Error evaluating the criteria formula,ข้อผิดพลาดในการประเมินสูตรเกณฑ์,
Error in formula or condition: {0},ข้อผิดพลาดในสูตรหรือเงื่อนไข: {0},
Error while processing deferred accounting for {0},เกิดข้อผิดพลาดขณะประมวลผลการบัญชีที่ถูกเลื่อนออกไปสำหรับ {0},
Error: Not a valid id?,ข้อผิดพลาด: ไม่ได้รหัสที่ถูกต้อง?,
Estimated Cost,ค่าใช้จ่ายประมาณ,
Evaluation,การประเมินผล,
"Even if there are multiple Pricing Rules with highest priority, then following internal priorities are applied:",แม้ว่าจะมีกฎการกำหนดราคาหลายกับความสำคัญสูงสุดแล้วจัดลำดับความสำคัญดังต่อไปนี้ภายในจะใช้:,
Event Location,สถานที่จัดงาน,
Event Name,ชื่องาน,
Exchange Gain/Loss,กำไรจากอัตราแลกเปลี่ยน / ขาดทุน,
Exchange Rate Revaluation master.,หลักการประเมินค่าอัตราแลกเปลี่ยน,
Exchange Rate must be same as {0} {1} ({2}),อัตราแลกเปลี่ยนจะต้องเป็นเช่นเดียวกับ {0} {1} ({2}),
Excise Invoice,สรรพสามิตใบแจ้งหนี้,
Execution,การปฏิบัติ,
Executive Search,การค้นหา ผู้บริหาร,
Expand All,ขยายทั้งหมด,
Expected Delivery Date,คาดว่าวันที่ส่ง,
Expected Delivery Date should be after Sales Order Date,วันที่จัดส่งที่คาดว่าจะเป็นหลังจากวันที่ใบสั่งขาย,
Expected End Date,คาดว่าวันที่สิ้นสุด,
Expected Hrs,เวลาที่คาดว่าจะได้,
Expected Start Date,วันที่เริ่มต้นคาดว่า,
Expense,ค่าใช้จ่าย,
Expense / Difference account ({0}) must be a 'Profit or Loss' account,ค่าใช้จ่ายบัญชี / แตกต่าง ({0}) จะต้องเป็นบัญชี 'กำไรหรือขาดทุน',
Expense Account,บัญชีค่าใช้จ่าย,
Expense Claim,เรียกร้องค่าใช้จ่าย,
Expense Claim for Vehicle Log {0},การเรียกร้องค่าใช้จ่ายสำหรับยานพาหนะเข้าสู่ระบบ {0},
Expense Claim {0} already exists for the Vehicle Log,ค่าใช้จ่ายในการเรียกร้อง {0} อยู่แล้วสำหรับการเข้าสู่ระบบยานพาหนะ,
Expense Claims,ค่าใช้จ่ายในการเรียกร้อง,
Expense account is mandatory for item {0},บัญชีค่าใช้จ่าย ที่จำเป็น สำหรับรายการที่ {0},
Expense or Difference account is mandatory for Item {0} as it impacts overall stock value,ค่าใช้จ่าย หรือ ความแตกต่าง บัญชี มีผลบังคับใช้ กับ รายการ {0} ที่มัน มีผลกระทบต่อ มูลค่า หุ้น โดยรวม,
Expenses,รายจ่าย,
Expenses Included In Asset Valuation,รวมค่าใช้จ่ายในการประเมินมูลค่าทรัพย์สิน,
Expenses Included In Valuation,ค่าใช้จ่ายรวมอยู่ในการประเมินมูลค่า,
Expired Batches,ชุดที่หมดอายุแล้ว,
Expires On,หมดอายุเมื่อวันที่,
Expiring On,หมดอายุเมื่อ,
Expiry (In Days),หมดอายุ (ในวัน),
Explore,สำรวจ,
Export E-Invoices,ส่งออกใบแจ้งหนี้อิเล็กทรอนิกส์,
Extra Large,ขนาดใหญ่พิเศษ,
Extra Small,ขนาดเล็กเป็นพิเศษ,
Failed,ล้มเหลว,
Failed to create website,ไม่สามารถสร้างเว็บไซต์,
Failed to install presets,ไม่สามารถติดตั้งค่าที่ตั้งล่วงหน้า,
Failed to login,ไม่สามารถเข้าสู่ระบบได้,
Failed to setup company,ไม่สามารถตั้งค่า บริษัท,
Failed to setup defaults,การตั้งค่าเริ่มต้นล้มเหลว,
Failed to setup post company fixtures,ไม่สามารถติดตั้งการติดตั้ง บริษัท โพสต์ได้,
Fee,ค่าธรรมเนียม,
Fee Created,สร้างค่าธรรมเนียมแล้ว,
Fee Creation Failed,การสร้างค่าธรรมเนียมล้มเหลว,
Fee Creation Pending,การสร้างค่าธรรมเนียมที่รอดำเนินการ,
Fee Records Created - {0},ค่าธรรมเนียมระเบียนที่สร้าง - {0},
Feedback,ข้อเสนอแนะ,
Fees,ค่าธรรมเนียม,
Fetch Data,ดึงข้อมูล,
Fetch Subscription Updates,เรียกข้อมูลอัปเดตการสมัครสมาชิก,
Fetch exploded BOM (including sub-assemblies),เรียก BOM ระเบิด (รวมถึงการ ประกอบย่อย ),
Fetching records......,กำลังดึงบันทึก ......,
Fill the form and save it,กรอกแบบฟอร์ม และบันทึกไว้,
Filter Employees By (Optional),กรองพนักงานโดย (ไม่จำเป็น),
"Filter Fields Row #{0}: Fieldname <b>{1}</b> must be of type ""Link"" or ""Table MultiSelect""",ฟิลด์ตัวกรองแถว # {0}: ชื่อฟิลด์ <b>{1}</b> ต้องเป็นประเภท &quot;Link&quot; หรือ &quot;Table MultiSelect&quot;,
Filter Total Zero Qty,กรองจำนวนรวมศูนย์,
Finance Book,หนังสือการเงิน,
Financial / accounting year.,การเงิน รอบปีบัญชี /,
Financial Services,บริการทางการเงิน,
Financial Statements,งบการเงิน,
Financial Year,ปีการเงิน,
Finish,เสร็จสิ้น,
Finished Good,เสร็จเรียบร้อยแล้ว,
Finished Good Item Code,รหัสรายการสินค้าสำเร็จรูปที่ดี,
Finished Goods,สินค้า สำเร็จรูป,
Finished Item {0} must be entered for Manufacture type entry,เสร็จสิ้นรายการ {0} ต้องป้อนสำหรับรายการประเภทการผลิต,
Finished product quantity <b>{0}</b> and For Quantity <b>{1}</b> cannot be different,ปริมาณผลิตภัณฑ์สำเร็จรูป <b>{0}</b> และสำหรับปริมาณ <b>{1}</b> ไม่ต่างกัน,
"Fiscal Regime is mandatory, kindly set the fiscal regime in the company {0}",จำเป็นต้องมีระบอบการปกครองการคลังกรุณาตั้งค่าระบอบการปกครองใน บริษัท {0},
Fiscal Year,ปีงบประมาณ,
Fiscal Year End Date should be one year after Fiscal Year Start Date,วันที่สิ้นสุดปีบัญชีควรเป็นหนึ่งปีหลังจากวันที่เริ่มต้นปีบัญชี,
Fiscal Year Start Date and Fiscal Year End Date are already set in Fiscal Year {0},วันเริ่มต้นปีงบประมาณและปีงบประมาณสิ้นสุดวันที่มีการตั้งค่าอยู่แล้วในปีงบประมาณ {0},
Fiscal Year Start Date should be one year earlier than Fiscal Year End Date,วันที่เริ่มต้นปีบัญชีควรเป็นหนึ่งปีก่อนวันที่สิ้นสุดปีบัญชี,
Fiscal Year {0} does not exist,ปีงบประมาณ {0} ไม่อยู่,
Fiscal Year {0} is required,ปีงบประมาณ {0} จะต้อง,
Fiscal Year {0} not found,ปีงบประมาณ {0} ไม่พบ,
Fiscal Year: {0} does not exists,ปีงบประมาณ: {0} ไม่อยู่,
Fixed Asset,สินทรัพย์ คงที่,
Fixed Asset Item must be a non-stock item.,รายการสินทรัพย์ถาวรจะต้องเป็นรายการที่ไม่สต็อก,
Fixed Assets,สินทรัพย์ถาวร,
Following Material Requests have been raised automatically based on Item's re-order level,ต่อไปนี้ขอวัสดุได้รับการยกโดยอัตโนมัติตามระดับสั่งซื้อใหม่ของรายการ,
Following accounts might be selected in GST Settings:,สามารถเลือกบัญชีต่อไปนี้ในการตั้งค่า GST:,
Following course schedules were created,สร้างตารางเวลาหลักสูตรขึ้นแล้ว,
Following item {0} is not marked as {1} item. You can enable them as {1} item from its Item master,รายการต่อไปนี้ {0} ไม่ได้ทำเครื่องหมายเป็น {1} รายการ คุณสามารถเปิดใช้งานรายการเป็น {1} รายการจากต้นแบบรายการ,
Following items {0} are not marked as {1} item. You can enable them as {1} item from its Item master,รายการต่อไปนี้ {0} ไม่ได้ทำเครื่องหมายเป็น {1} รายการ คุณสามารถเปิดใช้งานรายการเป็น {1} รายการจากต้นแบบรายการ,
Food,อาหาร,
"Food, Beverage & Tobacco","อาหาร, เครื่องดื่ม และ ยาสูบ",
For,สำหรับ,
"For 'Product Bundle' items, Warehouse, Serial No and Batch No will be considered from the 'Packing List' table. If Warehouse and Batch No are same for all packing items for any 'Product Bundle' item, those values can be entered in the main Item table, values will be copied to 'Packing List' table.","สำหรับรายการ &#39;Bundle สินค้า, คลังสินค้า, ไม่มี Serial และรุ่นที่จะไม่ได้รับการพิจารณาจาก&#39; บรรจุรายชื่อ &#39;ตาราง ถ้าคลังสินค้าและรุ่นที่ไม่มีเหมือนกันสำหรับรายการที่บรรจุทั้งหมดรายการใด ๆ &#39;Bundle สินค้า&#39; ค่าเหล่านั้นสามารถป้อนในตารางรายการหลักค่าจะถูกคัดลอกไปบรรจุรายชื่อ &#39;ตาราง",
For Employee,สำหรับพนักงาน,
For Quantity (Manufactured Qty) is mandatory,สำหรับปริมาณ (ผลิตจำนวน) มีผลบังคับใช้,
For Supplier,สำหรับ ผู้ผลิต,
For Warehouse,สำหรับโกดัง,
For Warehouse is required before Submit,สำหรับ คลังสินค้า จะต้อง ก่อนที่จะ ส่ง,
"For an item {0}, quantity must be negative number",สำหรับรายการ {0} จำนวนต้องเป็นจำนวนลบ,
"For an item {0}, quantity must be positive number",สำหรับรายการ {0} จำนวนต้องเป็นจำนวนบวก,
"For job card {0}, you can only make the 'Material Transfer for Manufacture' type stock entry",สำหรับบัตรงาน {0} คุณสามารถป้อนรายการสต็อคประเภท &#39;การโอนวัสดุเพื่อการผลิต&#39; ได้เท่านั้น,
"For row {0} in {1}. To include {2} in Item rate, rows {3} must also be included",แถว {0} ใน {1} ที่จะรวม {2} ในอัตรารายการแถว {3} จะต้องรวม,
For row {0}: Enter Planned Qty,สำหรับแถว {0}: ป้อนจำนวนที่วางแผนไว้,
"For {0}, only credit accounts can be linked against another debit entry",มีบัญชีประเภทเครดิตเท่านั้น ที่สามารถเชื่อมโยงกับรายการประเภทเดบิต สำหรับ {0},
"For {0}, only debit accounts can be linked against another credit entry",มีบัญชีประเภทเดบิตเท่านั้น ที่สามารถเชื่อมโยงกับรายการประเภทเครดิต สำหรับ {0},
Form View,มุมมองแบบฟอร์ม,
Forum Activity,กิจกรรมฟอรั่ม,
Free item code is not selected,ไม่ได้เลือกรหัสรายการฟรี,
Freight and Forwarding Charges,การขนส่งสินค้าและ การส่งต่อ ค่าใช้จ่าย,
Friday,วันศุกร์,
From,จาก,
From Address 1,จากที่อยู่ 1,
From Address 2,จากที่อยู่ 2,
From Currency and To Currency cannot be same,สกุลเงินจากสกุลเงินและไม่สามารถเดียวกัน,
From Date and To Date lie in different Fiscal Year,จากวันที่และวันที่อยู่ในปีงบประมาณที่แตกต่างกัน,
From Date cannot be greater than To Date,จากวันที่ไม่สามารถจะมากกว่านัด,
From Date must be before To Date,นับ แต่วันที่ต้องอยู่ก่อนวันที่ต้องการ,
From Date should be within the Fiscal Year. Assuming From Date = {0},จากวันที่ควรจะเป็นภายในปีงบประมาณ สมมติว่าตั้งแต่วันที่ = {0},
From Date {0} cannot be after employee's relieving Date {1},จากวันที่ {0} ไม่สามารถเป็นได้หลังจากที่พนักงานลบวันที่ {1},
From Date {0} cannot be before employee's joining Date {1},จากวันที่ {0} ต้องไม่ใช่วันที่พนักงานเข้าร่วมวันที่ {1},
From Datetime,จาก Datetime,
From Delivery Note,จากหมายเหตุการจัดส่งสินค้า,
From Fiscal Year,จากปีงบประมาณ,
From GSTIN,จาก GSTIN,
From Party Name,จากชื่อปาร์ตี้,
From Pin Code,จากรหัสพิน,
From Place,จากสถานที่,
From Range has to be less than To Range,จากช่วงจะต้องมีน้อยกว่าในช่วง,
From State,จากรัฐ,
From Time,ตั้งแต่เวลา,
From Time Should Be Less Than To Time,จากเวลาควรน้อยกว่าเวลา,
From Time cannot be greater than To Time.,จากเวลาที่ไม่สามารถมีค่ามากกว่าการเวลา,
"From a supplier under composition scheme, Exempt and Nil rated",จากซัพพลายเออร์ภายใต้รูปแบบการจัดองค์ประกอบการยกเว้นและไม่มีการจัดอันดับ,
From and To dates required,จากและถึง วันที่คุณต้องการ,
From date can not be less than employee's joining date,ตั้งแต่วันที่ไม่น้อยกว่าวันที่เข้าร่วมของพนักงาน,
From value must be less than to value in row {0},จากค่า ต้องน้อยกว่า ค่า ในแถว {0},
From {0} | {1} {2},จาก {0} | {1} {2},
Fuel Price,ราคาน้ำมัน,
Fuel Qty,น้ำมันเชื้อเพลิงจำนวน,
Fulfillment,การบรรลุเป้าหมาย,
Full Name,ชื่อเต็ม,
Full-time,เต็มเวลา,
Fully Depreciated,ค่าเสื่อมราคาหมด,
Furnitures and Fixtures,เฟอร์นิเจอร์และติดตั้ง,
"Further accounts can be made under Groups, but entries can be made against non-Groups",บัญชีเพิ่มเติมสามารถทำภายใต้กลุ่ม แต่รายการที่สามารถทำกับกลุ่มที่ไม่,
Further cost centers can be made under Groups but entries can be made against non-Groups,ศูนย์ต้นทุนเพิ่มเติมสามารถทำภายใต้กลุ่ม แต่รายการที่สามารถทำกับกลุ่มที่ไม่,
Further nodes can be only created under 'Group' type nodes,โหนด เพิ่มเติมสามารถ ถูกสร้างขึ้น ภายใต้ โหนด ' กลุ่ม ประเภท,
Future dates not allowed,วันที่ในอนาคตไม่ได้รับอนุญาต,
GSTIN,GSTIN,
GSTR3B-Form,GSTR3B แบบฟอร์ม,
Gain/Loss on Asset Disposal,กำไร / ขาดทุนจากการขายสินทรัพย์,
Gantt Chart,แผนภูมิแกนต์,
Gantt chart of all tasks.,แผนภูมิแกรนต์ของงานทั้งหมด,
Gender,เพศ,
General,ทั่วไป,
General Ledger,บัญชีแยกประเภท,
Generate Material Requests (MRP) and Work Orders.,สร้างคำขอ Material (MRP) และใบสั่งงาน,
Generate Secret,สร้างความลับ,
Get Details From Declaration,รับรายละเอียดจากประกาศ,
Get Employees,รับพนักงาน,
Get Invocies,รับ Invocies,
Get Invoices,รับใบแจ้งหนี้,
Get Invoices based on Filters,รับใบแจ้งหนี้ตามตัวกรอง,
Get Items from BOM,รับสินค้า จาก BOM,
Get Items from Healthcare Services,รับสินค้าจากบริการด้านสุขภาพ,
Get Items from Prescriptions,รับสินค้าจากการกําหนด,
Get Items from Product Bundle,รับรายการจาก Bundle สินค้า,
Get Suppliers,รับซัพพลายเออร์,
Get Suppliers By,รับซัพพลายเออร์โดย,
Get Updates,ได้รับการปรับปรุง,
Get customers from,รับลูกค้าจาก,
Get from Patient Encounter,ได้รับจากผู้ป่วย Encounter,
Getting Started,เริ่มต้นใช้งาน,
Global settings for all manufacturing processes.,การตั้งค่าโดยรวม สำหรับกระบวนการผลิตทั้งหมด,
Go to the Desktop and start using ERPNext,ไปยัง Desktop และเริ่มต้นใช้ ERPNext,
GoCardless SEPA Mandate,mandate SEPA GoCardless,
GoCardless payment gateway settings,การตั้งค่าเกตเวย์การชำระเงิน GoCardless,
Goal and Procedure,เป้าหมายและขั้นตอน,
Goals cannot be empty,เป้าหมายต้องไม่ว่างเปล่า,
Goods In Transit,สินค้าระหว่างทาง,
Goods Transferred,โอนสินค้าแล้ว,
Goods and Services Tax (GST India),ภาษีสินค้าและบริการ (GST India),
Goods are already received against the outward entry {0},รับสินค้ากับรายการภายนอกแล้ว {0},
Government,รัฐบาล,
Grand Total,รวมทั้งสิ้น,
Grant,แกรนท์,
Grant Application,ขอทุน,
Grant Leaves,Grant Leaves,
Grant information.,ให้ข้อมูล,
Grocery,ร้านขายของชำ,
Gross Pay,จ่ายขั้นต้น,
Gross Profit,กำไรขั้นต้น,
Gross Profit %,% กำไรขั้นต้น,
Gross Profit / Loss,กำไร/ขาดทุน ขั้นต้น,
Gross Purchase Amount,จำนวนการสั่งซื้อขั้นต้น,
Gross Purchase Amount is mandatory,จำนวนการสั่งซื้อขั้นต้นมีผลบังคับใช้,
Group by Account,จัดกลุ่มตามบัญชี,
Group by Party,จัดกลุ่มตามปาร์ตี้,
Group by Voucher,จัดกลุ่มตาม Voucher,
Group by Voucher (Consolidated),จัดกลุ่มตามคูปอง (รวม),
Group node warehouse is not allowed to select for transactions,คลังสินค้าโหนดกลุ่มไม่ได้รับอนุญาตให้เลือกสำหรับการทำธุรกรรม,
Group to Non-Group,กลุ่มที่ไม่ใช่กลุ่ม,
Group your students in batches,กลุ่มนักเรียนของคุณใน batches,
Groups,กลุ่ม,
Guardian1 Email ID,รหัสอีเมล Guardian1,
Guardian1 Mobile No,Guardian1 มือถือไม่มี,
Guardian1 Name,ชื่อ Guardian1,
Guardian2 Email ID,รหัสอีเมล Guardian2,
Guardian2 Mobile No,Guardian2 มือถือไม่มี,
Guardian2 Name,ชื่อ Guardian2,
HR Manager,HR Manager,
HSN,HSN,
HSN/SAC,HSN / SAC,
Half Day Date is mandatory,Half Day Date เป็นข้อบังคับ,
Half Day Date should be between From Date and To Date,ครึ่งวันวันควรอยู่ระหว่างนับจากวันและวันที่,
Half Day Date should be in between Work From Date and Work End Date,Half Day Date ควรอยู่ระหว่าง Work From Date กับ Work End Date,
Half day date should be in between from date and to date,วันที่ครึ่งวันควรอยู่ระหว่างตั้งแต่วันที่จนถึงวันที่,
Half-Yearly,รายหกเดือน,
Hardware,ฮาร์ดแวร์,
Head of Marketing and Sales,หัวหน้าฝ่ายการตลาด และการขาย,
Health Care,การดูแลสุขภาพ,
Healthcare,ดูแลสุขภาพ,
Healthcare (beta),สุขภาพ (เบต้า),
Healthcare Practitioner,ผู้ประกอบการด้านสุขภาพ,
Healthcare Practitioner not available on {0},ผู้ประกอบการด้านการดูแลสุขภาพไม่มีให้บริการใน {0},
Healthcare Practitioner {0} not available on {1},ผู้ประกอบการด้านการรักษาพยาบาล {0} ไม่มีให้บริการใน {1},
Healthcare Service Unit,หน่วยบริการด้านการดูแลสุขภาพ,
Healthcare Service Unit Tree,โครงสร้างหน่วยบริการด้านการดูแลสุขภาพ,
Healthcare Service Unit Type,ประเภทหน่วยบริการสุขภาพ,
Healthcare Services,บริการสุขภาพ,
Healthcare Settings,การตั้งค่าการดูแลสุขภาพ,
Hello,สวัสดี,
Help Results for,ผลลัพธ์ความช่วยเหลือสำหรับ,
High,สูง,
High Sensitivity,ความไวแสงสูง,
Hold,ถือ,
Hold Invoice,ระงับใบแจ้งหนี้,
Holiday,วันหยุด,
