 (Half Day),(ครึ่งวัน)
 .You can not assign / modify / remove Master Name,
 Quantity should be greater than 0.,
 after this transaction.,
 against cost center ,
 against sales order,กับคำสั่งขาย
 against same operation,กับการดำเนินงานเดียวกัน
 already marked,ทำเครื่องหมายแล้ว
 and fiscal year : ,
 and year: ,และปี:
 as it is stock Item or packing item,มันเป็นรายการหุ้นหรือรายการบรรจุ
 at warehouse: ,ที่คลังสินค้า:
 budget ,
 can not be created/modified against stopped Sales Order ,
 can not be deleted,
 can not be made.,ไม่สามารถทำ
 can not be received twice,
 can only be debited/credited through Stock transactions,
 created,
 does not belong to ,
 does not belong to Warehouse,
 does not belong to the company,ไม่ได้เป็นของ บริษัท ฯ
 does not exists,
 for account ,
 has been freezed. ,ได้รับการ freezed
 is a frozen account. Either make the account active or assign role in Accounts Settings who can create / modify entries against this account,
" is a frozen account. To create / edit transactions against this account, you need role",
" is less than equals to zero in the system, valuation rate is mandatory for this item",
 is mandatory,มีผลบังคับใช้
 is mandatory for GL Entry,มีผลบังคับใช้สำหรับรายการ GL
 is not a ledger,ไม่ได้เป็นบัญ​​ชีแยกประเภท
 is not active,ไม่ได้ใช้งาน
 is not submitted document,
" is now the default Fiscal Year. \
			Please refresh your browser for the change to take effect.",
 not active or does not exists in the system,ใช้งานไม่ได้หรือไม่ได้อยู่ในระบบ
 or the BOM is cancelled or inactive,หรือ BOM ถูกยกเลิกหรือไม่ได้ใช้งาน
 should be same as that in ,ควรจะเป็นเช่นเดียวกับที่อยู่ใน
 was on leave on ,ได้พักเมื่อ
 will be ,จะ
 will be created,
 will be over-billed against mentioned ,จะถูกกว่าเรียกเก็บเงินกับที่กล่าวถึง
 will become ,จะกลายเป็น
 will exceed by ,
""" does not exists","""ไม่ได้ มีอยู่"
# ###.##,
"#,###",
"#,###.##",
"#,###.###",
"#,##,###.##",
#.###,
"#.###,##",
%  Delivered,ส่ง%
% Amount Billed,จำนวนเงิน% จำนวน
% Billed,จำนวน%
% Completed,% เสร็จสมบูรณ์
% Delivered,% ส่ง
% Installed,% Installed
% Received,ได้รับ%
% of materials billed against this Purchase Order.,% ของวัสดุที่เรียกเก็บเงินกับการสั่งซื้อนี้
% of materials billed against this Sales Order,% ของวัสดุที่เรียกเก็บเงินกับการสั่งซื้อนี้ขาย
% of materials delivered against this Delivery Note,% ของวัสดุที่ส่งกับส่งหมายเหตุนี้
% of materials delivered against this Sales Order,% ของวัสดุที่ส่งต่อนี้สั่งซื้อขาย
% of materials ordered against this Material Request,% ของวัสดุสั่งกับวัสดุนี้ขอ
% of materials received against this Purchase Order,% ของวัสดุที่ได้รับกับการสั่งซื้อนี้
%(conversion_rate_label)s is mandatory. Maybe Currency Exchange record is not created for %(from_currency)s to %(to_currency)s,% ( conversion_rate_label ) s มีผลบังคับใช้ อาจจะ บันทึก แลกเปลี่ยนเงินตรา ไม่ได้ สร้างขึ้นสำหรับ % ( from_currency ) เพื่อ % ( to_currency ) s
' in Company: ,ใน บริษัท :
'To Case No.' cannot be less than 'From Case No.',&#39;to คดีหมายเลข&#39; ไม่สามารถจะน้อยกว่า &#39;จากคดีหมายเลข&#39;
"(Paid amount + Write Off Amount) can not be \
				greater than Grand Total",
(Total) Net Weight value. Make sure that Net Weight of each item is,( รวม ) ค่า น้ำหนักสุทธิ ให้แน่ใจว่า น้ำหนักสุทธิ ของแต่ละรายการ เป็น
* Will be calculated in the transaction.,* จะได้รับการคำนวณในการทำธุรกรรม
"**Budget Distribution** helps you distribute your budget across months if you have seasonality in your business.

To distribute a budget using this distribution, set this **Budget Distribution** in the **Cost Center**",
**Currency** Master,สกุลเงิน ** ** โท
**Fiscal Year** represents a Financial Year. All accounting entries and other major transactions are tracked against **Fiscal Year**.,** ** ปีงบประมาณแสดงรอบปีบัญชี ทุกรายการบัญชีและการทำธุรกรรมที่สำคัญอื่น ๆ จะมีการติดตามกับปีงบประมาณ ** **
". Outstanding cannot be less than zero. \
			 	Please match exact outstanding.",
. Please set status of the employee as 'Left',. กรุณาตั้งสถานะของพนักงานเป็น &#39;ซ้าย&#39;
. You can not mark his attendance as 'Present',. คุณไม่สามารถทำเครื่องหมายร่วมของเขาในฐานะ &#39;ปัจจุบัน&#39;
01,01
02,02
03,03
04,04
05,05
06,06
07,07
08,08
09,09
"1 Currency = [?] Fraction
For e.g. 1 USD = 100 Cent",
1. To maintain the customer wise item code and to make them searchable based on their code use this option,1 เพื่อรักษารหัสรายการลูกค้าที่ฉลาดและจะทำให้พวกเขาค้นหาตามรหัสของพวกเขาใช้ตัวเลือกนี้
10,10
11,11
12,12
2,2
3,3
4,4
5,5
6,6
: Duplicate row from same ,: ซ้ำแถวจากเดียวกัน
: It is linked to other active BOM(s),: มันจะเชื่อมโยงกับ BOM ใช้งานอื่น ๆ (s)
: Mandatory for a Recurring Invoice.,: บังคับสำหรับใบแจ้งหนี้ที่เกิดขึ้นประจำ
"<a href=""#Sales Browser/Customer Group"">Add / Edit</a>","<a href=""#Sales Browser/Customer Group""> เพิ่ม / แก้ไข </ a>"
"<a href=""#Sales Browser/Item Group"">Add / Edit</a>","<a href=""#Sales Browser/Item Group""> เพิ่ม / แก้ไข </ a>"
"<a href=""#Sales Browser/Territory"">Add / Edit</a>","<a href=""#Sales Browser/Territory""> เพิ่ม / แก้ไข </ a>"
"<a href=""https://en.wikipedia.org/wiki/Transport_Layer_Security"" target=""_blank"">[?]</a>","<a href=""https://en.wikipedia.org/wiki/Transport_Layer_Security"" target=""_blank""> [?] </ a>"
A Customer exists with same name,ลูกค้าที่มีอยู่ที่มีชื่อเดียวกัน
A Lead with this email id should exist,ตะกั่วที่มี id อีเมลนี้ควรมีอยู่
"A Product or a Service that is bought, sold or kept in stock.",สินค้าหรือบริการที่มีการซื้อขายหรือเก็บไว้ในสต็อก
A Supplier exists with same name,ผู้ผลิตที่มีอยู่ที่มีชื่อเดียวกัน
A condition for a Shipping Rule,เงื่อนไขในการกฎการจัดส่งสินค้า
A logical Warehouse against which stock entries are made.,คลังสินค้าตรรกะกับที่รายการสต็อกจะทำ
A symbol for this currency. For e.g. $,สัญลักษณ์สกุลเงินนี้ สำหรับเช่น $
A third party distributor / dealer / commission agent / affiliate / reseller who sells the companies products for a commission.,ตัวแทนจำหน่ายของบุคคลที่สามตัวแทนจำหน่าย / / คณะกรรมการพันธมิตร / / ผู้ค้าปลีกที่ขายผลิตภัณฑ์ของ บริษัท ให้คณะกรรมาธิการ
A+,+
A-,-
AB+,AB +
AB-,AB-
AMC Expiry Date,วันที่หมดอายุ AMC
AMC expiry date and maintenance status mismatched,วันหมดอายุ AMC และสถานะของ การบำรุงรักษา ที่ไม่ตรงกัน
ATT,ATT
Abbr,abbr
About ERPNext,เกี่ยวกับ ERPNext
Above Value,สูงกว่าค่า
Absent,ไม่อยู่
Acceptance Criteria,เกณฑ์การยอมรับ
Accepted,ได้รับการยอมรับ
Accepted Quantity,จำนวนที่ยอมรับ
Accepted Warehouse,คลังสินค้าได้รับการยอมรับ
Account,บัญชี
Account ,
Account Balance,ยอดเงินในบัญชี
Account Details,รายละเอียดบัญชี
Account Head,หัวหน้าบัญชี
Account Name,ชื่อบัญชี
Account Type,ประเภทบัญชี
Account expires on,บัญชี หมดอายุใน
Account for the warehouse (Perpetual Inventory) will be created under this Account.,บัญชีสำหรับ คลังสินค้า( Inventory ตลอด ) จะถูก สร้างขึ้นภายใต้ บัญชี นี้
Account for this ,บัญชีนี้
Accounting,การบัญชี
Accounting Entries are not allowed against groups.,รายการ บัญชี ไม่ได้รับอนุญาต กับ กลุ่ม
"Accounting Entries can be made against leaf nodes, called",รายการ บัญชี สามารถ ทำกับ โหนดใบ ที่เรียกว่า
Accounting Year.,ปีบัญชี
"Accounting entry frozen up to this date, nobody can do / modify entry except role specified below.",รายการบัญชีแช่แข็งถึงวันนี้ไม่มีใครสามารถทำ / แก้ไขรายการยกเว้นบทบาทที่ระบุไว้ด้านล่าง
Accounting journal entries.,รายการบัญชีวารสาร
Accounts,บัญชี
Accounts Frozen Upto,บัญชี Frozen เกิน
Accounts Payable,บัญชีเจ้าหนี้
Accounts Receivable,ลูกหนี้
Accounts Settings,การตั้งค่าบัญชี
Action,การกระทำ
Active,คล่องแคล่ว
Active: Will extract emails from ,ใช้งานล่าสุด: จะดึงอีเมลจาก
Activity,กิจกรรม
Activity Log,เข้าสู่ระบบกิจกรรม
Activity Log:,เข้าสู่ระบบ กิจกรรม:
Activity Type,ประเภทกิจกรรม
Actual,ตามความเป็นจริง
Actual Budget,งบประมาณที่เกิดขึ้นจริง
Actual Completion Date,วันที่เสร็จสมบูรณ์จริง
Actual Date,วันที่เกิดขึ้นจริง
Actual End Date,วันที่สิ้นสุดจริง
Actual Invoice Date,วันที่ใบแจ้งหนี้ที่เกิดขึ้นจริง
Actual Posting Date,วันที่โพสต์กระทู้ที่เกิดขึ้นจริง
Actual Qty,จำนวนที่เกิดขึ้นจริง
Actual Qty (at source/target),จำนวนที่เกิดขึ้นจริง (ที่มา / เป้าหมาย)
Actual Qty After Transaction,จำนวนที่เกิดขึ้นจริงหลังทำรายการ
Actual Qty: Quantity available in the warehouse.,ที่เกิดขึ้นจริง จำนวน: จำนวน ที่มีอยู่ใน คลังสินค้า
Actual Quantity,จำนวนที่เกิดขึ้นจริง
Actual Start Date,วันที่เริ่มต้นจริง
Add,เพิ่ม
Add / Edit Taxes and Charges,เพิ่ม / แก้ไขภาษีและค่าธรรมเนียม
Add Child,เพิ่ม เด็ก
Add Serial No,เพิ่ม หมายเลขเครื่อง
Add Taxes,เพิ่ม ภาษี
Add Taxes and Charges,เพิ่ม ภาษี และ ค่าใช้จ่าย
Add or Deduct,เพิ่มหรือหัก
Add rows to set annual budgets on Accounts.,เพิ่มแถวตั้งงบประมาณประจำปีเกี่ยวกับบัญชี
Add to calendar on this date,เพิ่ม ปฏิทิน ในวัน นี้
Add/Remove Recipients,Add / Remove ผู้รับ
Additional Info,ข้อมูลเพิ่มเติม
Address,ที่อยู่
Address & Contact,ที่อยู่และติดต่อ
Address & Contacts,ที่อยู่ติดต่อ &amp;
Address Desc,ที่อยู่รายละเอียด
Address Details,รายละเอียดที่อยู่
Address HTML,ที่อยู่ HTML
Address Line 1,ที่อยู่บรรทัดที่ 1
Address Line 2,ที่อยู่บรรทัดที่ 2
Address Title,หัวข้อที่อยู่
Address Type,ประเภทของที่อยู่
Advance Amount,จำนวนล่วงหน้า
Advance amount,จำนวนเงิน
Advances,ความก้าวหน้า
Advertisement,การโฆษณา
After Sale Installations,หลังจากการติดตั้งขาย
Against,กับ
Against Account,กับบัญชี
Against Docname,กับ Docname
Against Doctype,กับ Doctype
Against Document Detail No,กับรายละเอียดเอกสารไม่มี
Against Document No,กับเอกสารไม่มี
Against Expense Account,กับบัญชีค่าใช้จ่าย
Against Income Account,กับบัญชีรายได้
Against Journal Voucher,กับบัตรกำนัลวารสาร
Against Purchase Invoice,กับใบกำกับซื้อ
Against Sales Invoice,กับขายใบแจ้งหนี้
Against Sales Order,กับ การขายสินค้า
Against Voucher,กับบัตรกำนัล
Against Voucher Type,กับประเภทบัตร
Ageing Based On,เอจจิ้ง อยู่ ที่
Agent,ตัวแทน
"Aggregate group of **Items** into another **Item**. This is useful if you are bundling a certain **Items** into a package and you maintain stock of the packed **Items** and not the aggregate **Item**. 

The package **Item** will have ""Is Stock Item"" as ""No"" and ""Is Sales Item"" as ""Yes"".

For Example: If you are selling Laptops and Backpacks separately and have a special price if the customer buys both, then the Laptop + Backpack will be a new Sales BOM Item.

Note: BOM = Bill of Materials",
Aging Date,Aging วันที่
All Addresses.,ที่อยู่ทั้งหมด
All Contact,ติดต่อทั้งหมด
All Contacts.,ติดต่อทั้งหมด
All Customer Contact,ติดต่อลูกค้าทั้งหมด
All Day,วันทั้งหมด
All Employee (Active),พนักงาน (Active) ทั้งหมด
All Lead (Open),ตะกั่ว (เปิด) ทั้งหมด
All Products or Services.,ผลิตภัณฑ์หรือบริการ
All Sales Partner Contact,ทั้งหมดติดต่อพันธมิตรการขาย
All Sales Person,คนขายทั้งหมด
All Sales Transactions can be tagged against multiple **Sales Persons** so that you can set and monitor targets.,ทั้งหมดธุรกรรมการขายสามารถติดแท็กกับหลายคน ** ขาย ** เพื่อให้คุณสามารถตั้งค่าและตรวจสอบเป้าหมาย
All Supplier Contact,ติดต่อผู้ผลิตทั้งหมด
All Supplier Types,ทุก ประเภท ของผู้ผลิต
"All export related fields like currency, conversion rate, export total, export grand total etc are available in <br>
Delivery Note, POS, Quotation, Sales Invoice, Sales Order etc.",
"All import related fields like currency, conversion rate, import total, import grand total etc are available in <br>
Purchase Receipt, Supplier Quotation, Purchase Invoice, Purchase Order etc.",
Allocate,จัดสรร
Allocate leaves for the year.,จัดสรรใบสำหรับปี
Allocated Amount,จำนวนที่จัดสรร
Allocated Budget,งบประมาณที่จัดสรร
Allocated amount,จำนวนที่จัดสรร
Allow Bill of Materials,อนุญาตให้ Bill of Materials
Allow Dropbox Access,ที่อนุญาตให้เข้าถึง Dropbox
Allow For Users,ให้ สำหรับผู้ใช้
Allow Google Drive Access,ที่อนุญาตให้เข้าถึงใน Google Drive
Allow Negative Balance,อนุญาตให้ยอดคงเหลือติดลบ
Allow Negative Stock,อนุญาตให้สต็อกเชิงลบ
Allow Production Order,อนุญาตให้สั่งซื้อการผลิต
Allow User,อนุญาตให้ผู้ใช้
Allow Users,อนุญาตให้ผู้ใช้งาน
Allow the following users to approve Leave Applications for block days.,อนุญาตให้ผู้ใช้ต่อไปเพื่อขออนุมัติการใช้งานออกวันบล็อก
Allow user to edit Price List Rate in transactions,ช่วยให้ผู้ใช้ในการแก้ไขอัตราราคาปกติในการทำธุรกรรม
Allowance Percent,ร้อยละค่าเผื่อ
Allowed Role to Edit Entries Before Frozen Date,บทบาท ได้รับอนุญาตให้ แก้ไข คอมเมนต์ ก่อน วันที่ แช่แข็ง
Always use above Login Id as sender,มักจะใช้ รหัส เข้าสู่ระบบ ดังกล่าวข้างต้น เป็นผู้ส่ง
Amended From,แก้ไขเพิ่มเติม
Amount,จำนวน
Amount (Company Currency),จำนวนเงิน (สกุลเงิน บริษัท )
Amount <=,จำนวนเงินที่ &lt;=
Amount >=,จำนวนเงินที่&gt; =
Amount to Bill,เป็นจำนวนเงิน บิล
Analytics,Analytics
Another Period Closing Entry,อีก รายการ ปิด ระยะเวลา
Another Salary Structure '%s' is active for employee '%s'. Please make its status 'Inactive' to proceed.,โครงสร้าง เงินเดือน อีก '% s' มีการใช้งาน สำหรับพนักงาน '% s' กรุณา สถานะ ' ใช้งาน ' เพื่อ ดำเนินการต่อไป
"Any other comments, noteworthy effort that should go in the records.",ความเห็นอื่น ๆ ความพยายามที่น่าสังเกตว่าควรจะไปในบันทึก
Applicable Holiday List,รายการวันหยุดที่ใช้บังคับ
Applicable Territory,ดินแดน ที่ใช้บังคับ
Applicable To (Designation),ที่ใช้บังคับกับ (จุด)
Applicable To (Employee),ที่ใช้บังคับกับ (พนักงาน)
Applicable To (Role),ที่ใช้บังคับกับ (Role)
Applicable To (User),ที่ใช้บังคับกับ (User)
Applicant Name,ชื่อผู้ยื่นคำขอ
Applicant for a Job,ขอรับงาน
Applicant for a Job.,ผู้สมัครงาน
Applications for leave.,โปรแกรมประยุกต์สำหรับการลา
Applies to Company,นำไปใช้กับ บริษัท
Apply / Approve Leaves,ใช้ / อนุมัติใบ
Appraisal,การตีราคา
Appraisal Goal,เป้าหมายการประเมิน
Appraisal Goals,เป้าหมายการประเมิน
Appraisal Template,แม่แบบการประเมิน
Appraisal Template Goal,เป้าหมายเทมเพลทประเมิน
Appraisal Template Title,หัวข้อแม่แบบประเมิน
Approval Status,สถานะการอนุมัติ
Approved,ได้รับการอนุมัติ
Approver,อนุมัติ
Approving Role,อนุมัติบทบาท
Approving User,อนุมัติผู้ใช้
Are you sure you want to STOP ,
Are you sure you want to UNSTOP ,
Arrear Amount,จำนวน Arrear
"As Production Order can be made for this item, \
				it must be a stock item.",
As existing qty for item: ,เป็นจำนวนที่มีอยู่สำหรับรายการ:
As per Stock UOM,เป็นต่อสต็อก UOM
"As there are existing stock transactions for this item, you can not change the values of 'Has Serial No', 'Is Stock Item' and 'Valuation Method'","เนื่องจากมี การทำธุรกรรม หุ้น ที่มีอยู่ สำหรับรายการนี้ คุณจะไม่สามารถ เปลี่ยนค่า ของ 'มี ซีเรียล ไม่', ' เป็น รายการ สินค้า ' และ ' วิธี การประเมิน '"
Atleast one warehouse is mandatory,อย่างน้อยหนึ่งคลังสินค้ามีผลบังคับใช้
Attendance,การดูแลรักษา
Attendance Date,วันที่เข้าร่วม
Attendance Details,รายละเอียดการเข้าร่วมประชุม
Attendance From Date,ผู้เข้าร่วมจากวันที่
Attendance From Date and Attendance To Date is mandatory,เข้าร่วมประชุม จาก วันที่และ การเข้าร่วมประชุม เพื่อให้ มีผลบังคับใช้ วันที่
Attendance To Date,วันที่เข้าร่วมประชุมเพื่อ
Attendance can not be marked for future dates,ผู้เข้าร่วมไม่สามารถทำเครื่องหมายสำหรับวันที่ในอนาคต
Attendance for the employee: ,สำหรับพนักงานที่เข้าร่วม:
Attendance record.,บันทึกการเข้าร่วมประชุม
Authorization Control,ควบคุมการอนุมัติ
Authorization Rule,กฎการอนุญาต
Auto Accounting For Stock Settings,บัญชี อัตโนมัติ สำหรับ การตั้งค่า สต็อก
Auto Email Id,รหัสอีเมล์อัตโนมัติ
Auto Material Request,ขอวัสดุอัตโนมัติ
Auto-raise Material Request if quantity goes below re-order level in a warehouse,Auto-ยกคำขอถ้าปริมาณวัสดุไปต่ำกว่าระดับใหม่สั่งในคลังสินค้า
Automatically extract Job Applicants from a mail box ,
Automatically extract Leads from a mail box e.g.,สารสกัดจาก Leads โดยอัตโนมัติจาก กล่องจดหมายเช่นผู้
