Please share your feedback to the training by clicking on 'Training Feedback' and then 'New',โปรดแบ่งปันความคิดเห็นของคุณในการฝึกอบรมโดยคลิกที่ &#39;Training Feedback&#39; จากนั้นคลิก &#39;New&#39;,
Please specify Company,โปรดระบุ บริษัท,
Please specify Company to proceed,โปรดระบุ บริษัท ที่จะดำเนินการ,
Please specify a valid 'From Case No.',โปรดระบุที่ถูกต้อง &#39;จากคดีหมายเลข&#39;,
Please specify a valid Row ID for row {0} in table {1},โปรดระบุ ID แถวที่ถูกต้องสำหรับแถว {0} ในตาราง {1},
Please specify at least one attribute in the Attributes table,โปรดระบุอย่างน้อยหนึ่งแอตทริบิวต์ในตารางคุณสมบัติ,
Please specify currency in Company,โปรดระบุสกุลเงินใน บริษัท,
Please specify either Quantity or Valuation Rate or both,โปรดระบุ ทั้ง จำนวน หรือ อัตรา การประเมิน หรือทั้งสองอย่าง,
Please specify from/to range,โปรดระบุจาก / ไปยังช่วง,
Please supply the specified items at the best possible rates,กรุณาจัดหารายการที่ระบุในอัตราที่ดีที่สุด,
Please update your status for this training event,โปรดอัปเดตสถานะของคุณสำหรับกิจกรรมการฝึกอบรมนี้,
Please wait 3 days before resending the reminder.,โปรดรอ 3 วันก่อนส่งการแจ้งเตือนอีกครั้ง,
Point of Sale,จุดขาย,
Point-of-Sale,จุดขาย,
Point-of-Sale Profile,จุดขายข้อมูลส่วนตัว,
Portal,พอร์ทัล,
Possible Supplier,ผู้ผลิตที่เป็นไปได้,
Postal Expenses,ค่าใช้จ่าย ไปรษณีย์,
Posting Date,โพสต์วันที่,
Posting Date cannot be future date,โพสต์วันที่ไม่สามารถเป็นวันที่ในอนาคต,
Posting Time,โพสต์เวลา,
Posting date and posting time is mandatory,วันที่โพสต์และโพสต์เวลามีผลบังคับใช้,
Posting timestamp must be after {0},การโพสต์ จะต้องมี การประทับเวลา หลังจาก {0},
Potential opportunities for selling.,โอกาสที่มีศักยภาพสำหรับการขาย,
Practitioner Schedule,ตารางปฏิบัติของแพทย์,
Pre Sales,ขายก่อน,
Preference,การตั้งค่า,
Prescribed Procedures,ขั้นตอนที่กำหนดไว้,
Prescription,ใบสั่งยา,
Prescription Dosage,ปริมาณยาตามใบสั่งแพทย์,
Prescription Duration,ระยะเวลากําหนด,
Prescriptions,ใบสั่งยา,
Present,นำเสนอ,
Prev,ก่อนหน้า,
Preview Salary Slip,ดูตัวอย่างสลิปเงินเดือน,
Previous Financial Year is not closed,ปีก่อนหน้านี้ทางการเงินไม่ได้ปิด,
Price,ราคา,
Price List,บัญชีแจ้งราคาสินค้า,
Price List Currency not selected,สกุลเงิน ราคา ไม่ได้เลือก,
Price List Rate,อัตราราคาตามรายการ,
Price List master.,หลัก ราคาตามรายการ,
Price List must be applicable for Buying or Selling,รายการราคา จะต้องใช้ได้กับ การซื้อ หรือการขาย,
Price List not found or disabled,ราคาไม่พบหรือคนพิการ,
Price List {0} is disabled or does not exist,ราคา {0} เป็นคนพิการหรือไม่มีอยู่,
Price or product discount slabs are required,ต้องใช้แผ่นพื้นลดราคาหรือผลิตภัณฑ์,
Pricing,การตั้งราคา,
Pricing Rule,กฎ การกำหนดราคา,
"Pricing Rule is first selected based on 'Apply On' field, which can be Item, Item Group or Brand.",กฎข้อแรกคือการกำหนดราคาเลือกตาม 'สมัครในสนามซึ่งจะมีรายการกลุ่มสินค้าหรือยี่ห้อ,
"Pricing Rule is made to overwrite Price List / define discount percentage, based on some criteria.",กฎการกำหนดราคาจะทำเพื่อแทนที่ราคาตามรายการ / กำหนดเปอร์เซ็นต์ส่วนลดขึ้นอยู่กับเงื่อนไขบางอย่าง,
Pricing Rule {0} is updated,อัพเดตกฎการกำหนดราคา {0} แล้ว,
Pricing Rules are further filtered based on quantity.,กฎการกำหนดราคาจะถูกกรองต่อไปขึ้นอยู่กับปริมาณ,
Primary,ประถม,
Primary Address Details,รายละเอียดที่อยู่หลัก,
Primary Contact Details,รายละเอียดการติดต่อหลัก,
Principal Amount,เงินต้น,
Print IRS 1099 Forms,"พิมพ์ฟอร์ม IRS 1,099",
Print Report Card,พิมพ์บัตรรายงาน,
Print and Stationery,พิมพ์และเครื่องเขียน,
Print settings updated in respective print format,ตั้งค่าการพิมพ์การปรับปรุงในรูปแบบการพิมพ์ที่เกี่ยวข้อง,
Print taxes with zero amount,พิมพ์ภาษีที่มีจำนวนเป็นศูนย์,
Printing and Branding,การพิมพ์และ การสร้างแบรนด์,
Private Equity,ส่วนของภาคเอกชน,
Privilege Leave,สิทธิ ออก,
Probation,การทดลอง,
Probationary Period,ระยะเวลาการฝึกงาน,
Process Day Book Data,ประมวลผลข้อมูลสมุดรายวัน,
Process Master Data,ประมวลผลข้อมูลหลัก,
Processing Chart of Accounts and Parties,แผนภูมิการประมวลผลของบัญชีและภาคี,
Processing Items and UOMs,รายการประมวลผลและ UOM,
Processing Party Addresses,ที่อยู่ของบุคคลที่กำลังประมวลผล,
Processing Vouchers,กำลังประมวลผลบัตรกำนัล,
Procurement,จัดซื้อจัดจ้าง,
Produced Qty,จำนวนที่ผลิต,
Product,สินค้า,
Product Bundle,Bundle สินค้า,
Product Search,ค้นหาสินค้า,
Production,การผลิต,
Production Item,การผลิตสินค้า,
Products,ผลิตภัณฑ์,
Profit and Loss,กำไรและ ขาดทุน,
Profit for the year,กำไรสำหรับปี,
Program,โครงการ,
Program in the Fee Structure and Student Group {0} are different.,หลักสูตรในโครงสร้างค่าธรรมเนียมและกลุ่มนักเรียน {0} แตกต่างกัน,
Program {0} does not exist.,ไม่พบโปรแกรม {0},
Program: ,โปรแกรม:,
Progress % for a task cannot be more than 100.,% ความคืบหน้าสำหรับงานไม่ได้มากกว่า 100,
Project Collaboration Invitation,ขอเชิญร่วมโครงการ,
Project Id,Id โครงการ,
Project Manager,ผู้จัดการโครงการ,
Project Name,ชื่อโครงการ,
Project Start Date,วันที่เริ่มต้นโครงการ,
Project Status,สถานะโครงการ,
Project Summary for {0},สรุปโครงการสำหรับ {0},
Project Update.,การปรับปรุงโครงการ,
Project Value,มูลค่าโครงการ,
Project activity / task.,กิจกรรมของโครงการ / งาน,
Project master.,ต้นแบบโครงการ,
Project-wise data is not available for Quotation,ข้อมูล โครงการ ฉลาด ไม่สามารถใช้ได้กับ ใบเสนอราคา,
Projected,ที่คาดการณ์ไว้,
Projected Qty,ฉายจำนวน,
Projected Quantity Formula,สูตรปริมาณที่คาดการณ์,
Projects,โครงการ,
Property already added,เพิ่มคุณสมบัติแล้ว,
Proposal Writing,การเขียน ข้อเสนอ,
Proposal/Price Quote,ข้อเสนอราคา / ราคา,
Prospecting,การตรวจหาแร่,
Provisional Profit / Loss (Credit),กำไรเฉพาะกาล / ขาดทุน (เครดิต),
Publications,สิ่งพิมพ์,
Publish Items on Website,รายการเผยแพร่บนเว็บไซต์,
Publishing,การประกาศ,
Purchase,ซื้อ,
Purchase Amount,ปริมาณการซื้อ,
Purchase Date,วันที่ซื้อ,
Purchase Invoice,ซื้อใบแจ้งหนี้,
Purchase Invoice {0} is already submitted,ซื้อ ใบแจ้งหนี้ {0} มีการส่ง แล้ว,
Purchase Order,ใบสั่งซื้อ,
Purchase Order Amount,จำนวนการสั่งซื้อ,
Purchase Order Amount(Company Currency),จำนวนการสั่งซื้อ (สกุลเงิน บริษัท ),
Purchase Order Date,วันที่สั่งซื้อ,
Purchase Order Items not received on time,ซื้อรายการสั่งซื้อที่ไม่ได้รับตามเวลา,
Purchase Order number required for Item {0},จำนวน การสั่งซื้อ สินค้า ที่จำเป็นสำหรับ {0},
Purchase Order to Payment,การสั่งซื้อที่จะชำระเงิน,
Purchase Order {0} is not submitted,สั่งซื้อ {0} ไม่ได้ ส่ง,
Purchase Orders are not allowed for {0} due to a scorecard standing of {1}.,คำสั่งซื้อซื้อไม่ได้รับอนุญาตสำหรับ {0} เนื่องจากมีการจดแต้มที่ {1},
Purchase Orders given to Suppliers.,ใบสั่งซื้อให้กับซัพพลายเออร์,
Purchase Price List,ซื้อราคา,
Purchase Receipt,ใบเสร็จรับเงินการสั่งซื้อ,
Purchase Receipt {0} is not submitted,รับซื้อ {0} ไม่ได้ ส่ง,
Purchase Tax Template,ซื้อแม่แบบภาษี,
Purchase orders help you plan and follow up on your purchases,คำสั่งซื้อที่ช่วยให้คุณวางแผนและติดตามในการซื้อสินค้าของคุณ,
Purchasing,การจัดซื้อ,
Purpose must be one of {0},จุดประสงค์ ต้องเป็นหนึ่งใน {0},
Qty,จำนวน,
Qty To Manufacture,จำนวนการผลิต,
Qty Total,จำนวนรวม,
Qty for {0},จำนวนสำหรับ {0},
Qualification,คุณสมบัติ,
Quality,คุณภาพ,
Quality Action,การดำเนินการที่มีคุณภาพ,
Quality Goal.,เป้าหมายคุณภาพ,
Quality Inspection,การตรวจสอบคุณภาพ,
Quality Inspection: {0} is not submitted for the item: {1} in row {2},การตรวจสอบคุณภาพ: ไม่ได้ส่ง {0} สำหรับรายการ: {1} ในแถว {2},
Quality Management,การบริหารจัดการคุณภาพ,
Quality Meeting,การประชุมคุณภาพ,
Quality Procedure,ขั้นตอนคุณภาพ,
Quality Procedure.,ขั้นตอนคุณภาพ,
Quality Review,ตรวจสอบคุณภาพ,
Quantity,จำนวน,
Quantity for Item {0} must be less than {1},ปริมาณ รายการ {0} ต้องน้อยกว่า {1},
Quantity in row {0} ({1}) must be same as manufactured quantity {2},จำนวน ในแถว {0} ({1} ) จะต้อง เป็นเช่นเดียวกับ ปริมาณ การผลิต {2},
Quantity must be less than or equal to {0},ปริมาณต้องน้อยกว่าหรือเท่ากับ {0},
Quantity must be positive,ปริมาณต้องเป็นบวก,
Quantity must not be more than {0},จำนวนต้องไม่เกิน {0},
Quantity required for Item {0} in row {1},จำนวน รายการ ที่จำเป็นสำหรับ {0} ในแถว {1},
Quantity should be greater than 0,ปริมาณที่ควรจะเป็นมากกว่า 0,
Quantity to Make,จำนวนที่ต้องทำ,
Quantity to Manufacture must be greater than 0.,ปริมาณการผลิตจะต้องมากกว่า 0,
Quantity to Produce,ปริมาณในการผลิต,
Quantity to Produce can not be less than Zero,ปริมาณที่จะผลิตต้องไม่น้อยกว่าศูนย์,
Queued for replacing the BOM. It may take a few minutes.,จัดคิวสำหรับการเปลี่ยน BOM อาจใช้เวลาสักครู่,
Queued for updating latest price in all Bill of Materials. It may take a few minutes.,จัดคิวเพื่ออัปเดตราคาล่าสุดในบิลวัสดุทั้งหมด อาจใช้เวลาสักครู่,
Quick Journal Entry,วารสารรายการด่วน,
Quot Count,นับ Quot,
Quot/Lead %,Quot / Lead%,
Quotation,ใบเสนอราคา,
Quotation {0} is cancelled,ใบเสนอราคา {0} จะถูกยกเลิก,
Quotation {0} not of type {1},ไม่ได้ ชนิดของ ใบเสนอราคา {0} {1},
Quotations,ใบเสนอราคา,
"Quotations are proposals, bids you have sent to your customers",ใบเสนอราคาข้อเสนอการเสนอราคาที่คุณส่งให้กับลูกค้าของคุณ,
Quotations received from Suppliers.,ใบเสนอราคาที่ได้รับจากผู้จัดจำหน่าย,
Quotations: ,ใบเสนอราคา:,
Quotes to Leads or Customers.,ใบเสนอราคาไปยังช่องทาง หรือลูกค้า,
RFQs are not allowed for {0} due to a scorecard standing of {1},RFQs ไม่ได้รับอนุญาตสำหรับ {0} เนื่องจากสถานะการจดแต้ม {1},
Range,เทือกเขา,
Rate,อัตรา,
Rate:,ราคา:,
Raw Material,วัตถุดิบ,
Raw Materials,วัตถุดิบ,
Raw Materials cannot be blank.,วัตถุดิบไม่สามารถมีช่องว่าง,
Re-open,Re - เปิด,
Read blog,อ่านบล็อก,
Read the ERPNext Manual,อ่านคู่มือ ERPNext,
Reading Uploaded File,กำลังอ่านไฟล์ที่อัพโหลด,
Real Estate,อสังหาริมทรัพย์,
Reason For Putting On Hold,เหตุผลในการระงับ,
Reason for Hold,เหตุผลในการระงับ,
Reason for hold: ,เหตุผลในการระงับ:,
Receipt,ใบเสร็จรับเงิน,
Receipt document must be submitted,เอกสารใบเสร็จรับเงินจะต้องส่ง,
Receivable,ลูกหนี้,
Receivable Account,ลูกหนี้การค้า,
Receive at Warehouse Entry,รับที่รายการคลังสินค้า,
Received,ที่ได้รับ,
Received On,ที่ได้รับใน,
Received Quantity,ปริมาณที่ได้รับ,
Received Stock Entries,รับรายการสต็อค,
Receiver List is empty. Please create Receiver List,รายชื่อ ผู้รับ ว่างเปล่า กรุณาสร้าง รายชื่อ รับ,
Reconcile,คืนดี,
"Record of all communications of type email, phone, chat, visit, etc.",บันทึกการสื่อสารทั้งหมดของอีเมลประเภทโทรศัพท์แชทเข้าชม ฯลฯ,
Records,ประวัติ,
Ref,อ้าง,
Ref Date,Ref วันที่สมัคร,
Reference,การอ้างอิง,
Reference #{0} dated {1},อ้างอิง # {0} วันที่ {1},
Reference Date,วันที่อ้างอิง,
Reference Doctype must be one of {0},อ้างอิง Doctype ต้องเป็นหนึ่งใน {0},
Reference Document,เอกสารอ้างอิง,
Reference No & Reference Date is required for {0},ไม่มี การอ้างอิง และการอ้างอิง วันที่ เป็นสิ่งจำเป็นสำหรับ {0},
Reference No and Reference Date is mandatory for Bank transaction,อ้างอิงและการอ้างอิงวันที่มีผลบังคับใช้สำหรับการทำธุรกรรมธนาคาร,
Reference No is mandatory if you entered Reference Date,ไม่มี การอ้างอิง มีผลบังคับใช้ ถ้า คุณป้อน วันที่ อ้างอิง,
Reference No.,เลขอ้างอิง.,
Reference Number,เลขที่อ้างอิง,
"Reference: {0}, Item Code: {1} and Customer: {2}",ข้อมูลอ้างอิง: {0} รหัสรายการ: {1} และลูกค้า: {2},
References,อ้างอิง,
Register,สมัครสมาชิก,
Reject,ปฏิเสธ,
Rejected,ปฏิเสธ,
Related,ที่เกี่ยวข้อง,
Relation with Guardian1,ความสัมพันธ์กับ Guardian1,
Relation with Guardian2,ความสัมพันธ์กับ Guardian2,
Release Date,วันที่เผยแพร่,
Reload Linked Analysis,โหลดการวิเคราะห์ที่เชื่อมโยงกัน,
Remaining,ที่เหลืออยู่,
Remaining Balance,ยอดคงเหลือที่เหลืออยู่,
Remarks,ข้อคิดเห็น,
Reminder to update GSTIN Sent,คำเตือนเพื่ออัปเดต GSTIN Sent,
Remove item if charges is not applicable to that item,ลบรายการค่าใช้จ่ายถ้าไม่สามารถใช้ได้กับรายการที่,
Removed items with no change in quantity or value.,รายการที่ลบออกด้วยการเปลี่ยนแปลงในปริมาณหรือไม่มีค่า,
Reopen,เปิดใหม่,
Reorder Level,สั่งซื้อใหม่ระดับ,
Reorder Qty,สั่งซื้อใหม่จำนวน,
Repeat Customer Revenue,ซ้ำรายได้ของลูกค้า,
Repeat Customers,ทำซ้ำลูกค้า,
Replace BOM and update latest price in all BOMs,แทนที่ BOM และอัปเดตราคาล่าสุดใน BOM ทั้งหมด,
Replies,ตอบกลับ,
Report,รายงาน,
Report Builder,สร้างรายงาน,
Report Type is mandatory,ประเภทรายงาน มีผลบังคับใช้,
Report an Issue,รายงาน ฉบับ,
Reports,รายงาน,
Reqd By Date,reqd โดยวันที่,
Reqd Qty,จำนวน Reqd,
Request for Quotation,ขอใบเสนอราคา,
"Request for Quotation is disabled to access from portal, for more check portal settings.",ขอให้เสนอราคาถูกปิดใช้งานในการเข้าถึงจากพอร์ทัลสำหรับการตั้งค่าพอร์ทัลการตรวจสอบมากขึ้น,
Request for Quotations,การขอใบเสนอราคา,
Request for Raw Materials,ขอวัตถุดิบ,
Request for purchase.,ขอซื้อ,
Request for quotation.,ขอใบเสนอราคา.,
Requested Qty,ขอ จำนวน,
"Requested Qty: Quantity requested for purchase, but not ordered.",ขอ จำนวน: จำนวน การร้องขอ สำหรับการซื้อ แต่ไม่ ได้รับคำสั่ง,
Requesting Site,กำลังร้องขอไซต์,
Requesting payment against {0} {1} for amount {2},ร้องขอการชำระเงินจาก {0} {1} สำหรับจำนวนเงิน {2},
Requestor,ผู้ขอ,
Required On,ต้องใช้ใน,
Required Qty,จำนวนที่ต้องการ,
Required Quantity,ปริมาณที่ต้องการ,
Reschedule,หมายกำหนดการใหม่,
Research,การวิจัย,
Research & Development,การวิจัยและพัฒนา,
Researcher,นักวิจัย,
Resend Payment Email,ส่งอีเมล์การชำระเงิน,
Reserve Warehouse,คลังสินค้าสำรอง,
Reserved Qty,สงวนไว้ จำนวน,
Reserved Qty for Production,ลิขสิทธิ์จำนวนการผลิต,
Reserved Qty for Production: Raw materials quantity to make manufacturing items.,ปริมาณที่สงวนไว้สำหรับการผลิต: ปริมาณวัตถุดิบเพื่อผลิตรายการ,
"Reserved Qty: Quantity ordered for sale, but not delivered.",ลิขสิทธิ์ จำนวน: จำนวน ที่สั่งซื้อ สำหรับการขาย แต่ ไม่ได้ส่ง,
Reserved Warehouse is mandatory for Item {0} in Raw Materials supplied,คลังสำรองเป็นข้อบังคับสำหรับรายการ {0} ในวัตถุดิบที่จัดให้,
Reserved for manufacturing,สงวนไว้สำหรับการผลิต,
Reserved for sale,สงวนไว้สำหรับขาย,
Reserved for sub contracting,สงวนไว้สำหรับสัญญาย่อย,
Resistant,ต้านทาน,
Resolve error and upload again.,แก้ไขข้อผิดพลาดและอัปโหลดอีกครั้ง,
Responsibilities,ความรับผิดชอบ,
Rest Of The World,ส่วนที่เหลือ ของโลก,
Restart Subscription,รีสตาร์ทการสมัครสมาชิกใหม่,
Restaurant,ร้านอาหาร,
Result Date,วันที่ผลลัพธ์,
Result already Submitted,ผลลัพธ์ที่ได้รับแล้ว,
Resume,ประวัติย่อ,
Retail,ค้าปลีก,
Retail & Wholesale,ค้าปลีกและ ขายส่ง,
Retail Operations,การดำเนินงานค้าปลีก,
Retained Earnings,กำไรสะสม,
Retention Stock Entry,การเก็บรักษารายการสินค้าคงคลัง,
Retention Stock Entry already created or Sample Quantity not provided,เก็บสต็อกสินค้าที่จัดเก็บไว้แล้วหรือไม่ได้ระบุจำนวนตัวอย่าง,
Return,กลับ,
Return / Credit Note,กลับมา / หมายเหตุเครดิต,
Return / Debit Note,ย้อนกลับ / เดบิตหมายเหตุ,
Returns,ผลตอบแทน,
Reverse Journal Entry,Reverse Journal Entry,
