 (Half Day),(ครึ่งวัน)
Currency is missing for Price List,สกุลเงิน ที่ ขาดหายไปสำหรับ ราคาตามรายการ
Current Address,ที่อยู่ปัจจุบัน
Current Address Is,ที่อยู่ ปัจจุบัน เป็น
Current BOM,BOM ปัจจุบัน
Current Fiscal Year,ปีงบประมาณปัจจุบัน
Current Stock,สต็อกปัจจุบัน
Current Stock UOM,UOM ต็อกสินค้าปัจจุบัน
Current Value,ค่าปัจจุบัน
Custom,ประเพณี
Custom Autoreply Message,ข้อความตอบกลับอัตโนมัติที่กำหนดเอง
Custom Message,ข้อความที่กำหนดเอง
Customer,ลูกค้า
Customer (Receivable) Account,บัญชีลูกค้า (ลูกหนี้)
Customer / Item Name,ชื่อลูกค้า / รายการ
Customer / Lead Address,ลูกค้า / ตะกั่ว อยู่
Customer Account Head,หัวหน้าฝ่ายบริการลูกค้า
Customer Acquisition and Loyalty,การซื้อ ของลูกค้าและ ความจงรักภักดี
Customer Address,ที่อยู่ของลูกค้า
Customer Addresses And Contacts,ที่อยู่ของลูกค้าและการติดต่อ
Customer Code,รหัสลูกค้า
Customer Codes,รหัสลูกค้า
Customer Details,รายละเอียดลูกค้า
Customer Discount,ส่วนลดพิเศษสำหรับลูกค้า
Customer Discounts,ส่วนลดลูกค้า
Customer Feedback,คำติชมของลูกค้า
Customer Group,กลุ่มลูกค้า
Customer Group / Customer,กลุ่ม ลูกค้า / ลูกค้า
Customer Group Name,ชื่อกลุ่มลูกค้า
Customer Intro,แนะนำลูกค้า
Customer Issue,ปัญหาของลูกค้า
Customer Issue against Serial No.,ลูกค้าออกกับหมายเลขเครื่อง
Customer Name,ชื่อลูกค้า
Customer Naming By,การตั้งชื่อตามลูกค้า
Customer classification tree.,ต้นไม้จำแนกลูกค้า
Customer database.,ฐานข้อมูลลูกค้า
Customer's Item Code,รหัสสินค้าของลูกค้า
Customer's Purchase Order Date,วันที่สั่งซื้อของลูกค้าสั่งซื้อ
Customer's Purchase Order No,ใบสั่งซื้อของลูกค้าไม่มี
Customer's Purchase Order Number,จำนวน การสั่งซื้อ ของลูกค้า
Customer's Vendor,ผู้ขายของลูกค้า
Customers Not Buying Since Long Time,ลูกค้าที่ไม่ได้ซื้อตั้งแต่เวลานาน
Customerwise Discount,ส่วนลด Customerwise
Customization,การปรับแต่ง
Customize the Notification,กำหนดประกาศ
Customize the introductory text that goes as a part of that email. Each transaction has a separate introductory text.,ปรับแต่งข้อความเกริ่นนำที่จะไปเป็นส่วนหนึ่งของอีเมลที่ แต่ละรายการมีข้อความเกริ่นนำแยก
DN,DN
DN Detail,รายละเอียด DN
Daily,ประจำวัน
Daily Time Log Summary,ข้อมูลอย่างย่อประจำวันเข้าสู่ระบบ
Data Import,นำเข้าข้อมูล
Database Folder ID,ID โฟลเดอร์ฐานข้อมูล
Database of potential customers.,ฐานข้อมูลของลูกค้าที่มีศักยภาพ
Date,วันที่
Date Format,รูปแบบวันที่
Date Of Retirement,วันที่ของการเกษียณอายุ
Date and Number Settings,การตั้งค่าวันที่และจำนวน
Date is repeated,วันที่ซ้ำแล้วซ้ำอีก
Date of Birth,วันเกิด
Date of Issue,วันที่ออก
Date of Joining,วันที่ของการเข้าร่วม
Date on which lorry started from supplier warehouse,วันที่เริ่มต้นจากรถบรรทุกคลังสินค้าผู้จัดจำหน่าย
Date on which lorry started from your warehouse,วันที่เริ่มต้นจากรถบรรทุกคลังสินค้าของคุณ
Dates,วันที่
Days Since Last Order,ตั้งแต่ วันที่ สั่งซื้อ ล่าสุด
Days for which Holidays are blocked for this department.,วันที่วันหยุดจะถูกบล็อกสำหรับแผนกนี้
Dealer,เจ้ามือ
Debit,หักบัญชี
Debit Amt,จำนวนบัตรเดบิต
Debit Note,หมายเหตุเดบิต
Debit To,เดบิตเพื่อ
Debit and Credit not equal for this voucher: Diff (Debit) is ,
Debit or Credit,เดบิตหรือบัตรเครดิต
Debited account (Supplier) is not matching with Purchase Invoice,หัก บัญชี ( ผู้ผลิต ) จะ ไม่ตรงกับ ที่มีการ ซื้อ ใบแจ้งหนี้
Deduct,หัก
Deduction,การหัก
Deduction Type,ประเภทหัก
Deduction1,Deduction1
Deductions,การหักเงิน
Default,ผิดนัด
Default Account,บัญชีเริ่มต้น
Default BOM,BOM เริ่มต้น
Default Bank / Cash account will be automatically updated in POS Invoice when this mode is selected.,เริ่มต้นบัญชีธนาคาร / เงินสดจะถูกปรับปรุงโดยอัตโนมัติในใบแจ้งหนี้ POS เมื่อโหมดนี้ถูกเลือก
Default Bank Account,บัญชีธนาคารเริ่มต้น
Default Buying Price List,ซื้อ ราคา เริ่มต้น
Default Cash Account,บัญชีเงินสดเริ่มต้น
Default Company,บริษัท เริ่มต้น
Default Cost Center,ศูนย์ต้นทุนเริ่มต้น
Default Cost Center for tracking expense for this item.,ศูนย์ต้นทุนค่าใช้จ่ายเริ่มต้นสำหรับการติดตามสำหรับรายการนี​​้
Default Currency,สกุลเงินเริ่มต้น
Default Customer Group,กลุ่มลูกค้าเริ่มต้น
Default Expense Account,บัญชีค่าใช้จ่ายเริ่มต้น
Default Income Account,บัญชีรายได้เริ่มต้น
Default Item Group,กลุ่มสินค้าเริ่มต้น
Default Price List,รายการราคาเริ่มต้น
Default Purchase Account in which cost of the item will be debited.,บัญชีซื้อเริ่มต้นที่ค่าใช้จ่ายของรายการที่จะถูกหัก
Default Settings,ตั้งค่าเริ่มต้น
Default Source Warehouse,คลังสินค้าที่มาเริ่มต้น
Default Stock UOM,เริ่มต้น UOM สต็อก
Default Supplier,ผู้ผลิตเริ่มต้น
Default Supplier Type,ซัพพลายเออร์ชนิดเริ่มต้น
Default Target Warehouse,คลังสินค้าเป้าหมายเริ่มต้น
Default Territory,ดินแดนเริ่มต้น
Default UOM updated in item ,
Default Unit of Measure,หน่วยเริ่มต้นของวัด
"Default Unit of Measure can not be changed directly because you have already made some transaction(s) with another UOM. To change default UOM, use 'UOM Replace Utility' tool under Stock module.",หน่วย เริ่มต้น ของการวัด ไม่สามารถเปลี่ยนแปลงได้ โดยตรง เพราะคุณ ได้ทำแล้ว การทำธุรกรรม บางอย่าง (s ) ที่มี UOM อื่น เมื่อต้องการเปลี่ยน UOM เริ่มต้น ใช้ ' UOM แทนที่ ยูทิลิตี้ ' เครื่องมือ ภายใต้ โมดูล สต็อก
Default Valuation Method,วิธีการประเมินค่าเริ่มต้น
Default Warehouse,คลังสินค้าเริ่มต้น
Default Warehouse is mandatory for Stock Item.,คลังสินค้าเริ่มต้นมีผลบังคับใช้สำหรับรายการสินค้า
Default settings for Shopping Cart,การตั้งค่าเริ่มต้นสำหรับรถเข็น
"Define Budget for this Cost Center. To set budget action, see <a href=""#!List/Company"">Company Master</a>","กำหนดงบประมาณสำหรับศูนย์ต้นทุนนี้ เพื่อตั้งกระทำงบประมาณเห็น <a href=""#!List/Company"">บริษัท มาสเตอร์</a>"
Delete,ลบ
Delivered,ส่ง
Delivered Items To Be Billed,รายการที่ส่งไปถูกเรียกเก็บเงิน
Delivered Qty,จำนวนส่ง
Delivered Serial No ,
Delivery Date,วันที่ส่ง
Delivery Details,รายละเอียดการจัดส่งสินค้า
Delivery Document No,เอกสารจัดส่งสินค้าไม่มี
Delivery Document Type,ประเภทเอกสารการจัดส่งสินค้า
Delivery Note,หมายเหตุจัดส่งสินค้า
Delivery Note Item,รายการจัดส่งสินค้าหมายเหตุ
Delivery Note Items,รายการจัดส่งสินค้าหมายเหตุ
Delivery Note Message,ข้อความหมายเหตุจัดส่งสินค้า
Delivery Note No,หมายเหตุจัดส่งสินค้าไม่มี
Delivery Note Required,หมายเหตุจัดส่งสินค้าที่จำเป็น
Delivery Note Trends,แนวโน้มหมายเหตุการจัดส่งสินค้า
Delivery Status,สถานะการจัดส่งสินค้า
Delivery Time,เวลาจัดส่งสินค้า
Delivery To,เพื่อจัดส่งสินค้า
Department,แผนก
Depends on LWP,ขึ้นอยู่กับ LWP
Description,ลักษณะ
Description HTML,HTML รายละเอียด
Description of a Job Opening,คำอธิบายของการเปิดงาน
Designation,การแต่งตั้ง
Detailed Breakup of the totals,กระจัดกระจายรายละเอียดของผลรวม
Details,รายละเอียด
Difference,ข้อแตกต่าง
Difference Account,บัญชี ที่แตกต่างกัน
Different UOM for items will lead to incorrect,UOM ที่แตกต่างกัน สำหรับรายการที่ จะ นำไปสู่การ ที่ไม่ถูกต้อง
Disable Rounded Total,ปิดการใช้งานรวมโค้ง
Discount  %,ส่วนลด%
Discount %,ส่วนลด%
Discount (%),ส่วนลด (%)
"Discount Fields will be available in Purchase Order, Purchase Receipt, Purchase Invoice","ทุ่งส่วนลดจะสามารถใช้ได้ในใบสั่งซื้อรับซื้อ, ใบกำกับซื้อ"
Discount(%),ส่วนลด (%)
Display all the individual items delivered with the main items,แสดงรายการทั้งหมดของแต่ละบุคคลมาพร้อมกับรายการหลัก
Distinct unit of an Item,หน่วยที่แตกต่างของรายการ
Distribute transport overhead across items.,แจกจ่ายค่าใช้จ่ายการขนส่งข้ามรายการ
Distribution,การกระจาย
Distribution Id,รหัสกระจาย
Distribution Name,ชื่อการแจกจ่าย
Distributor,ผู้จัดจำหน่าย
Divorced,หย่าร้าง
Do Not Contact,ไม่ ติดต่อ
Do not show any symbol like $ etc next to currencies.,ไม่แสดงสัญลักษณ์ใด ๆ เช่น ฯลฯ $ ต่อไปกับเงินสกุล
Do you really want to STOP ,
Do you really want to STOP this Material Request?,คุณ ต้องการที่จะ หยุด การร้องขอ วัสดุ นี้
Do you really want to Submit all Salary Slip for month : ,
Do you really want to UNSTOP ,
Do you really want to UNSTOP this Material Request?,คุณต้องการ จริงๆที่จะ เปิดจุก ขอ วัสดุ นี้
Doc Name,ชื่อหมอ
Doc Type,ประเภท Doc
Document Description,คำอธิบายเอกสาร
Document Type,ประเภทเอกสาร
Documentation,เอกสาร
Documents,เอกสาร
Domain,โดเมน
Don't send Employee Birthday Reminders,อย่าส่ง พนักงาน เตือนวันเกิด
Download Materials Required,ดาวน์โหลดวัสดุที่จำเป็น
Download Reconcilation Data,ดาวน์โหลด Reconcilation ข้อมูล
Download Template,ดาวน์โหลดแม่แบบ
Download a report containing all raw materials with their latest inventory status,ดาวน์โหลดรายงานที่มีวัตถุดิบทั้งหมดที่มีสถานะสินค้าคงคลังของพวกเขาล่าสุด
"Download the Template, fill appropriate data and attach the modified file.",ดาวน์โหลด แม่แบบกรอก ข้อมูลที่เหมาะสม และแนบ ไฟล์ ที่มีการแก้ไข
"Download the Template, fill appropriate data and attach the modified file.
All dates and employee combination in the selected period will come in the template, with existing attendance records",
Draft,ร่าง
Dropbox,Dropbox
Dropbox Access Allowed,Dropbox เข็น
Dropbox Access Key,ที่สำคัญในการเข้าถึง Dropbox
Dropbox Access Secret,ความลับในการเข้าถึง Dropbox
Due Date,วันที่ครบกำหนด
Duplicate Item,รายการ ที่ซ้ำกัน
EMP/,EMP /
ERPNext Setup,การติดตั้ง ERPNext
ERPNext Setup Guide,คู่มือการติดตั้ง ERPNext
"ERPNext is an open-source web based ERP made by Web Notes Technologies Pvt Ltd. to provide an integrated tool to manage most processes in a small organization. For more information about Web Notes, or to buy hosting servies, go to ",
ESIC CARD No,CARD ESIC ไม่มี
ESIC No.,หมายเลข ESIC
Earliest,ที่เก่าแก่ที่สุด
Earning,รายได้
Earning & Deduction,รายได้และการหัก
Earning Type,รายได้ประเภท
Earning1,Earning1
Edit,แก้ไข
Educational Qualification,วุฒิการศึกษา
Educational Qualification Details,รายละเอียดคุ​​ณสมบัติการศึกษา
Eg. smsgateway.com/api/send_sms.cgi,เช่น smsgateway.com / API / send_sms.cgi
Electricity Cost,ค่าใช้จ่าย ไฟฟ้า
Electricity cost per hour,ต้นทุนค่าไฟฟ้า ต่อชั่วโมง
Email,อีเมล์
Email Digest,ข่าวสารทางอีเมล
Email Digest Settings,การตั้งค่าอีเมลเด่น
Email Digest: ,
Email Id,Email รหัส
"Email Id must be unique, already exists for: ",Email รหัสต้องไม่ซ้ำกันอยู่แล้วสำหรับ:
"Email Id where a job applicant will email e.g. ""jobs@example.com""",Email รหัสที่ผู้สมัครงานจะส่งอีเมลถึง &quot;jobs@example.com&quot; เช่น
Email Sent?,อีเมลที่ส่ง?
Email Settings,การตั้งค่าอีเมล
Email Settings for Outgoing and Incoming Emails.,การตั้งค่าอีเมลสำหรับอีเมลขาออกและขาเข้า
Email ids separated by commas.,รหัสอีเมลคั่นด้วยเครื่องหมายจุลภาค
"Email settings for jobs email id ""jobs@example.com""",การตั้งค่าอีเมลสำหรับอีเมล ID งาน &quot;jobs@example.com&quot;
"Email settings to extract Leads from sales email id e.g. ""sales@example.com""",การตั้งค่าอีเมลที่จะดึงนำมาจากอีเมล์ ID เช่นยอดขาย &quot;sales@example.com&quot;
Emergency Contact,ติดต่อฉุกเฉิน
Emergency Contact Details,รายละเอียดการติดต่อในกรณีฉุกเฉิน
Emergency Phone,โทรศัพท์ ฉุกเฉิน
Employee,ลูกจ้าง
Employee Birthday,วันเกิดของพนักงาน
Employee Designation.,ได้รับการแต่งตั้งพนักงาน
Employee Details,รายละเอียดของพนักงาน
Employee Education,การศึกษาการทำงานของพนักงาน
Employee External Work History,ประวัติการทำงานของพนักงานภายนอก
Employee Information,ข้อมูลของพนักงาน
Employee Internal Work History,ประวัติการทำงานของพนักงานภายใน
Employee Internal Work Historys,Historys การทำงานของพนักงานภายใน
Employee Leave Approver,อนุมัติพนักงานออก
Employee Leave Balance,ยอดคงเหลือพนักงานออก
Employee Name,ชื่อของพนักงาน
Employee Number,จำนวนพนักงาน
Employee Records to be created by,ระเบียนพนักงานที่จะถูกสร้างขึ้นโดย
Employee Settings,การตั้งค่า การทำงานของพนักงาน
Employee Setup,การติดตั้งการทำงานของพนักงาน
Employee Type,ประเภทพนักงาน
Employee grades,เกรดของพนักงาน
Employee record is created using selected field. ,ระเบียนของพนักงานจะถูกสร้างขึ้นโดยใช้เขตข้อมูลที่เลือก
Employee records.,ระเบียนพนักงาน
Employee: ,พนักงาน:
Employees Email Id,Email รหัสพนักงาน
Employment Details,รายละเอียดการจ้างงาน
Employment Type,ประเภทการจ้างงาน
Enable / Disable Email Notifications,เปิด / ปิด การแจ้งเตือน อีเมล์
Enable Shopping Cart,เปิดใช้งานรถเข็น
Enabled,เปิดการใช้งาน
Encashment Date,วันที่การได้เป็นเงินสด
End Date,วันที่สิ้นสุด
End date of current invoice's period,วันที่สิ้นสุดของรอบระยะเวลาใบแจ้งหนี้ปัจจุบัน
End of Life,ในตอนท้ายของชีวิต
Enter Row,ใส่แถว
Enter Verification Code,ใส่รหัสยืนยัน
Enter campaign name if the source of lead is campaign.,ป้อนชื่อแคมเปญหากแหล่งที่มาของสารตะกั่วเป็นแคมเปญ
Enter department to which this Contact belongs,ใส่แผนกที่ติดต่อนี้เป็นของ
Enter designation of this Contact,ใส่ชื่อของเราได้ที่นี่
"Enter email id separated by commas, invoice will be mailed automatically on particular date",ใส่หมายเลขอีเมลคั่นด้วยเครื่องหมายจุลภาคใบแจ้งหนี้จะถูกส่งโดยอัตโนมัติในวันที่เจาะจง
Enter items and planned qty for which you want to raise production orders or download raw materials for analysis.,ป้อนรายการและจำนวนที่วางแผนไว้สำหรับที่คุณต้องการที่จะยกระดับการสั่งผลิตหรือดาวน์โหลดวัตถุดิบสำหรับการวิเคราะห์
Enter name of campaign if source of enquiry is campaign,ป้อนชื่อของแคมเปญหากแหล่งที่มาของการรณรงค์สอบถามรายละเอียดเพิ่มเติม
"Enter static url parameters here (Eg. sender=ERPNext, username=ERPNext, password=1234 etc.)",ป้อนพารามิเตอร์คงที่ URL ที่นี่ (เช่นผู้ส่ง = ERPNext ชื่อผู้ใช้ = ERPNext รหัสผ่าน = 1234 ฯลฯ )
Enter the company name under which Account Head will be created for this Supplier,ป้อนชื่อ บริษัท ภายใต้ซึ่งหัวหน้าบัญชีจะถูกสร้างขึ้นสำหรับผู้ผลิตนี้
Enter url parameter for message,ป้อนพารามิเตอร์ URL สำหรับข้อความ
Enter url parameter for receiver nos,ป้อนพารามิเตอร์ URL สำหรับ Nos รับ
Entries,คอมเมนต์
Entries against,คอมเมนต์ กับ
Entries are not allowed against this Fiscal Year if the year is closed.,คอมเมนต์ไม่ได้รับอนุญาตกับปีงบประมาณนี้หากที่ปิดปี
Error,ความผิดพลาด
Error for,สำหรับข้อผิดพลาด
Estimated Material Cost,ต้นทุนวัสดุประมาณ
Everyone can read,ทุกคนสามารถอ่าน
"Example: ABCD.#####
If series is set and Serial No is not mentioned in transactions, then automatic serial number will be created based on this series. If you always want to explicitly mention Serial Nos for this item. leave this blank.",
Exchange Rate,อัตราแลกเปลี่ยน
Excise Page Number,หมายเลขหน้าสรรพสามิต
Excise Voucher,บัตรกำนัลสรรพสามิต
Exemption Limit,วงเงินข้อยกเว้น
Exhibition,งานมหกรรม
Existing Customer,ลูกค้าที่มีอยู่
Exit,ทางออก
Exit Interview Details,ออกจากรายละเอียดการสัมภาษณ์
Expected,ที่คาดหวัง
Expected Date cannot be before Material Request Date,วันที่ คาดว่าจะ ไม่สามารถเป็น วัสดุ ก่อนที่จะ ขอ วันที่
Expected Delivery Date,คาดว่าวันที่ส่ง
Expected End Date,คาดว่าวันที่สิ้นสุด
Expected Start Date,วันที่เริ่มต้นคาดว่า
Expense Account,บัญชีค่าใช้จ่าย
