"""Customer Provided Item"" cannot be Purchase Item also",&quot;สินค้าที่ลูกค้าให้มา&quot; ไม่สามารถซื้อสินค้าได้เช่นกัน,
"""Customer Provided Item"" cannot have Valuation Rate",&quot;รายการที่ลูกค้าให้ไว้&quot; ไม่สามารถมีอัตราการประเมินค่าได้,
"""Is Fixed Asset"" cannot be unchecked, as Asset record exists against the item","ไม่สามารถเพิกถอน ""คือสินทรัพย์ถาวร"" ได้เพราะมีบันทึกสินทรัพย์ที่อยู่กับรายการ",
'Based On' and 'Group By' can not be same,'ขึ้นอยู่กับ' และ 'จัดกลุ่มโดย' ต้องไม่เหมือนกัน,
'Days Since Last Order' must be greater than or equal to zero,' ตั้งแต่ วันที่ สั่งซื้อ ล่าสุด ' ต้องมากกว่า หรือเท่ากับศูนย์,
'Entries' cannot be empty,' รายการ ' ต้องไม่ว่างเปล่า,
'From Date' is required,ต้องระบุ 'วันเริ่มต้น',
'From Date' must be after 'To Date','จาก วันที่ ' ต้อง เป็นหลังจากที่ ' นัด ',
'Has Serial No' can not be 'Yes' for non-stock item,'มีเลขซีเรียล' ไม่สามารถเป็น 'ใช่' สำหรับรายการที่ไม่ใช่สต็อก,
'Opening','กำลังเปิด',
'To Case No.' cannot be less than 'From Case No.','ถึงหมายเลขกรณี' ไม่สามารถจะน้อยกว่า 'จากหมายเลขกรณี',
'To Date' is required,"โปรดระบุ “วันที่สิ้นสุด""",
'Total',&#39;ทั้งหมด&#39;,
'Update Stock' can not be checked because items are not delivered via {0},'การปรับสต็อก' ไม่สามารถตรวจสอบได้เพราะรายการไม่ได้จัดส่งผ่านทาง {0},
'Update Stock' cannot be checked for fixed asset sale,ไม่สามารถตรวจสอบ 'การปรับสต๊อก' สำหรับการขายสินทรัพย์ถาวร,
) for {0},) สำหรับ {0},
1 exact match.,1 การแข่งขันที่แน่นอน,
90-Above,90-ขึ้นไป,
A Customer Group exists with same name please change the Customer name or rename the Customer Group,กลุ่ม ลูกค้าที่มีอยู่ ที่มีชื่อเดียวกัน โปรด เปลี่ยนชื่อ ลูกค้าหรือเปลี่ยนชื่อ กลุ่ม ลูกค้า,
A Default Service Level Agreement already exists.,ข้อตกลงระดับบริการเริ่มต้นมีอยู่แล้ว,
A Lead requires either a person's name or an organization's name,ลูกค้าเป้าหมายต้องการชื่อบุคคลหรือชื่อองค์กร,
A customer with the same name already exists,มีลูกค้าที่มีชื่อเดียวกันอยู่แล้ว,
A question must have more than one options,คำถามต้องมีมากกว่าหนึ่งตัวเลือก,
A qustion must have at least one correct options,qustion ต้องมีตัวเลือกที่ถูกต้องอย่างน้อยหนึ่งตัว,
A {0} exists between {1} and {2} (,{0} อยู่ระหว่าง {1} ถึง {2} (,
Abbr can not be blank or space,เงื่อนไขที่ไม่สามารถเป็นที่ว่างเปล่าหรือพื้นที่,
Abbreviation already used for another company,ชื่อย่อที่ใช้แล้วสำหรับ บริษัท อื่น,
Abbreviation cannot have more than 5 characters,ตัวอักษรย่อ ห้ามมีความยาวมากกว่า 5 ตัวอักษร,
Abbreviation is mandatory,ชื่อย่อมีผลบังคับใช้,
About the Company,เกี่ยวกับ บริษัท,
About your company,เกี่ยวกับ บริษัท ของคุณ,
Above,สูงกว่า,
Absent,ขาด,
Academic Term,ระยะทางวิชาการ,
Academic Term: ,ระยะเวลาการศึกษา:,
Academic Year,ปีการศึกษา,
Academic Year: ,ปีการศึกษา:,
Accepted + Rejected Qty must be equal to Received quantity for Item {0},จำนวนสินค้าที่ผ่านการตรวจรับ + จำนวนสินค้าที่ไม่ผ่านการตรวจรับ จะต้องมีปริมาณเท่ากับ  จำนวน สืนค้าที่ได้รับ สำหรับ รายการ {0},
Accessable Value,มูลค่าที่สามารถเข้าถึงได้,
Account,บัญชี,
Account Number,หมายเลขบัญชี,
Account Number {0} already used in account {1},เลขที่บัญชี {0} ใช้ไปแล้วในบัญชี {1},
Account Pay Only,บัญชีจ่ายเพียง,
Account Type,ประเภทบัญชี,
Account Type for {0} must be {1},ประเภทบัญชีสำหรับ {0} &#39;จะต้อง {1},
"Account balance already in Credit, you are not allowed to set 'Balance Must Be' as 'Debit'",ยอดเงินในบัญชีแล้วในเครดิตคุณไม่ได้รับอนุญาตให้ตั้ง 'ยอดดุลต้องเป็น' เป็น 'เดบิต',
"Account balance already in Debit, you are not allowed to set 'Balance Must Be' as 'Credit'",ยอดเงินในบัญชีแล้วในเดบิตคุณไม่ได้รับอนุญาตให้ตั้ง 'ยอดดุลต้องเป็น' เป็น 'เครดิต,
Account number for account {0} is not available.<br> Please setup your Chart of Accounts correctly.,หมายเลขบัญชีสำหรับบัญชี {0} ไม่พร้อมใช้งาน <br> โปรดตั้งค่าแผนภูมิบัญชีให้ถูกต้อง,
Account with child nodes cannot be converted to ledger,บัญชีที่มี ต่อมน้ำเด็ก ไม่สามารถ แปลงเป็น บัญชีแยกประเภท,
Account with child nodes cannot be set as ledger,บัญชีที่มีโหนดลูกไม่สามารถกำหนดให้เป็นบัญชีแยกประเภท,
Account with existing transaction can not be converted to group.,บัญชี กับการทำธุรกรรม ที่มีอยู่ ไม่สามารถ แปลงเป็น กลุ่ม,
Account with existing transaction can not be deleted,บัญชี ที่มีอยู่ กับการทำธุรกรรม ไม่สามารถลบได้,
Account with existing transaction cannot be converted to ledger,บัญชี กับการทำธุรกรรม ที่มีอยู่ ไม่สามารถ แปลงเป็น บัญชีแยกประเภท,
Account {0} does not belong to company: {1},บัญชี {0} ไม่ได้เป็นของ บริษัท : {1},
Account {0} does not belongs to company {1},บัญชี {0} ไม่ได้เป็นของ บริษัท {1},
Account {0} does not exist,บัญชี {0} ไม่อยู่,
Account {0} does not exists,บัญชี {0} ไม่อยู่,
Account {0} does not match with Company {1} in Mode of Account: {2},บัญชี {0} ไม่ตรงกับ บริษัท {1} ในโหมดบัญชี: {2},
Account {0} has been entered multiple times,บัญชี {0} ได้รับการป้อนหลายครั้ง,
Account {0} is added in the child company {1},เพิ่มบัญชี {0} ใน บริษัท ย่อย {1},
Account {0} is frozen,บัญชี {0} จะถูก แช่แข็ง,
Account {0} is invalid. Account Currency must be {1},บัญชี {0} ไม่ถูกต้อง สกุลเงินในบัญชีจะต้องเป็น {1},
Account {0}: Parent account {1} can not be a ledger,บัญชี {0}: บัญชีผู้ปกครอง {1} ไม่สามารถแยกประเภท,
Account {0}: Parent account {1} does not belong to company: {2},บัญชี {0}: บัญชีผู้ปกครอง {1} ไม่ได้เป็นของ บริษัท : {2},
Account {0}: Parent account {1} does not exist,บัญชี {0}: บัญชีผู้ปกครอง {1} ไม่อยู่,
Account {0}: You can not assign itself as parent account,บัญชี {0}: คุณไม่สามารถกำหนดตัวเองเป็นบัญชีผู้ปกครอง,
Account: {0} can only be updated via Stock Transactions,บัญชี: {0} เท่านั้นที่สามารถได้รับการปรับปรุงผ่านการทำธุรกรรมสต็อก,
Account: {0} with currency: {1} can not be selected,บัญชี: {0} กับสกุลเงิน: {1} ไม่สามารถเลือกได้,
Accountant,นักบัญชี,
Accounting,การบัญชี,
Accounting Entry for Asset,รายการบัญชีสำหรับสินทรัพย์,
Accounting Entry for Stock,เข้าบัญชีสำหรับสต็อก,
Accounting Entry for {0}: {1} can only be made in currency: {2},บัญชีรายการสำหรับ {0}: {1} สามารถทำได้ในสกุลเงิน: {2},
Accounting Ledger,บัญชีแยกประเภท,
Accounting journal entries.,รายการบันทึกบัญชี,
Accounts,บัญชี,
Accounts Payable,บัญชีเจ้าหนี้,
Accounts Payable Summary,สรุปบัญชีเจ้าหนี้,
Accounts Receivable,ลูกหนี้,
Accounts Receivable Summary,สรุปบัญชีลูกหนี้,
Accounts table cannot be blank.,ตารางบัญชีต้องไม่ว่างเปล่า,
Accrual Journal Entry for salaries from {0} to {1},รายการบันทึกยอดคงค้างสำหรับเงินเดือนจาก {0} ถึง {1},
Accumulated Depreciation,ค่าเสื่อมราคาสะสม,
Accumulated Depreciation Amount,จำนวนเงินค่าเสื่อมราคาสะสม,
Accumulated Depreciation as on,ค่าเสื่อมราคาสะสม ณ วันที่,
Accumulated Monthly,สะสมรายเดือน,
Accumulated Values,ค่าสะสม,
Accumulated Values in Group Company,มูลค่าสะสมในกลุ่ม บริษัท,
Achieved ({}),ทำได้ ({}),
Action,ดำเนินการ,
Action Initialised,การดำเนินการเริ่มต้นแล้ว,
Actions,การดำเนินการ,
Active,ใช้งาน,
Active Leads / Customers,นำไปสู่การใช้ / ลูกค้า,
Activity Cost exists for Employee {0} against Activity Type - {1},ค่าใช้จ่ายในกิจกรรมที่มีอยู่สำหรับพนักงาน {0} กับประเภทกิจกรรม - {1},
Activity Cost per Employee,ค่าใช้จ่ายในกิจกรรมต่อพนักงาน,
Activity Type,ประเภทกิจกรรม,
Actual Cost,ต้นทุนที่แท้จริง,
Actual Delivery Date,วันที่จัดส่งจริง,
Actual Qty,จำนวนจริง,
Actual Qty is mandatory,จำนวนที่เกิดขึ้นจริงมีผลบังคับใช้,
Actual Qty {0} / Waiting Qty {1},จำนวนจริง {0} / รอจำนวน {1},
Actual Qty: Quantity available in the warehouse.,ที่เกิดขึ้นจริง จำนวน: จำนวน ที่มีอยู่ใน คลังสินค้า,
Actual qty in stock,จำนวนจริงในสต็อก,
Actual type tax cannot be included in Item rate in row {0},ประเภทภาษีที่เกิดขึ้นจริงไม่สามารถรวมอยู่ในราคาสินค้าในแถว {0},
Add,เพิ่ม,
Add / Edit Prices,เพิ่ม / แก้ไขราคา,
Add All Suppliers,เพิ่มซัพพลายเออร์ทั้งหมด,
Add Comment,เพิ่มความเห็น,
Add Customers,เพิ่มลูกค้า,
Add Employees,เพิ่มพนักงาน,
Add Item,เพิ่มรายการ,
Add Items,เพิ่มรายการ,
Add Leads,เพิ่ม Leads,
Add Multiple Tasks,เพิ่มงานหลายรายการ,
Add Row,เพิ่มแถว,
Add Sales Partners,เพิ่มพันธมิตรการขาย,
Add Serial No,เพิ่ม หมายเลขซีเรียล,
Add Students,เพิ่มนักเรียน,
Add Suppliers,เพิ่มซัพพลายเออร์,
Add Time Slots,เพิ่มช่วงเวลา,
Add Timesheets,เพิ่ม Timesheets,
Add Timeslots,เพิ่ม Timeslots,
Add Users to Marketplace,เพิ่มผู้ใช้ลงใน Marketplace,
Add a new address,เพิ่มที่อยู่ใหม่,
Add cards or custom sections on homepage,เพิ่มการ์ดหรือส่วนที่กำหนดเองในหน้าแรก,
Add more items or open full form,เพิ่มรายการมากขึ้นหรือเต็มรูปแบบเปิด,
Add notes,เพิ่มบันทึก,
Add the rest of your organization as your users. You can also add invite Customers to your portal by adding them from Contacts,เพิ่มส่วนที่เหลือขององค์กรของคุณเป็นผู้ใช้ของคุณ นอกจากนี้คุณยังสามารถเพิ่มเชิญลูกค้าพอร์ทัลของคุณด้วยการเพิ่มจากรายชื่อ,
Add to Details,เพิ่มในรายละเอียด,
Add/Remove Recipients,เพิ่ม / ลบ ชื่อผู้รับ,
Added,ที่เพิ่ม,
Added to details,เพิ่มในรายละเอียด,
Added {0} users,เพิ่ม {0} ผู้ใช้แล้ว,
Additional Salary Component Exists.,องค์ประกอบเงินเดือนเพิ่มเติมมีอยู่,
Address,ที่อยู่,
Address Line 2,ที่อยู่บรรทัดที่ 2,
Address Name,ชื่อที่อยู่,
Address Title,หัวข้อที่อยู่,
Address Type,ประเภทของที่อยู่,
Administrative Expenses,ค่าใช้จ่ายใน การดูแลระบบ,
Administrative Officer,พนักงานธุรการ,
Administrator,ผู้บริหาร,
Admission,การรับเข้า,
Admission and Enrollment,การรับสมัครและการลงทะเบียน,
Admissions for {0},การรับสมัครสำหรับ {0},
Admit,ยอมรับ,
Admitted,ที่ยอมรับ,
Advance Amount,จำนวนล่วงหน้า,
Advance Payments,การชำระเงินล่วงหน้า,
Advance account currency should be same as company currency {0},สกุลเงินของบัญชี Advance ควรเหมือนกับสกุลเงินของ บริษัท {0},
Advance amount cannot be greater than {0} {1},จำนวนเงินล่วงหน้าไม่สามารถจะสูงกว่า {0} {1},
Advertising,การโฆษณา,
Aerospace,การบินและอวกาศ,
Against,กับ,
Against Account,กับบัญชี,
Against Journal Entry {0} does not have any unmatched {1} entry,กับอนุทิน {0} ไม่ได้มีที่ไม่มีใครเทียบ {1} รายการ,
Against Journal Entry {0} is already adjusted against some other voucher,กับอนุทิน {0} จะถูกปรับแล้วกับบางบัตรกำนัลอื่น ๆ,
Against Supplier Invoice {0} dated {1},กับผู้ผลิตใบแจ้งหนี้ {0} วัน {1},
Against Voucher,กับบัตรกำนัล,
Against Voucher Type,กับประเภทบัตร,
Age,อายุ,
Age (Days),อายุ (วัน),
Ageing Based On,เอจจิ้ง อยู่ ที่,
Ageing Range 1,ช่วงสูงอายุ 1,
Ageing Range 2,ช่วงสูงอายุ 2,
Ageing Range 3,ช่วงสูงอายุ 3,
Agriculture,การเกษตร,
Agriculture (beta),เกษตรกรรม (เบต้า),
Airline,สายการบิน,
All Accounts,บัญชีทั้งหมด,
All Addresses.,ที่อยู่ทั้งหมด,
All Assessment Groups,ทุกกลุ่มการประเมิน,
All BOMs,BOMs ทั้งหมด,
All Contacts.,ติดต่อทั้งหมด,
All Customer Groups,ทุกกลุ่ม ลูกค้า,
All Day,ทั้งวัน,
All Departments,แผนกทั้งหมด,
All Healthcare Service Units,หน่วยบริการด้านการดูแลสุขภาพทั้งหมด,
All Item Groups,ทั้งหมด รายการ กลุ่ม,
All Jobs,งานทั้งหมด,
All Products,สินค้าทั้งหมด,
All Products or Services.,ผลิตภัณฑ์หรือบริการ  ทั้งหมด,
All Student Admissions,ทั้งหมดเป็นนักศึกษา,
All Supplier Groups,กลุ่มผู้จัดจำหน่ายทั้งหมด,
All Supplier scorecards.,ดัชนีชี้วัดทั้งหมดของ Supplier,
All Territories,ดินแดน ทั้งหมด,
All Warehouses,โกดังทั้งหมด,
All communications including and above this shall be moved into the new Issue,การสื่อสารทั้งหมดที่รวมถึงประเด็นนี้จะถูกย้ายไปสู่ฉบับใหม่,
All items have already been invoiced,รายการทั้งหมดที่ ได้รับการ ออกใบแจ้งหนี้ แล้ว,
All items have already been transferred for this Work Order.,รายการทั้งหมดได้รับการโอนไปแล้วสำหรับใบสั่งงานนี้,
All other ITC,อื่น ๆ ทั้งหมดของ ITC,
All the mandatory Task for employee creation hasn't been done yet.,ยังไม่ได้ดำเนินงานที่จำเป็นสำหรับการสร้างพนักงานทั้งหมด,
All these items have already been invoiced,รายการทั้งหมด เหล่านี้ได้รับ ใบแจ้งหนี้ แล้ว,
Allocate Payment Amount,จัดสรรจำนวนเงินที่ชำระ,
Allocated Amount,จำนวนเงินที่จัดสรร,
Allocated Leaves,ใบที่จัดสรรไว้,
Allocating leaves...,กำลังจัดสรรใบ ...,
Already record exists for the item {0},มีรายการบันทึกสำหรับรายการ {0} อยู่แล้ว,
"Already set default in pos profile {0} for user {1}, kindly disabled default",ตั้งค่าดีฟอลต์ในโพสต์โปรไฟล์ {0} สำหรับผู้ใช้ {1} เรียบร้อยแล้วโปรดปิดใช้งานค่าเริ่มต้น,
Alternate Item,รายการสำรอง,
Alternative item must not be same as item code,รายการทางเลือกต้องไม่เหมือนกับรหัสรายการ,
Amount,จำนวน,
Amount After Depreciation,จำนวนเงินหลังจากที่ค่าเสื่อมราคา,
Amount of Integrated Tax,จำนวนภาษีรวม,
Amount of TDS Deducted,จำนวนเงินที่หักแล้วของ TDS,
Amount should not be less than zero.,จำนวนไม่ควรน้อยกว่าศูนย์,
Amount to Bill,จำนวนเงินที่จะเรียกเก็บเงิน,
Amount {0} {1} against {2} {3},จำนวน {0} {1} กับ {2} {3},
Amount {0} {1} deducted against {2},จำนวน {0} {1} หักกับ {2},
Amount {0} {1} transferred from {2} to {3},จำนวน {0} {1} โอนจาก {2} เป็น {3},
Amount {0} {1} {2} {3},จำนวน {0} {1} {2} {3},
Amt,amt,
"An Item Group exists with same name, please change the item name or rename the item group",รายการกลุ่ม ที่มีอยู่ ที่มีชื่อเดียวกัน กรุณาเปลี่ยน ชื่อรายการหรือเปลี่ยนชื่อ กลุ่ม รายการ,
An academic term with this 'Academic Year' {0} and 'Term Name' {1} already exists. Please modify these entries and try again.,ระยะทางวิชาการกับเรื่องนี้ &#39;ปีการศึกษา&#39; {0} และ &#39;ระยะชื่อ&#39; {1} อยู่แล้ว โปรดแก้ไขรายการเหล่านี้และลองอีกครั้ง,
An error occurred during the update process,เกิดข้อผิดพลาดระหว่างการอัพเดต,
"An item exists with same name ({0}), please change the item group name or rename the item",รายการที่มีอยู่ ที่มีชื่อเดียวกัน ({0}) กรุณาเปลี่ยนชื่อกลุ่ม รายการ หรือเปลี่ยนชื่อ รายการ,
Analyst,นักวิเคราะห์,
Analytics,Analytics,
Annual Billing: {0},การเรียกเก็บเงินประจำปี: {0},
Annual Salary,เงินเดือนประจำปี,
Anonymous,ไม่ระบุชื่อ,
Another Budget record '{0}' already exists against {1} '{2}' and account '{3}' for fiscal year {4},บันทึกงบประมาณ &#39;{0}&#39; มีอยู่แล้วสำหรับ {1} &#39;{2}&#39; และบัญชี &#39;{3}&#39; สำหรับปีงบประมาณ {4},
Another Period Closing Entry {0} has been made after {1},อีก รายการ ระยะเวลา ปิด {0} ได้รับการทำ หลังจาก {1},
Another Sales Person {0} exists with the same Employee id,อีกคนขาย {0} อยู่กับรหัสพนักงานเดียวกัน,
Antibiotic,ยาปฏิชีวนะ,
Apparel & Accessories,เครื่องแต่งกาย และอุปกรณ์เสริม,
"Applicable if the company is SpA, SApA or SRL","บังคับใช้หาก บริษัท คือ SpA, SApA หรือ SRL",
Applicable if the company is a limited liability company,บังคับใช้หาก บริษัท เป็น บริษัท รับผิด จำกัด,
Applicable if the company is an Individual or a Proprietorship,บังคับใช้หาก บริษัท เป็นบุคคลธรรมดาหรือเจ้าของกิจการ,
Applicant,ผู้ขอ,
Applicant Type,ประเภทผู้สมัคร,
Application of Funds (Assets),การใช้ประโยชน์กองทุน (สินทรัพย์),
Application period cannot be across two allocation records,ระยะเวลาการสมัครต้องไม่เกินสองระเบียนการจัดสรร,
