 (Half Day),(ครึ่งวัน)
Set allocated amount against each Payment Entry and click 'Allocate'.,ชุด การจัดสรร เงิน กับแต่ละ รายการ ชำระเงิน และคลิก จัดสรร '
Set as Default,Set as Default
Set as Lost,ตั้งเป็น ที่หายไป
Set prefix for numbering series on your transactions,กำหนดคำนำหน้าสำหรับหมายเลขชุดทำธุรกรรมของคุณ
Set targets Item Group-wise for this Sales Person.,ตั้งเป้ากลุ่มสินค้าที่ชาญฉลาดสำหรับการนี​​้คนขาย
"Set your outgoing mail SMTP settings here. All system generated notifications, emails will go from this mail server. If you are not sure, leave this blank to use ERPNext servers (emails will still be sent from your email id) or contact your email provider.",ตั้งค่าของคุณอีเมล SMTP ขาออกที่นี่ ระบบทั้งหมดที่สร้างการแจ้งเตือนอีเมลจะไปจากที่เซิร์ฟเวอร์อีเมลนี้ หากคุณไม่แน่ใจว่าเว้นว่างไว้เพื่อใช้เซิร์ฟเวอร์ ERPNext (อีเมลจะยังคงถูกส่งจาก id อีเมลของคุณ) หรือติดต่อผู้ให้บริการอีเมลของคุณ
Setting Account Type helps in selecting this Account in transactions.,ประเภทบัญชีการตั้งค่าช่วยในการเลือกบัญชีนี้ในการทำธุรกรรม
Setting up...,การตั้งค่า ...
Settings,การตั้งค่า
Settings for Accounts,การตั้งค่าสำหรับบัญชี
Settings for Buying Module,การตั้งค่าสำหรับการซื้อโมดูล
Settings for Selling Module,การตั้งค่าสำหรับการขายโมดูล
Settings for Stock Module,การตั้งค่าสำหรับ โมดูล สต็อก
"Settings to extract Job Applicants from a mailbox e.g. ""jobs@example.com""",การตั้งค่าที่จะดึงผู้สมัครงานจากกล่องจดหมายเช่น &quot;jobs@example.com&quot;
Setup,การติดตั้ง
Setup Already Complete!!,การติดตั้ง เสร็จสมบูรณ์ แล้ว !
Setup Complete!,การติดตั้ง เสร็จสมบูรณ์ !
Setup Completed,การติดตั้ง เสร็จสมบูรณ์
Setup Series,ชุดติดตั้ง
Setup of Shopping Cart.,การติดตั้งของรถเข็นช้อปปิ้ง
Setup to pull emails from support email account,ติดตั้งเพื่อดึงอีเมลจากบัญชีอีเมลสนับสนุน
Share,หุ้น
Share With,ร่วมกับ
Shipments to customers.,จัดส่งให้กับลูกค้า
Shipping,การส่งสินค้า
Shipping Account,บัญชีการจัดส่งสินค้า
Shipping Address,ที่อยู่จัดส่ง
Shipping Amount,จำนวนการจัดส่งสินค้า
Shipping Rule,กฎการจัดส่งสินค้า
Shipping Rule Condition,สภาพกฎการจัดส่งสินค้า
Shipping Rule Conditions,เงื่อนไขกฎการจัดส่งสินค้า
Shipping Rule Label,ป้ายกฎการจัดส่งสินค้า
Shipping Rules,กฎการจัดส่งสินค้า
Shop,ร้านค้า
Shopping Cart,รถเข็นช้อปปิ้ง
Shopping Cart Price List,รายการสินค้าราคาสินค้าในรถเข็น
Shopping Cart Price Lists,ช้อปปิ้งสินค้าราคา Lists
Shopping Cart Settings,การตั้งค่ารถเข็น
Shopping Cart Shipping Rule,ช้อปปิ้งรถเข็นกฎการจัดส่งสินค้า
Shopping Cart Shipping Rules,รถเข็นกฎการจัดส่งสินค้า
Shopping Cart Taxes and Charges Master,ภาษีรถเข็นและปริญญาโทค่าใช้จ่าย
Shopping Cart Taxes and Charges Masters,ภาษีรถเข็นช้อปปิ้งและปริญญาโทค่าใช้จ่าย
Short biography for website and other publications.,ชีวประวัติสั้นสำหรับเว็บไซต์และสิ่งพิมพ์อื่น ๆ
"Show ""In Stock"" or ""Not in Stock"" based on stock available in this warehouse.",แสดง &quot;ในสต็อก&quot; หรือ &quot;ไม่อยู่ในสต็อก&quot; บนพื้นฐานของหุ้นที่มีอยู่ในคลังสินค้านี้
Show / Hide Features,แสดง / ซ่อน คุณสมบัติ
Show / Hide Modules,แสดง / ซ่อน โมดูล
Show In Website,แสดงในเว็บไซต์
Show a slideshow at the top of the page,สไลด์โชว์ที่ด้านบนของหน้า
Show in Website,แสดงในเว็บไซต์
Show this slideshow at the top of the page,แสดงภาพสไลด์นี้ที่ด้านบนของหน้า
Signature,ลายเซ็น
Signature to be appended at the end of every email,ลายเซ็นที่จะต่อท้ายของอีเมลทุก
Single,เดียว
Single unit of an Item.,หน่วยเดียวของรายการ
Sit tight while your system is being setup. This may take a few moments.,นั่งตึงตัว ในขณะที่ ระบบของคุณ จะถูก ติดตั้ง ซึ่งอาจใช้เวลา สักครู่
Slideshow,สไลด์โชว์
"Sorry! You cannot change company's default currency, because there are existing transactions against it. You will need to cancel those transactions if you want to change the default currency.",ขออภัย! คุณไม่สามารถเปลี่ยนสกุลเงินเริ่มต้นของ บริษัท เนื่องจากมีการทำธุรกรรมที่มีอยู่กับมัน คุณจะต้องยกเลิกการทำธุรกรรมเหล่านั้นถ้าคุณต้องการที่จะเปลี่ยนสกุลเงินเริ่มต้น
"Sorry, Serial Nos cannot be merged",ขออภัย อนุกรม Nos ไม่สามารถ รวม
"Sorry, companies cannot be merged",ขออภัย บริษัท ไม่สามารถ รวม
Source,แหล่ง
Source Warehouse,คลังสินค้าที่มา
Source and Target Warehouse cannot be same,แหล่งที่มาและเป้าหมายคลังสินค้าไม่สามารถเดียวกัน
Spartan,สปาร์ตัน
Special Characters,อักขระพิเศษ
Special Characters ,
Specification Details,รายละเอียดสเปค
Specify Exchange Rate to convert one currency into another,ระบุอัตราแลกเปลี่ยนการแปลงสกุลเงินที่ลงในอีก
"Specify a list of Territories, for which, this Price List is valid",ระบุรายการของดินแดนซึ่งรายการนี​​้เป็นราคาที่ถูกต้อง
"Specify a list of Territories, for which, this Shipping Rule is valid",ระบุรายการของดินแดนซึ่งกฎข้อนี้การจัดส่งสินค้าที่ถูกต้อง
"Specify a list of Territories, for which, this Taxes Master is valid",ระบุรายการของดินแดนซึ่งนี้โทภาษีถูกต้อง
Specify conditions to calculate shipping amount,ระบุเงื่อนไขในการคำนวณปริมาณการจัดส่งสินค้า
"Specify the operations, operating cost and give a unique Operation no to your operations.",ระบุการดำเนินการ ค่าใช้จ่าย ในการดำเนินงาน และให้การดำเนินการ ที่ไม่ซ้ำกัน ในการ ดำเนินงานของคุณ
Split Delivery Note into packages.,แยกหมายเหตุจัดส่งสินค้าเข้าไปในแพคเกจ
Standard,มาตรฐาน
Standard Rate,อัตรามาตรฐาน
"Standard Terms and Conditions that can be added to Sales and Purchases.

Examples:

1. Validity of the offer.
1. Payment Terms (In Advance, On Credit, part advance etc).
1. What is extra (or payable by the Customer).
1. Safety / usage warning.
1. Warranty if any.
1. Returns Policy.
1. Terms of shipping, if applicable.
1. Ways of addressing disputes, indemnity, liability, etc.
1. Address and Contact of your Company.",
"Standard tax template that can be applied to all Purchase Transactions. This template can contain list of tax heads and also other expense heads like ""Shipping"", ""Insurance"", ""Handling"" etc.

#### Note

The tax rate you define here will be the standard tax rate for all **Items**. If there are **Items** that have different rates, they must be added in the **Item Tax** table in the **Item** master.

#### Description of Columns

1. Calculation Type: 
    - This can be on **Net Total** (that is the sum of basic amount).
    - **On Previous Row Total / Amount** (for cumulative taxes or charges). If you select this option, the tax will be applied as a percentage of the previous row (in the tax table) amount or total.
    - **Actual** (as mentioned).
2. Account Head: The Account ledger under which this tax will be booked
3. Cost Center: If the tax / charge is an income (like shipping) or expense it needs to be booked against a Cost Center.
4. Description: Description of the tax (that will be printed in invoices / quotes).
5. Rate: Tax rate.
6. Amount: Tax amount.
7. Total: Cumulative total to this point.
8. Enter Row: If based on ""Previous Row Total"" you can select the row number which will be taken as a base for this calculation (default is the previous row).
9. Consider Tax or Charge for: In this section you can specify if the tax / charge is only for valuation (not a part of total) or only for total (does not add value to the item) or for both.
10. Add or Deduct: Whether you want to add or deduct the tax.",
"Standard tax template that can be applied to all Sales Transactions. This template can contain list of tax heads and also other expense / income heads like ""Shipping"", ""Insurance"", ""Handling"" etc.

#### Note

The tax rate you define here will be the standard tax rate for all **Items**. If there are **Items** that have different rates, they must be added in the **Item Tax** table in the **Item** master.

#### Description of Columns

1. Calculation Type: 
    - This can be on **Net Total** (that is the sum of basic amount).
    - **On Previous Row Total / Amount** (for cumulative taxes or charges). If you select this option, the tax will be applied as a percentage of the previous row (in the tax table) amount or total.
    - **Actual** (as mentioned).
2. Account Head: The Account ledger under which this tax will be booked
3. Cost Center: If the tax / charge is an income (like shipping) or expense it needs to be booked against a Cost Center.
4. Description: Description of the tax (that will be printed in invoices / quotes).
5. Rate: Tax rate.
6. Amount: Tax amount.
7. Total: Cumulative total to this point.
8. Enter Row: If based on ""Previous Row Total"" you can select the row number which will be taken as a base for this calculation (default is the previous row).
9. Is this Tax included in Basic Rate?: If you check this, it means that this tax will not be shown below the item table, but will be included in the Basic Rate in your main item table. This is useful where you want give a flat price (inclusive of all taxes) price to customers.",
Start,เริ่มต้น
Start Date,วันที่เริ่มต้น
Start date of current invoice's period,วันที่เริ่มต้นของระยะเวลาการออกใบแจ้งหนี้ปัจจุบัน
Starting up...,เริ่มต้นขึ้น ...
State,รัฐ
Static Parameters,พารามิเตอร์คง
Status,สถานะ
Status must be one of ,สถานะต้องเป็นหนึ่งใน
Status should be Submitted,สถานะควรจะ Submitted
Statutory info and other general information about your Supplier,ข้อมูลตามกฎหมายและข้อมูลทั่วไปอื่น ๆ เกี่ยวกับผู้จำหน่ายของคุณ
Stock,คลังสินค้า
Stock Adjustment Account,การปรับบัญชีสินค้า
Stock Ageing,เอจจิ้งสต็อก
Stock Analytics,สต็อก Analytics
Stock Balance,ยอดคงเหลือสต็อก
Stock Entries already created for Production Order ,
Stock Entry,รายการสินค้า
Stock Entry Detail,รายละเอียดราย​​การสินค้า
Stock Frozen Upto,สต็อกไม่เกิน Frozen
Stock Ledger,บัญชีแยกประเภทสินค้า
Stock Ledger Entry,รายการสินค้าบัญชีแยกประเภท
Stock Level,ระดับสต็อก
Stock Projected Qty,หุ้น ที่คาดการณ์ จำนวน
Stock Qty,จำนวนหุ้น
Stock Queue (FIFO),สต็อกคิว (FIFO)
Stock Received But Not Billed,สินค้าที่ได้รับ แต่ไม่ได้เรียกเก็บ
Stock Reconcilation Data,หุ้น Reconcilation ข้อมูล
Stock Reconcilation Template,หุ้น Reconcilation แม่
Stock Reconciliation,สมานฉันท์สต็อก
"Stock Reconciliation can be used to update the stock on a particular date, ",
Stock Settings,การตั้งค่าหุ้น
Stock UOM,UOM สต็อก
Stock UOM Replace Utility,สต็อกยูทิลิตี้แทนที่ UOM
Stock Uom,UOM สต็อก
Stock Value,มูลค่าหุ้น
Stock Value Difference,ความแตกต่างมูลค่าหุ้น
Stock transactions exist against warehouse ,
Stop,หยุด
Stop Birthday Reminders,หยุด วันเกิด การแจ้งเตือน
Stop Material Request,ขอ หยุด วัสดุ
Stop users from making Leave Applications on following days.,หยุดผู้ใช้จากการทำแอพพลิเคที่เดินทางในวันที่ดังต่อไปนี้
Stop!,หยุด!
Stopped,หยุด
Structure cost centers for budgeting.,ศูนย์ต้นทุนโครงสร้างสำหรับการจัดทำงบประมาณ
Structure of books of accounts.,โครงสร้างของหนังสือของบัญชี
"Sub-currency. For e.g. ""Cent""",ย่อยสกุลเงิน สำหรับ &quot;ร้อย&quot; เช่น
Subcontract,สัญญารับช่วง
Subject,เรื่อง
Submit Salary Slip,ส่งสลิปเงินเดือน
Submit all salary slips for the above selected criteria,ส่งบิลเงินเดือนทั้งหมดสำหรับเกณฑ์ที่เลือกข้างต้น
Submit this Production Order for further processing.,ส่ง การผลิต การสั่งซื้อ นี้ สำหรับการประมวลผล ต่อไป
Submitted,Submitted
Subsidiary,บริษัท สาขา
Successful: ,ที่ประสบความสำเร็จ:
Suggestion,ข้อเสนอแนะ
Suggestions,ข้อเสนอแนะ
Sunday,วันอาทิตย์
Supplier,ผู้จัดจำหน่าย
Supplier (Payable) Account,ผู้จัดจำหน่ายบัญชี (เจ้าหนี้)
Supplier (vendor) name as entered in supplier master,ผู้จัดจำหน่ายชื่อ (ผู้ขาย) ป้อนเป็นผู้จัดจำหน่ายในต้นแบบ
Supplier Account,บัญชี ผู้จัดจำหน่าย
Supplier Account Head,หัวหน้าฝ่ายบัญชีของผู้จัดจำหน่าย
Supplier Address,ที่อยู่ผู้ผลิต
Supplier Addresses And Contacts,ผู้จัดจำหน่าย และ ที่อยู่ ติดต่อ
Supplier Addresses and Contacts,ที่อยู่ ของผู้ผลิต และผู้ติดต่อ
Supplier Details,รายละเอียดผู้จัดจำหน่าย
Supplier Intro,แนะนำผู้ผลิต
Supplier Invoice Date,วันที่ใบแจ้งหนี้ผู้จัดจำหน่าย
Supplier Invoice No,ใบแจ้งหนี้ที่ผู้ผลิตไม่มี
Supplier Name,ชื่อผู้จัดจำหน่าย
Supplier Naming By,ซัพพลายเออร์ที่ตั้งชื่อตาม
Supplier Part Number,หมายเลขชิ้นส่วนของผู้ผลิต
Supplier Quotation,ใบเสนอราคาของผู้ผลิต
Supplier Quotation Item,รายการใบเสนอราคาของผู้ผลิต
Supplier Reference,อ้างอิงจำหน่าย
Supplier Shipment Date,วันที่จัดส่งสินค้า
Supplier Shipment No,การจัดส่งสินค้าไม่มี
Supplier Type,ประเภทผู้ผลิต
Supplier Type / Supplier,ประเภท ผู้ผลิต / ผู้จัดจำหน่าย
Supplier Warehouse,คลังสินค้าผู้จัดจำหน่าย
Supplier Warehouse mandatory subcontracted purchase receipt,ผู้จัดจำหน่ายคลังสินค้าใบเสร็จรับเงินบังคับเหมา
Supplier classification.,การจัดหมวดหมู่จัดจำหน่าย
Supplier database.,ฐานข้อมูลผู้ผลิต
Supplier of Goods or Services.,ผู้ผลิตสินค้าหรือบริการ
Supplier warehouse where you have issued raw materials for sub - contracting,คลังสินค้าผู้จัดจำหน่ายที่คุณได้ออกวัตถ​​ุดิบสำหรับ sub - สัญญา
Supplier-Wise Sales Analytics,ผู้ผลิต ฉลาด Analytics ขาย
Support,สนับสนุน
Support Analtyics,Analtyics สนับสนุน
Support Analytics,Analytics สนับสนุน
Support Email,การสนับสนุนทางอีเมล
Support Email Settings,การสนับสนุน การตั้งค่า อีเมล์
Support Password,รหัสผ่านสนับสนุน
Support Ticket,ตั๋วสนับสนุน
Support queries from customers.,คำสั่งการสนับสนุนจากลูกค้า
Symbol,สัญญลักษณ์
Sync Support Mails,ซิงค์อีเมลที่สนับสนุน
Sync with Dropbox,ซิงค์กับ Dropbox
Sync with Google Drive,ซิงค์กับ Google ไดรฟ์
System Administration,การบริหาร ระบบ
System Scheduler Errors,ข้อผิดพลาด ระบบการ จัดตารางเวลา
System Settings,การตั้งค่าระบบ
"System User (login) ID. If set, it will become default for all HR forms.",ผู้ใช้ระบบ (login) ID ถ้าชุดก็จะกลายเป็นค่าเริ่มต้นสำหรับทุกรูปแบบทรัพยากรบุคคล
System for managing Backups,ระบบการจัดการการสำรองข้อมูล
System generated mails will be sent from this email id.,อีเมลที่สร้างระบบจะถูกส่งมาจาก id อีเมลนี้
TL-,TL-
TLB-,TLB-
Table for Item that will be shown in Web Site,ตารางสำหรับรายการที่จะแสดงในเว็บไซต์
Target  Amount,จำนวนเป้าหมาย
Target Detail,รายละเอียดเป้าหมาย
Target Details,รายละเอียดเป้าหมาย
Target Details1,Details1 เป้าหมาย
Target Distribution,การกระจายเป้าหมาย
Target On,เป้าหมาย ที่
Target Qty,จำนวนเป้าหมาย
Target Warehouse,คลังสินค้าเป้าหมาย
Task,งาน
Task Details,รายละเอียดงาน
Tasks,งาน
Tax,ภาษี
Tax Accounts,บัญชี ภาษีอากร
Tax Calculation,การคำนวณภาษี
Tax Category can not be 'Valuation' or 'Valuation and Total' as all items are non-stock items,หมวดหมู่ ภาษี ไม่สามารถ ' ประเมิน ' หรือ ' การประเมิน และ รวม เป็นรายการ ทุก รายการที่ไม่ สต็อก
Tax Master,ปริญญาโทภาษี
Tax Rate,อัตราภาษี
Tax Template for Purchase,แม่แบบภาษีซื้อ
Tax Template for Sales,แม่แบบภาษีสำหรับการขาย
Tax and other salary deductions.,ภาษีและอื่น ๆ หักเงินเดือน
"Tax detail table fetched from item master as a string and stored in this field.
Used for Taxes and Charges",
Taxable,ต้องเสียภาษี
Taxes,ภาษี
Taxes and Charges,ภาษีและค่าบริการ
Taxes and Charges Added,ภาษีและค่าบริการเพิ่ม
Taxes and Charges Added (Company Currency),ภาษีและค่าใช้จ่ายเพิ่ม (สกุลเงิน บริษัท )
Taxes and Charges Calculation,ภาษีและการคำนวณค่าใช้จ่าย
Taxes and Charges Deducted,ภาษีและค่าบริการหัก
Taxes and Charges Deducted (Company Currency),ภาษีและค่าใช้จ่ายหัก (สกุลเงิน บริษัท )
Taxes and Charges Total,ภาษีและค่าใช้จ่ายทั้งหมด
Taxes and Charges Total (Company Currency),ภาษีและค่าใช้จ่ายรวม (สกุลเงิน บริษัท )
Template for employee performance appraisals.,แม่แบบสำหรับการประเมินผลการปฏิบัติงานของพนักงาน
Template of terms or contract.,แม่ของข้อตกลงหรือสัญญา
Term Details,รายละเอียดคำ
Terms,ข้อตกลงและเงื่อนไข
Terms and Conditions,ข้อตกลงและเงื่อนไข
Terms and Conditions Content,ข้อตกลงและเงื่อนไขเนื้อหา
Terms and Conditions Details,ข้อตกลงและเงื่อนไขรายละเอียด
Terms and Conditions Template,ข้อตกลงและเงื่อนไขของแม่แบบ
Terms and Conditions1,ข้อตกลงและ Conditions1
Terretory,Terretory
Territory,อาณาเขต
Territory / Customer,มณฑล / ลูกค้า
Territory Manager,ผู้จัดการดินแดน
Territory Name,ชื่อดินแดน
Territory Target Variance (Item Group-Wise),ความแปรปรวนของดินแดนเป้าหมาย (กลุ่มสินค้า-ฉลาด)
Territory Targets,เป้าหมายดินแดน
