 (Half Day),(ครึ่งวัน)
Make Installation Note,ทำให้ การติดตั้ง หมายเหตุ
Make Invoice,ทำให้ ใบแจ้งหนี้
Make Maint. Schedule,ทำให้ Maint ตารางเวลา
Make Maint. Visit,ทำให้ Maint เยือน
Make Maintenance Visit,ทำให้ การบำรุงรักษา เยี่ยมชม
Make Packing Slip,ให้ บรรจุ สลิป
Make Payment Entry,ทำ รายการ ชำระเงิน
Make Purchase Invoice,ให้ ซื้อ ใบแจ้งหนี้
Make Purchase Order,ทำให้ การสั่งซื้อ
Make Purchase Receipt,ให้ รับซื้อ
Make Salary Slip,ให้ เงินเดือน สลิป
Make Salary Structure,ทำให้ โครงสร้าง เงินเดือน
Make Sales Invoice,ทำให้การ ขายใบแจ้งหนี้
Make Sales Order,ทำให้ การขายสินค้า
Make Supplier Quotation,ทำ ใบเสนอราคา ของผู้ผลิต
Male,ชาย
Manage 3rd Party Backups,3 พรรค การจัดการ การสำรองข้อมูล
Manage cost of operations,จัดการค่าใช้จ่ายในการดำเนินงาน
Manage exchange rates for currency conversion,จัดการอัตราแลกเปลี่ยนสำหรับการแปลงสกุลเงิน
"Mandatory if Stock Item is ""Yes"". Also the default warehouse where reserved quantity is set from Sales Order.",บังคับรายการสินค้าหากคือ &quot;ใช่&quot; ยังคลังสินค้าเริ่มต้นที่ปริมาณสำรองจะถูกตั้งค่าจากการสั่งซื้อการขาย
Manufacture against Sales Order,การผลิตกับการสั่งซื้อการขาย
Manufacture/Repack,การผลิต / Repack
Manufactured Qty,จำนวนการผลิต
Manufactured quantity will be updated in this warehouse,ปริมาณการผลิตจะมีการปรับปรุงในคลังสินค้านี้
Manufacturer,ผู้ผลิต
Manufacturer Part Number,หมายเลขชิ้นส่วนของผู้ผลิต
Manufacturing,การผลิต
Manufacturing Quantity,จำนวนการผลิต
Manufacturing Quantity is mandatory,จำนวน การผลิต มีผลบังคับใช้
Margin,ขอบ
Marital Status,สถานภาพการสมรส
Market Segment,ส่วนตลาด
Married,แต่งงาน
Mass Mailing,จดหมายมวล
Master Data,โท ข้อมูล
Master Name,ชื่อปริญญาโท
Master Name is mandatory if account type is Warehouse,ชื่อ ปริญญาโท มีผลบังคับใช้ ถ้าชนิด บัญชี คลังสินค้า
Master Type,ประเภทหลัก
Masters,โท
Match non-linked Invoices and Payments.,ตรงกับใบแจ้งหนี้ไม่ได้เชื่อมโยงและการชำระเงิน
Material Issue,ฉบับวัสดุ
Material Receipt,ใบเสร็จรับเงินวัสดุ
Material Request,ขอวัสดุ
Material Request Detail No,รายละเอียดขอวัสดุไม่มี
Material Request For Warehouse,ขอวัสดุสำหรับคลังสินค้า
Material Request Item,รายการวัสดุขอ
Material Request Items,รายการวัสดุขอ
Material Request No,ขอวัสดุไม่มี
Material Request Type,ชนิดของการร้องขอวัสดุ
Material Request used to make this Stock Entry,ขอวัสดุที่ใช้เพื่อให้รายการสินค้านี้
Material Requests for which Supplier Quotations are not created,ขอ วัสดุ ที่ ใบเสนอราคา ของผู้ผลิต ไม่ได้สร้างขึ้น
Material Requirement,ความต้องการวัสดุ
Material Transfer,โอนวัสดุ
Materials,วัสดุ
Materials Required (Exploded),วัสดุบังคับ (ระเบิด)
Max 500 rows only.,แม็กซ์ 500 เฉพาะแถว
Max Days Leave Allowed,วันแม็กซ์ฝากอนุญาตให้นำ
Max Discount (%),ส่วนลดสูงสุด (%)
Max Returnable Qty,แม็กซ์ กลับมา จำนวน
Medium,กลาง
"Merging is only possible if following \
					properties are same in both records.
					Group or Ledger, Debit or Credit, Is PL Account",
Message,ข่าวสาร
Message Parameter,พารามิเตอร์ข้อความ
Message Sent,ข้อความ ที่ส่ง
Messages,ข้อความ
Messages greater than 160 characters will be split into multiple messages,ข้อความมากขึ้นกว่า 160 ตัวอักษรจะได้รับการลง split mesage หลาย
Middle Income,มีรายได้ปานกลาง
Milestone,ขั้น
Milestone Date,วันที่ Milestone
Milestones,ความคืบหน้า
Milestones will be added as Events in the Calendar,ความคืบหน้าจะเพิ่มเป็นเหตุการณ์ในปฏิทิน
Min Order Qty,จำนวนสั่งซื้อขั้นต่ำ
Minimum Order Qty,จำนวนสั่งซื้อขั้นต่ำ
Misc Details,รายละเอียดอื่น ๆ
Miscellaneous,เบ็ดเตล็ด
Miscelleneous,เบ็ดเตล็ด
Mobile No,มือถือไม่มี
Mobile No.,เบอร์มือถือ
Mode of Payment,โหมดของการชำระเงิน
Modern,ทันสมัย
Modified Amount,จำนวนการแก้ไข
Monday,วันจันทร์
Month,เดือน
Monthly,รายเดือน
Monthly Attendance Sheet,แผ่นผู้เข้าร่วมรายเดือน
Monthly Earning & Deduction,กำไรสุทธิรายเดือนและหัก
Monthly Salary Register,สมัครสมาชิกเงินเดือน
Monthly salary statement.,งบเงินเดือน
Monthly salary template.,แม่เงินเดือน
More Details,รายละเอียดเพิ่มเติม
More Info,ข้อมูลเพิ่มเติม
Moving Average,ค่าเฉลี่ยเคลื่อนที่
Moving Average Rate,ย้ายอัตราเฉลี่ย
Mr,นาย
Ms,ms
Multiple Item prices.,ราคา หลายรายการ
Multiple Price list.,รายการ ราคา หลาย
Must be Whole Number,ต้องเป็นจำนวนเต็ม
My Settings,การตั้งค่าของฉัน
NL-,NL-
Name,ชื่อ
Name and Description,ชื่อและรายละเอียด
Name and Employee ID,ชื่อและลูกจ้าง ID
Name is required,ชื่อจะต้อง
"Name of new Account. Note: Please don't create accounts for Customers and Suppliers,",ชื่อของ บัญชี ใหม่ หมายเหตุ : โปรดอย่าสร้าง บัญชี สำหรับลูกค้า และ ซัพพลายเออร์
Name of person or organization that this address belongs to.,ชื่อบุคคลหรือองค์กรที่อยู่นี้เป็นของ
Name of the Budget Distribution,ชื่อของการกระจายงบประมาณ
Naming Series,การตั้งชื่อซีรีส์
Negative balance is not allowed for account ,ความสมดุลเชิงลบจะไม่ได้รับอนุญาตสำหรับบัญชี
Net Pay,จ่ายสุทธิ
Net Pay (in words) will be visible once you save the Salary Slip.,จ่ายสุทธิ (คำ) จะสามารถมองเห็นได้เมื่อคุณบันทึกสลิปเงินเดือน
Net Total,สุทธิ
Net Total (Company Currency),รวมสุทธิ (สกุลเงิน บริษัท )
Net Weight,ปริมาณสุทธิ
Net Weight UOM,UOM น้ำหนักสุทธิ
Net Weight of each Item,น้ำหนักสุทธิของแต่ละรายการ
Net pay can not be negative,จ่ายสุทธิไม่สามารถลบ
Never,ไม่เคย
New,ใหม่
New ,
New Account,บัญชีผู้ใช้ใหม่
New Account Name,ชื่อ บัญชีผู้ใช้ใหม่
New BOM,BOM ใหม่
New Communications,การสื่อสารใหม่
New Company,บริษัท ใหม่
New Cost Center,ศูนย์ต้นทุน ใหม่
New Cost Center Name,ใหม่ ชื่อ ศูนย์ต้นทุน
New Delivery Notes,ใบนำส่งสินค้าใหม่
New Enquiries,ใหม่สอบถาม
New Leads,ใหม่นำ
New Leave Application,แอพลิเคชันออกใหม่
New Leaves Allocated,ใหม่ใบจัดสรร
New Leaves Allocated (In Days),ใบใหม่ที่จัดสรร (ในวัน)
New Material Requests,ขอวัสดุใหม่
New Projects,โครงการใหม่
New Purchase Orders,สั่งซื้อใหม่
New Purchase Receipts,รายรับซื้อใหม่
New Quotations,ใบเสนอราคาใหม่
New Sales Orders,คำสั่งขายใหม่
"New Serial No cannot have Warehouse. Warehouse must be \
				set by Stock Entry or Purchase Receipt",
New Stock Entries,คอมเมนต์สต็อกใหม่
New Stock UOM,ใหม่ UOM สต็อก
New Supplier Quotations,ใบเสนอราคาจำหน่ายใหม่
New Support Tickets,ตั๋วสนับสนุนใหม่
New Workplace,สถานที่ทำงานใหม่
Newsletter,จดหมายข่าว
Newsletter Content,เนื้อหาจดหมายข่าว
Newsletter Status,สถานะจดหมาย
"Newsletters to contacts, leads.",จดหมายข่าวไปยังรายชื่อนำไปสู่
Next Communcation On,ถัดไป communcation เกี่ยวกับ
Next Contact By,ติดต่อถัดไป
Next Contact Date,วันที่ถัดไปติดต่อ
Next Date,วันที่ถัดไป
Next email will be sent on:,อีเมล์ถัดไปจะถูกส่งเมื่อ:
No,ไม่
No Action,ไม่มีการดำเนินการ
No Customer Accounts found.,ไม่มี บัญชีลูกค้า พบ
"No Customer or Supplier Accounts found. Accounts are identified based on \
			'Master Type' value in account record.",
No Item found with ,
No Items to Pack,รายการที่จะแพ็ค
No Leave Approvers. Please assign 'Leave Approver' Role to atleast one user.,ไม่มีผู้อนุมัติไว้ กรุณากำหนด &#39;ฝากอนุมัติบทบาทเพื่อ atleast ผู้ใช้คนหนึ่ง
No Permission,ไม่ได้รับอนุญาต
No Production Order created.,ไม่มี การผลิต เพื่อ สร้าง
No Supplier Accounts found. Supplier Accounts are identified based on 'Master Type' value in account record.,ไม่มี บัญชี ผู้ผลิต พบว่า บัญชี ผู้จัดจำหน่าย จะมีการระบุ ขึ้นอยู่กับ 'ประเภท โท ค่าใน การบันทึก บัญชี
No accounting entries for following warehouses,ไม่มี รายการบัญชี ต่อไปนี้ คลังสินค้า
No addresses created,ไม่มี ที่อยู่ ที่สร้างขึ้น
No contacts created,ไม่มี รายชื่อ ที่สร้างขึ้น
No default BOM exists for item: ,BOM ไม่มีค่าเริ่มต้นสำหรับรายการที่มีอยู่:
No of Requested SMS,ไม่มีของ SMS ขอ
No of Sent SMS,ไม่มี SMS ที่ส่ง
No of Visits,ไม่มีการเข้าชม
No record found,บันทึกไม่พบ
No salary slip found for month: ,สลิปเงินเดือนไม่พบคำที่เดือน:
Not,ไม่
Not Active,ไม่ได้ใช้งานล่าสุด
Not Applicable,ไม่สามารถใช้งาน
Not Available,ไม่สามารถใช้งาน
Not Billed,ไม่ได้เรียกเก็บ
Not Delivered,ไม่ได้ส่ง
Not Set,ยังไม่ได้ระบุ
Not allowed entry in Warehouse,รายการ ไม่ได้รับอนุญาต ใน คลังสินค้า
Note,หมายเหตุ
Note User,ผู้ใช้งานหมายเหตุ
Note is a free page where users can share documents / notes,หมายเหตุ: หน้าฟรีที่ผู้ใช้สามารถแบ่งปันเอกสาร / บันทึก
Note:,หมายเหตุ :
"Note: Backups and files are not deleted from Dropbox, you will have to delete them manually.",หมายเหตุ: การสำรองข้อมูลและไฟล์ที่ไม่ได้ถูกลบออกจาก Dropbox คุณจะต้องลบด้วยตนเอง
"Note: Backups and files are not deleted from Google Drive, you will have to delete them manually.",หมายเหตุ: การสำรองข้อมูลและไฟล์ที่ไม่ได้ถูกลบออกจาก Google Drive ของคุณจะต้องลบด้วยตนเอง
Note: Email will not be sent to disabled users,หมายเหตุ: อีเมล์ของคุณจะไม่ถูกส่งไปยังผู้ใช้คนพิการ
Notes,หมายเหตุ
Notes:,หมายเหตุ:
Nothing to request,ไม่มีอะไรที่จะ ขอ
Notice (days),แจ้งให้ทราบล่วงหน้า (วัน)
Notification Control,ควบคุมการแจ้งเตือน
Notification Email Address,ที่อยู่อีเมลการแจ้งเตือน
Notify by Email on creation of automatic Material Request,แจ้งทางอีเมล์เมื่อการสร้างการร้องขอวัสดุโดยอัตโนมัติ
Number Format,รูปแบบจำนวน
O+,+ O
O-,O-
OPPT,OPPT
Offer Date,ข้อเสนอ วันที่
Office,สำนักงาน
Old Parent,ผู้ปกครองเก่า
On,บน
On Net Total,เมื่อรวมสุทธิ
On Previous Row Amount,เกี่ยวกับจำนวนเงินแถวก่อนหน้า
On Previous Row Total,เมื่อรวมแถวก่อนหน้า
"Only Serial Nos with status ""Available"" can be delivered.","เพียง อนุกรม Nos ที่มีสถานะ "" มี "" สามารถส่ง"
Only Stock Items are allowed for Stock Entry,สินค้าพร้อมส่งเท่านั้นที่จะได้รับอนุญาตสำหรับรายการสินค้า
Only leaf nodes are allowed in transaction,โหนดใบเท่านั้นที่จะเข้าในการทำธุรกรรม
Open,เปิด
Open Production Orders,สั่ง เปิด การผลิต
Open Tickets,ตั๋วเปิด
Opening,การเปิด
Opening Accounting Entries,เปิด รายการ บัญชี
Opening Accounts and Stock,บัญชี การเปิดและการ สต็อกสินค้า
Opening Date,เปิดวันที่
Opening Entry,เปิดรายการ
Opening Qty,เปิด จำนวน
Opening Time,เปิดเวลา
Opening Value,ความคุ้มค่า เปิด
Opening for a Job.,เปิดงาน
Operating Cost,ค่าใช้จ่ายในการดำเนินงาน
Operation Description,ดำเนินการคำอธิบาย
Operation No,ไม่ดำเนินการ
Operation Time (mins),เวลาการดำเนินงาน (นาที)
Operations,การดำเนินงาน
Opportunity,โอกาส
Opportunity Date,วันที่มีโอกาส
Opportunity From,โอกาสจาก
Opportunity Item,รายการโอกาส
Opportunity Items,รายการโอกาส
Opportunity Lost,สูญเสียโอกาส
Opportunity Type,ประเภทโอกาส
Optional. This setting will be used to filter in various transactions.,ไม่จำเป็น การตั้งค่านี้ จะถูก ใช้ในการกรอง ในการทำธุรกรรม ต่างๆ
Order Type,ประเภทสั่งซื้อ
Ordered,ได้รับคำสั่ง
Ordered Items To Be Billed,รายการที่สั่งซื้อจะเรียกเก็บเงิน
Ordered Items To Be Delivered,รายการที่สั่งซื้อจะถูกส่ง
Ordered Qty,สั่งซื้อ จำนวน
"Ordered Qty: Quantity ordered for purchase, but not received.",สั่งซื้อ จำนวน: จำนวน สั่ง ซื้อ แต่ ไม่ได้รับ
Ordered Quantity,จำนวนสั่ง
Orders released for production.,คำสั่งปล่อยให้การผลิต
Organization,องค์กร
Organization Name,ชื่อองค์กร
Organization User,รายละเอียดองค์กร
Other,อื่น ๆ
Other Details,รายละเอียดอื่น ๆ
Out Qty,ออก จำนวน
Out Value,ออก มูลค่า
Out of AMC,ออกของ AMC
Out of Warranty,ออกจากการรับประกัน
Outgoing,ขาออก
Outgoing Email Settings,การตั้งค่า อีเมล์ ที่ส่งออก
Outgoing Mail Server,เซิร์ฟเวอร์อีเมลขาออก
Outgoing Mails,ส่งอีเมล์ออก
Outstanding Amount,ยอดคงค้าง
Outstanding for Voucher ,ที่โดดเด่นสำหรับคูปอง
Overhead,เหนือศีรษะ
Overheads,ค่าโสหุ้ย
Overlapping Conditions found between,เงื่อนไขที่ทับซ้อนกันอยู่ระหว่าง
Overview,ภาพรวม
Owned,เจ้าของ
Owner,เจ้าของ
PAN Number,จำนวน PAN
PF No.,หมายเลข PF
PF Number,จำนวน PF
PI/2011/,PI/2011 /
PIN,PIN
PL or BS,PL หรือ BS
PO,PO
PO Date,PO วันที่
PO No,PO ไม่มี
POP3 Mail Server,เซิร์ฟเวอร์จดหมาย POP3
POP3 Mail Settings,การตั้งค่า POP3 จดหมาย
POP3 mail server (e.g. pop.gmail.com),เซิร์ฟเวอร์อีเมล POP3 (เช่น pop.gmail.com)
POP3 server e.g. (pop.gmail.com),POP3 เซิร์ฟเวอร์เช่น (pop.gmail.com)
POS Setting,การตั้งค่า POS
POS View,ดู POS
PR Detail,รายละเอียดประชาสัมพันธ์
PR Posting Date,พีอาร์ โพสต์ วันที่
PRO,PRO
PS,PS
Package Item Details,รายละเอียดแพคเกจสินค้า
Package Items,รายการแพคเกจ
Package Weight Details,รายละเอียดแพคเกจน้ำหนัก
Packed Item,จัดส่งสินค้าบรรจุหมายเหตุ
Packing Details,บรรจุรายละเอียด
Packing Detials,detials บรรจุ
Packing List,รายการบรรจุ
Packing Slip,สลิป
Packing Slip Item,บรรจุรายการสลิป
Packing Slip Items,บรรจุรายการสลิป
Packing Slip(s) Cancelled,สลิปการบรรจุ (s) ยกเลิก
Page Break,แบ่งหน้า
Page Name,ชื่อเพจ
Paid,ต้องจ่าย
Paid Amount,จำนวนเงินที่ชำระ
Parameter,พารามิเตอร์
Parent Account,บัญชีผู้ปกครอง
Parent Cost Center,ศูนย์ต้นทุนผู้ปกครอง
Parent Customer Group,กลุ่มลูกค้าผู้ปกครอง
Parent Detail docname,docname รายละเอียดผู้ปกครอง
Parent Item,รายการหลัก
Parent Item Group,กลุ่มสินค้าหลัก
Parent Sales Person,ผู้ปกครองคนขาย
Parent Territory,ดินแดนปกครอง
Parenttype,Parenttype
Partially Billed,ในจำนวน บางส่วน
Partially Completed,เสร็จบางส่วน
Partially Delivered,ส่ง บางส่วน
Partly Billed,จำนวนมากที่สุดเป็นส่วนใหญ่
Partly Delivered,ส่งบางส่วน
Partner Target Detail,รายละเอียดเป้าหมายพันธมิตร
Partner Type,ประเภทคู่
Partner's Website,เว็บไซต์ของหุ้นส่วน
Passive,ไม่โต้ตอบ
Passport Number,หมายเลขหนังสือเดินทาง
Password,รหัสผ่าน
Pay To / Recd From,จ่ายให้ Recd / จาก
Payables,เจ้าหนี้
Payables Group,กลุ่มเจ้าหนี้
Payment Days,วันชำระเงิน
Payment Due Date,วันที่ครบกำหนด ชำระเงิน
Payment Entries,คอมเมนต์การชำระเงิน
"Payment Entry has been modified after you pulled it. 
			Please pull it again.",
Payment Period Based On Invoice Date,ระยะเวลา ในการชำระเงิน ตาม ใบแจ้งหนี้ ใน วันที่
Payment Reconciliation,สอบการชำระเงิน
Payment Type,ประเภท การชำระเงิน
Payment of salary for the month: ,
Payment to Invoice Matching Tool,วิธีการชำระเงินไปที่เครื่องมือการจับคู่ใบแจ้งหนี้
Payment to Invoice Matching Tool Detail,รายละเอียดการชำระเงินเพื่อการจับคู่เครื่องมือใบแจ้งหนี้
Payments,วิธีการชำระเงิน
Payments Made,การชำระเงิน
Payments Received,วิธีการชำระเงินที่ได้รับ
Payments made during the digest period,เงินที่ต้องจ่ายในช่วงระยะเวลาย่อย
Payments received during the digest period,วิธีการชำระเงินที่ได้รับในช่วงระยะเวลาย่อย
Payroll Settings,การตั้งค่า บัญชีเงินเดือน
Payroll Setup,การติดตั้งเงินเดือน
Pending,คาราคาซัง
Pending Amount,จำนวนเงินที่ รอดำเนินการ
Pending Review,รอตรวจทาน
Pending SO Items For Purchase Request,รายการที่รอดำเนินการเพื่อให้ใบขอซื้อ
Percent Complete,ร้อยละสมบูรณ์
Percentage Allocation,การจัดสรรร้อยละ
Percentage Allocation should be equal to ,การจัดสรรร้อยละควรจะเท่ากับ
