DocType: Accounting Period,Period Name,Tên kỳ
,Minutes to First Response for Issues,Các phút tới phản hồi đầu tiên cho kết quả
DocType: Purchase Invoice,Terms and Conditions1,Điều khoản và Conditions1
apps/erpnext/erpnext/public/js/setup_wizard.js +109,The name of the institute for which you are setting up this system.,Tên của tổ chức  mà bạn đang thiết lập hệ thống này.
DocType: Accounts Settings,"Accounting entry frozen up to this date, nobody can do / modify entry except role specified below.","Bút toán hạch toán đã đóng băng đến ngày này, không ai có thể làm / sửa đổi nào ngoại trừ người có vai trò xác định dưới đây."
apps/erpnext/erpnext/maintenance/doctype/maintenance_schedule/maintenance_schedule.js +116,Please save the document before generating maintenance schedule,Xin vui lòng lưu các tài liệu trước khi tạo ra lịch trình bảo trì
apps/erpnext/erpnext/manufacturing/doctype/bom_update_tool/bom_update_tool.js +45,Latest price updated in all BOMs,Giá mới nhất được cập nhật trong tất cả các BOMs
apps/erpnext/erpnext/projects/report/project_wise_stock_tracking/project_wise_stock_tracking.py +28,Project Status,Tình trạng dự án
DocType: UOM,Check this to disallow fractions. (for Nos),Kiểm tra này để không cho phép các phần phân đoạn. (Cho Nos)
DocType: Student Admission Program,Naming Series (for Student Applicant),Đặt tên Series (cho sinh viên nộp đơn)
apps/erpnext/erpnext/hr/doctype/retention_bonus/retention_bonus.py +16,Bonus Payment Date cannot be a past date,Ngày thanh toán thưởng không thể là ngày qua
DocType: Travel Request,Copy of Invitation/Announcement,Bản sao Lời mời / Thông báo
DocType: Practitioner Service Unit Schedule,Practitioner Service Unit Schedule,Đơn vị dịch vụ học viên
DocType: Delivery Note,Transporter Name,Tên người vận chuyển
DocType: Authorization Rule,Authorized Value,Giá trị được ủy quyền
DocType: BOM,Show Operations,Hiện Operations
,Minutes to First Response for Opportunity,Các phút tới phản hồi đầu tiên cho cơ hội
apps/erpnext/erpnext/hr/report/monthly_attendance_sheet/monthly_attendance_sheet.py +97,Total Absent,Tổng số Vắng
apps/erpnext/erpnext/stock/doctype/stock_entry/stock_entry.py +1060,Item or Warehouse for row {0} does not match Material Request,Mục hoặc Kho cho hàng {0} không phù hợp với liệu Yêu cầu
apps/erpnext/erpnext/config/stock.py +194,Unit of Measure,Đơn vị đo
DocType: Fiscal Year,Year End Date,Ngày kết thúc năm
DocType: Task Depends On,Task Depends On,Nhiệm vụ Phụ thuộc vào
apps/erpnext/erpnext/buying/doctype/request_for_quotation/request_for_quotation.js +1076,Opportunity,Cơ hội
DocType: Operation,Default Workstation,Mặc định Workstation
DocType: Notification Control,Expense Claim Approved Message,Thông báo yêu cầu bồi thường chi phí được chấp thuận
DocType: Payment Entry,Deductions or Loss,Các khoản giảm trừ khả năng mất vốn
apps/erpnext/erpnext/accounts/doctype/journal_entry/journal_entry.py +279,{0} {1} is closed,{0} {1} đã đóng
DocType: Email Digest,How frequently?,Tần suất ra sao ?
apps/erpnext/erpnext/education/doctype/fee_schedule/fee_schedule.js +56,Total Collected: {0},Tổng Số Được Thu: {0}
DocType: Purchase Receipt,Get Current Stock,Lấy tồn kho hiện tại
DocType: Purchase Invoice,ineligible,không hội đủ điều kiện
apps/erpnext/erpnext/config/manufacturing.py +46,Tree of Bill of Materials,Cây biểu thị hóa đơn nguyên vật liệu
DocType: Student,Joining Date,Ngày tham gia
,Employees working on a holiday,Nhân viên làm việc trên một kỳ nghỉ
,TDS Computation Summary,Tóm tắt tính toán TDS
DocType: Share Balance,Current State,Tình trạng hiện tại
apps/erpnext/erpnext/hr/doctype/employee_attendance_tool/employee_attendance_tool.js +152,Mark Present,Đánh dấu hiện tại
DocType: Share Transfer,From Shareholder,Từ Cổ đông
DocType: Project,% Complete Method,% Phương pháp hoàn chỉnh
apps/erpnext/erpnext/healthcare/setup.py +180,Drug,Thuốc uống
apps/erpnext/erpnext/maintenance/doctype/maintenance_schedule/maintenance_schedule.py +200,Maintenance start date can not be before delivery date for Serial No {0},Bảo trì ngày bắt đầu không thể trước ngày giao hàng cho dãy số {0}
DocType: Job Card,Actual End Date,Ngày kết thúc thực tế
DocType: Cash Flow Mapping,Is Finance Cost Adjustment,Điều chỉnh Chi phí Tài chính
DocType: BOM,Operating Cost (Company Currency),Chi phí điều hành (Công ty ngoại tệ)
DocType: Authorization Rule,Applicable To (Role),Để áp dụng (Role)
apps/erpnext/erpnext/hr/doctype/leave_application/leave_application_dashboard.html +10,Pending Leaves,Lá đang chờ xử lý
DocType: BOM Update Tool,Replace BOM,Thay thế Hội đồng quản trị
apps/erpnext/erpnext/healthcare/doctype/lab_test_template/lab_test_template.py +113,Code {0} already exist,Mã {0} đã tồn tại
DocType: Patient Encounter,Procedures,Thủ tục
apps/erpnext/erpnext/manufacturing/doctype/production_plan/production_plan.py +36,Sales orders are not available for production,Đơn đặt hàng không có sẵn để sản xuất
DocType: Asset Movement,Purpose,Mục đích
DocType: Company,Fixed Asset Depreciation Settings,Thiết lập khấu hao TSCĐ
DocType: Item,Will also apply for variants unless overrridden,Cũng sẽ được áp dụng cho các biến thể trừ phần bị ghi đèn
DocType: Purchase Invoice,Advances,Tạm ứng
DocType: Work Order,Manufacture against Material Request,Sản xuất với Yêu cầu vật liệu
apps/erpnext/erpnext/education/report/course_wise_assessment_report/course_wise_assessment_report.html +17,Assessment Group: ,Nhóm đánh giá:
DocType: Item Reorder,Request for,Yêu cầu đối với
apps/erpnext/erpnext/setup/doctype/authorization_rule/authorization_rule.py +32,Approving User cannot be same as user the rule is Applicable To,Phê duyệt Người dùng không thể được giống như sử dụng các quy tắc là áp dụng để
DocType: Stock Entry Detail,Basic Rate (as per Stock UOM),Tỷ giá cơ bản (trên mỗi đơn vị chuẩn của hàng hóa)
DocType: SMS Log,No of Requested SMS,Số  SMS được yêu cầu
apps/erpnext/erpnext/hr/doctype/salary_slip/salary_slip.py +328,Leave Without Pay does not match with approved Leave Application records,Để lại Nếu không phải trả tiền không phù hợp với hồ sơ Để lại ứng dụng đã được phê duyệt
apps/erpnext/erpnext/setup/page/welcome_to_erpnext/welcome_to_erpnext.html +21,Next Steps,Những bước tiếp theo
DocType: Travel Request,Domestic,Trong nước
apps/erpnext/erpnext/buying/doctype/request_for_quotation/request_for_quotation.js +846,Please supply the specified items at the best possible rates,Vui lòng cung cấp mục cụ thể với mức giá tốt nhất có thể
apps/erpnext/erpnext/hr/doctype/employee_transfer/employee_transfer.py +19,Employee Transfer cannot be submitted before Transfer Date ,Chuyển khoản nhân viên không thể được gửi trước ngày chuyển
DocType: Certification Application,USD,đô la Mỹ
apps/erpnext/erpnext/hotels/doctype/hotel_room_reservation/hotel_room_reservation.js +7,Make Invoice,Làm cho hóa đơn
apps/erpnext/erpnext/accounts/report/accounts_receivable/accounts_receivable.py +104,Remaining Balance,Số dư còn lại
DocType: Selling Settings,Auto close Opportunity after 15 days,Auto Cơ hội gần thi hành sau 15 ngày
apps/erpnext/erpnext/buying/doctype/purchase_order/purchase_order.py +83,Purchase Orders are not allowed for {0} due to a scorecard standing of {1}.,Đơn đặt hàng mua không được cho {0} do bảng điểm của điểm số {1}.
apps/erpnext/erpnext/stock/doctype/item/item.py +516,Barcode {0} is not a valid {1} code,Mã vạch {0} không phải là {1} mã hợp lệ
apps/erpnext/erpnext/accounts/report/consolidated_financial_statement/consolidated_financial_statement.js +25,End Year,cuối Năm
apps/erpnext/erpnext/crm/report/campaign_efficiency/campaign_efficiency.py +23,Quot/Lead %,Báo giá/Tiềm năng %
apps/erpnext/erpnext/crm/report/campaign_efficiency/campaign_efficiency.py +23,Quot/Lead %,Báo giá/Tiềm năng %
apps/erpnext/erpnext/hr/doctype/employee/employee.py +141,Contract End Date must be greater than Date of Joining,Ngày kết thúc hợp đồng phải lớn hơn ngày gia nhập
DocType: Driver,Driver,Người lái xe
DocType: Vital Signs,Nutrition Values,Giá trị dinh dưỡng
DocType: Lab Test Template,Is billable,Có thể thanh toán
DocType: Sales Partner,A third party distributor / dealer / commission agent / affiliate / reseller who sells the companies products for a commission.,Một nhà phân phối của bên thứ ba / đại lý / hoa hồng đại lý / chi nhánh / đại lý bán lẻ chuyên bán các sản phẩm công ty cho hưởng hoa hồng.
apps/erpnext/erpnext/accounts/doctype/journal_entry/journal_entry.py +412,{0} against Purchase Order {1},{0} gắn với đơn mua hàng {1}
DocType: Patient,Patient Demographics,Bệnh nhân Nhân khẩu học
DocType: Task,Actual Start Date (via Time Sheet),Ngày bắt đầu thực tế (thông qua thời gian biểu)
apps/erpnext/erpnext/portal/doctype/homepage/homepage.py +15,This is an example website auto-generated from ERPNext,Đây là một trang web ví dụ tự động tạo ra từ ERPNext
apps/erpnext/erpnext/accounts/report/accounts_payable/accounts_payable.js +55,Ageing Range 1,Phạm vi Ageing 1
DocType: Shopify Settings,Enable Shopify,Bật Shopify
apps/erpnext/erpnext/hr/doctype/expense_claim/expense_claim.py +220,Total advance amount cannot be greater than total claimed amount,Tổng số tiền tạm ứng không được lớn hơn tổng số tiền đã yêu cầu
DocType: Purchase Taxes and Charges Template,"Standard tax template that can be applied to all Purchase Transactions. This template can contain list of tax heads and also other expense heads like ""Shipping"", ""Insurance"", ""Handling"" etc.

#### Note

The tax rate you define here will be the standard tax rate for all **Items**. If there are **Items** that have different rates, they must be added in the **Item Tax** table in the **Item** master.

#### Description of Columns

1. Calculation Type: 
    - This can be on **Net Total** (that is the sum of basic amount).
    - **On Previous Row Total / Amount** (for cumulative taxes or charges). If you select this option, the tax will be applied as a percentage of the previous row (in the tax table) amount or total.
    - **Actual** (as mentioned).
2. Account Head: The Account ledger under which this tax will be booked
3. Cost Center: If the tax / charge is an income (like shipping) or expense it needs to be booked against a Cost Center.
4. Description: Description of the tax (that will be printed in invoices / quotes).
5. Rate: Tax rate.
6. Amount: Tax amount.
7. Total: Cumulative total to this point.
8. Enter Row: If based on ""Previous Row Total"" you can select the row number which will be taken as a base for this calculation (default is the previous row).
9. Consider Tax or Charge for: In this section you can specify if the tax / charge is only for valuation (not a part of total) or only for total (does not add value to the item) or for both.
10. Add or Deduct: Whether you want to add or deduct the tax.","Mẫu thuế tiêu chuẩn có thể được chấp thuận với tất cả các giao dịch mua bán. Mẫu vật này có thể bao gồm danh sách các đầu thuế và cũng có thể là các đầu phí tổn như ""vận chuyển"",,""Bảo hiểm"",""Xử lý"" vv.#### Lưu ý: tỷ giá thuế mà bạn định hình ở đây sẽ là tỷ giá thuế tiêu chuẩn cho tất cả các **mẫu hàng**. Nếu có **các mẫu hàng** có các tỷ giá khác nhau, chúng phải được thêm vào bảng **Thuế mẫu hàng** tại **mẫu hàng** chủ. #### Mô tả của các cột 1. Kiểu tính toán: -Điều này có thể vào  **tổng thuần** (tổng số lượng cơ bản).-** Tại hàng tổng trước đó / Số lượng** (đối với các loại thuế hoặc phân bổ tích lũy)... Nếu bạn chọn phần này, thuế sẽ được chấp thuận như một phần trong phần trăm của cột trước đó (trong bảng thuế) số lượng hoặc tổng. -**Thực tế** (như đã đề cập tới).2. Đầu tài khoản: Tài khoản sổ cái nơi mà loại thuế này sẽ được đặt 3. Trung tâm chi phí: Nếu thuế / sự phân bổ là môt loại thu nhập (giống như vận chuyển) hoặc là chi phí, nó cần được đặt trước với một trung tâm chi phí. 4 Mô tả: Mô tả của loại thuế (sẽ được in vào hóa đơn/ giấy báo giá) 5. Tỷ giá: Tỷ giá thuế. 6 Số lượng: SỐ lượng thuế 7.Tổng: Tổng tích lũy tại điểm này. 8. nhập dòng: Nếu được dựa trên ""Hàng tổng trước đó"" bạn có thể lựa chọn số hàng nơi sẽ được làm nền cho việc tính toán (mặc định là hàng trước đó).9. Loại thuế này có bao gồm trong tỷ giá cơ bản ?: Nếu bạn kiểm tra nó, nghĩa là loại thuế này sẽ không được hiển thị bên dưới bảng mẫu hàng, nhưng sẽ được bao gồm tại tỷ giá cơ bản tại bảng mẫu hàng chính của bạn.. Điều này rất hữu ích bất cứ khi nào bạn muốn đưa ra một loại giá sàn (bao gồm tất cả các loại thuế) đối với khách hàng,"
DocType: Homepage,Homepage,Trang chủ
DocType: Grant Application,Grant Application Details ,Chi tiết Đơn xin Cấp phép
DocType: Employee Separation,Employee Separation,Tách nhân viên
DocType: BOM Item,Original Item,Mục gốc
DocType: Purchase Receipt Item,Recd Quantity,số lượng REcd
apps/erpnext/erpnext/regional/report/eway_bill/eway_bill.py +170,Doc Date,Ngày tài liệu
apps/erpnext/erpnext/education/doctype/program_enrollment/program_enrollment.py +64,Fee Records Created - {0},Hồ sơ Phí Tạo - {0}
DocType: Asset Category Account,Asset Category Account,Loại tài khoản tài sản
apps/erpnext/erpnext/accounts/doctype/sales_invoice/sales_invoice.py +1020,Row #{0} (Payment Table): Amount must be positive,Hàng # {0} (Bảng Thanh toán): Số tiền phải là số dương
apps/erpnext/erpnext/manufacturing/doctype/production_order/production_order.py +137,Cannot produce more Item {0} than Sales Order quantity {1},Không thể sản xuất {0} nhiều hơn số lượng trên đơn đặt hàng {1}
apps/erpnext/erpnext/stock/doctype/item/item.js +440,Select Attribute Values,Chọn Giá trị Thuộc tính
DocType: Purchase Invoice,Reason For Issuing document,Lý do phát hành tài liệu
apps/erpnext/erpnext/accounts/doctype/journal_entry/journal_entry.py +583,Stock Entry {0} is not submitted,Bút toán hàng tồn kho{0} không được đệ trình
DocType: Payment Reconciliation,Bank / Cash Account,Tài khoản ngân hàng /Tiền mặt
apps/erpnext/erpnext/crm/doctype/lead/lead.py +47,Next Contact By cannot be same as the Lead Email Address,"""Liên hệ Tiếp theo bởi "" không thể giống như Địa chỉ Email của tiềm năng"
DocType: Tax Rule,Billing City,Thành phố thanh toán
DocType: Asset,Manual,Hướng dẫn sử dụng
DocType: Salary Component Account,Salary Component Account,Tài khoản phần lương
DocType: Global Defaults,Hide Currency Symbol,Ẩn Ký hiệu tiền tệ
apps/erpnext/erpnext/selling/page/sales_funnel/sales_funnel.js +281,Sales Opportunities by Source,Cơ hội bán hàng theo nguồn
apps/erpnext/erpnext/config/non_profit.py +58,Donor information.,Thông tin về các nhà tài trợ.
apps/erpnext/erpnext/hr/doctype/upload_attendance/upload_attendance.py +89,Please setup numbering series for Attendance via Setup &gt; Numbering Series,Vui lòng thiết lập chuỗi đánh số để tham dự qua Thiết lập&gt; Chuỗi đánh số
apps/erpnext/erpnext/config/accounts.py +368,"e.g. Bank, Cash, Credit Card","ví dụ như Ngân hàng, tiền mặt, thẻ tín dụng"
DocType: Job Applicant,Source Name,Tên nguồn
DocType: Vital Signs,"Normal resting blood pressure in an adult is approximately 120 mmHg systolic, and 80 mmHg diastolic, abbreviated ""120/80 mmHg""","Huyết áp nghỉ ngơi bình thường ở người lớn là khoảng 120 mmHg tâm thu và huyết áp tâm trương 80 mmHg, viết tắt là &quot;120/80 mmHg&quot;"
apps/erpnext/erpnext/stock/doctype/batch/batch.py +124,"Set items shelf life in days, to set expiry based on manufacturing_date plus self life","Đặt thời hạn sử dụng của các mặt hàng trong ngày, để đặt thời hạn sử dụng dựa trên số liệu sản xuất cùng với cuộc sống tự lập"
DocType: Journal Entry,Credit Note,Tín dụng Ghi chú
DocType: Projects Settings,Ignore Employee Time Overlap,Bỏ qua thời gian nhân viên chồng chéo nhau
DocType: Warranty Claim,Service Address,Địa chỉ dịch vụ
DocType: Asset Maintenance Task,Calibration,Hiệu chuẩn
apps/erpnext/erpnext/healthcare/doctype/patient_appointment/patient_appointment.py +182,{0} is a company holiday,{0} là một kỳ nghỉ của công ty
apps/erpnext/erpnext/patches/v11_0/add_default_email_template_for_leave.py +19,Leave Status Notification,Để lại thông báo trạng thái
DocType: Patient Appointment,Procedure Prescription,Thủ tục toa thuốc
apps/erpnext/erpnext/accounts/doctype/account/chart_of_accounts/verified/standard_chart_of_accounts.py +50,Furnitures and Fixtures,Nội thất và Đèn
DocType: Travel Request,Travel Type,Loại du lịch
DocType: Item,Manufacture,Chế tạo
DocType: Blanket Order,MFG-BLR-.YYYY.-,MFG-BLR-.YYYY.-
apps/erpnext/erpnext/utilities/user_progress.py +27,Setup Company,Thiết lập công ty
,Lab Test Report,Báo cáo thử nghiệm Lab
DocType: Employee Benefit Application,Employee Benefit Application,Đơn xin hưởng quyền lợi cho nhân viên
apps/erpnext/erpnext/stock/doctype/packing_slip/packing_slip.js +13,Please Delivery Note first,Hãy chú ý lưu ý đầu tiên
DocType: Student Applicant,Application Date,Ngày nộp hồ sơ
DocType: Salary Component,Amount based on formula,Số tiền dựa trên công thức
DocType: Purchase Invoice,Currency and Price List,Bảng giá và tiền
DocType: Opportunity,Customer / Lead Name,Tên Khách hàng / Tiềm năng
apps/erpnext/erpnext/accounts/doctype/bank_reconciliation/bank_reconciliation.py +115,Clearance Date not mentioned,Ngày chốt sổ không được đề cập
DocType: Payroll Period,Taxable Salary Slabs,Bảng lương chịu thuế
apps/erpnext/erpnext/config/manufacturing.py +7,Production,Sản xuất
DocType: Guardian,Occupation,Nghề Nghiệp
apps/erpnext/erpnext/manufacturing/doctype/work_order/work_order.js +210,For Quantity must be less than quantity {0},Đối với Số lượng phải nhỏ hơn số lượng {0}
apps/erpnext/erpnext/maintenance/doctype/maintenance_schedule/maintenance_schedule.js +74,Row {0}:Start Date must be before End Date,Hàng {0}: Ngày bắt đầu phải trước khi kết thúc ngày
DocType: Salary Component,Max Benefit Amount (Yearly),Số tiền lợi ích tối đa (hàng năm)
apps/erpnext/erpnext/accounts/report/tds_computation_summary/tds_computation_summary.py +118,TDS Rate %,Tỷ lệ TDS%
DocType: Crop,Planting Area,Diện tích trồng trọt
apps/erpnext/erpnext/controllers/trends.py +19,Total(Qty),Tổng số (SL)
DocType: Installation Note Item,Installed Qty,Số lượng cài đặt
apps/erpnext/erpnext/utilities/user_progress.py +31,You added ,Bạn đã thêm
DocType: Purchase Taxes and Charges,Parenttype,Parenttype
apps/erpnext/erpnext/hr/doctype/training_event/training_event.js +10,Training Result,Kết quả đào tạo
DocType: Purchase Invoice,Is Paid,Được thanh toán
DocType: Salary Structure,Total Earning,Tổng số Lợi nhuận
DocType: Purchase Receipt,Time at which materials were received,Thời gian mà các tài liệu đã nhận được
DocType: Products Settings,Products per Page,Sản phẩm trên mỗi trang
DocType: Stock Ledger Entry,Outgoing Rate,Tỷ giá đầu ra
apps/erpnext/erpnext/controllers/accounts_controller.py +362, or ,hoặc
DocType: Sales Order,Billing Status,Tình trạng thanh toán
apps/erpnext/erpnext/public/js/conf.js +32,Report an Issue,Báo lỗi
apps/erpnext/erpnext/accounts/doctype/account/chart_of_accounts/verified/standard_chart_of_accounts.py +127,Utility Expenses,Chi phí tiện ích
apps/erpnext/erpnext/accounts/report/payment_period_based_on_invoice_date/payment_period_based_on_invoice_date.py +64,90-Above,Trên - 90
apps/erpnext/erpnext/accounts/doctype/payment_entry/payment_entry.py +253,Row #{0}: Journal Entry {1} does not have account {2} or already matched against another voucher,Hàng # {0}: Bút toán nhật ký {1} không có tài khoản {2} hoặc đã xuất hiện đối với chứng từ khác
DocType: Supplier Scorecard Criteria,Criteria Weight,Tiêu chí Trọng lượng
apps/erpnext/erpnext/patches/v11_0/add_default_email_template_for_leave.py +7,Leave Approval Notification,Để lại thông báo phê duyệt
DocType: Buying Settings,Default Buying Price List,Bảng giá mua hàng mặc định
DocType: Payroll Entry,Salary Slip Based on Timesheet,Phiếu lương Dựa trên bảng thời gian
apps/erpnext/erpnext/stock/report/item_price_stock/item_price_stock.py +55,Buying Rate,Tỷ lệ mua
apps/erpnext/erpnext/controllers/buying_controller.py +590,Row {0}: Enter location for the asset item {1},Hàng {0}: Nhập vị trí cho mục nội dung {1}
DocType: Request for Quotation,PUR-RFQ-.YYYY.-,PUR-RFQ-.YYYY.-
DocType: Company,About the Company,Về công ty
DocType: Notification Control,Sales Order Message,Thông báo đơn đặt hàng
apps/erpnext/erpnext/config/setup.py +15,"Set Default Values like Company, Currency, Current Fiscal Year, etc.","Thiết lập giá trị mặc định như Công ty, tiền tệ, năm tài chính hiện tại, vv"
DocType: Payment Entry,Payment Type,Loại thanh toán
apps/erpnext/erpnext/stock/doctype/batch/batch.py +245,Please select a Batch for Item {0}. Unable to find a single batch that fulfills this requirement,Vui lòng chọn một lô hàng {0}. Không thể tìm thấy lô hàng nào đáp ứng yêu cầu này
apps/erpnext/erpnext/stock/doctype/batch/batch.py +245,Please select a Batch for Item {0}. Unable to find a single batch that fulfills this requirement,Vui lòng chọn một  lô hàng  {0}. Không thể tìm thấy lô hàng nào đáp ứng yêu cầu này
DocType: Asset Maintenance Log,ACC-AML-.YYYY.-,ACC-AML-.YYYY.-
DocType: Payroll Entry,Select Employees,Chọn nhân viên
DocType: Shopify Settings,Sales Invoice Series,Chuỗi hóa đơn bán hàng
DocType: Opportunity,Potential Sales Deal,Sales tiềm năng Deal
DocType: Complaint,Complaints,Khiếu nại
DocType: Employee Tax Exemption Declaration,Employee Tax Exemption Declaration,Tuyên bố miễn thuế nhân viên
DocType: Payment Entry,Cheque/Reference Date,Séc / Ngày tham chiếu
DocType: Purchase Invoice,Total Taxes and Charges,Tổng số thuế và phí
apps/erpnext/erpnext/assets/doctype/asset/asset.py +89,Available-for-use Date is entered as past date,Ngày có sẵn để sử dụng được nhập như ngày trước
DocType: Employee,Emergency Contact,Liên hệ Trường hợp Khẩn cấp
DocType: Bank Reconciliation Detail,Payment Entry,Bút toán thanh toán
,sales-browser,bán hàng trình duyệt
apps/erpnext/erpnext/accounts/doctype/account/account.js +78,Ledger,Sổ cái
DocType: Drug Prescription,Drug Code,Mã thuốc
DocType: Target Detail,Target  Amount,Mục tiêu Số tiền
DocType: POS Profile,Print Format for Online,Định dạng In cho Trực tuyến
DocType: Shopping Cart Settings,Shopping Cart Settings,Cài đặt giỏ hàng mua sắm
DocType: Journal Entry,Accounting Entries,Các bút toán hạch toán
apps/erpnext/erpnext/accounts/doctype/pricing_rule/pricing_rule.js +17,"If selected Pricing Rule is made for 'Rate', it will overwrite Price List. Pricing Rule rate is the final rate, so no further discount should be applied. Hence, in transactions like Sales Order, Purchase Order etc, it will be fetched in 'Rate' field, rather than 'Price List Rate' field.","Nếu chọn Quy tắc Đặt giá cho &#39;Tỷ lệ&#39;, nó sẽ ghi đè lên Bảng giá. Định mức giá là tỷ lệ cuối cùng, vì vậy không nên giảm giá thêm nữa. Do đó, trong các giao dịch như Đơn đặt hàng Bán hàng, Đặt hàng mua hàng vv, nó sẽ được tìm nạp trong trường &#39;Giá&#39;, chứ không phải là trường &#39;Bảng giá Giá&#39;."
DocType: Journal Entry,Paid Loan,Trả tiền vay
apps/erpnext/erpnext/setup/doctype/authorization_rule/authorization_rule.py +24,Duplicate Entry. Please check Authorization Rule {0},HIện bút toán trùng lặp. Vui lòng kiểm tra Quy định ủy quyền {0}
DocType: Journal Entry Account,Reference Due Date,Ngày hết hạn tham chiếu
DocType: Purchase Order,Ref SQ,Tài liệu tham khảo SQ
DocType: Leave Type,Applicable After (Working Days),Áp dụng sau (ngày làm việc)
apps/erpnext/erpnext/stock/doctype/landed_cost_voucher/landed_cost_voucher.py +55,Receipt document must be submitted,tài liệu nhận phải nộp
DocType: Purchase Invoice Item,Received Qty,số lượng nhận được
DocType: Stock Entry Detail,Serial No / Batch,Không nối tiếp / hàng loạt
