DocType: Accounting Period,Period Name,Tên kỳ
apps/erpnext/erpnext/selling/doctype/sales_order/sales_order.py +867,Please select Qty against item {0},Vui lòng chọn Số lượng đối với mặt hàng {0}
apps/erpnext/erpnext/stock/doctype/serial_no/serial_no.py +33,New Serial No cannot have Warehouse. Warehouse must be set by Stock Entry or Purchase Receipt,Dãy số mới không thể có  kho hàng. Kho hàng phải đượcthiết lập bởi Bút toán kho dự trữ  hoặc biên lai mua hàng
DocType: Lead,Lead Type,Loại Tiềm năng
apps/erpnext/erpnext/hr/doctype/leave_application/leave_application.py +183,You are not authorized to approve leaves on Block Dates,Bạn không được uỷ quyền phê duyệt nghỉ trên Các khối kỳ hạn
apps/erpnext/erpnext/stock/doctype/delivery_note/delivery_note.py +405,All these items have already been invoiced,Tất cả các mặt hàng này đã được lập hoá đơn
apps/erpnext/erpnext/accounts/doctype/purchase_invoice/purchase_invoice.js +1017,Set New Release Date,Đặt ngày phát hành mới
DocType: Company,Monthly Sales Target,Mục tiêu bán hàng hàng tháng
apps/erpnext/erpnext/setup/doctype/authorization_control/authorization_control.py +37,Can be approved by {0},Có thể được duyệt bởi {0}
DocType: Hotel Room,Hotel Room Type,Loại phòng khách sạn
apps/erpnext/erpnext/accounts/doctype/pricing_rule/pricing_rule.js +181,Supplier &gt; Supplier Type,Nhà cung cấp&gt; Loại nhà cung cấp
DocType: Leave Allocation,Leave Period,Rời khỏi Khoảng thời gian
DocType: Item,Default Material Request Type,Mặc định liệu yêu cầu Loại
DocType: Supplier Scorecard,Evaluation Period,Thời gian thẩm định
apps/erpnext/erpnext/buying/doctype/supplier_scorecard/supplier_scorecard_list.js +13,Unknown,không xác định
apps/erpnext/erpnext/selling/doctype/sales_order/sales_order.js +1029,Work Order not created,Đơn hàng công việc chưa tạo
apps/erpnext/erpnext/hr/doctype/employee_benefit_application/employee_benefit_application.py +36,"An amount of {0} already claimed for the component {1},\
						 set the amount equal or greater than {2}","Một số tiền {0} đã được xác nhận quyền sở hữu cho thành phần {1}, \ đặt số tiền bằng hoặc lớn hơn {2}"
DocType: Shipping Rule,Shipping Rule Conditions,Các điều kiện cho quy tắc vận  chuyển
DocType: Purchase Invoice,Export Type,Loại xuất khẩu
DocType: Salary Slip Loan,Salary Slip Loan,Khoản Vay Lương
DocType: BOM Update Tool,The new BOM after replacement,BOM mới sau khi thay thế
,Point of Sale,Điểm bán hàng
DocType: Payment Entry,Received Amount,Số tiền nhận được
DocType: Patient,Widow,Người đàn bà góa
DocType: GST Settings,GSTIN Email Sent On,GSTIN Gửi Email
DocType: Program Enrollment,Pick/Drop by Guardian,Chọn/Thả bởi giám hộ
DocType: Bank Account,SWIFT number,Số SWIFT
DocType: Payment Entry,Party Name,Tên Đối tác
DocType: Employee Benefit Application,Benefits Applied,Lợi ích áp dụng
DocType: Crop,Planting UOM,Trồng UOM
DocType: Account,Tax,Thuế
apps/erpnext/erpnext/education/report/student_batch_wise_attendance/student_batch_wise_attendance.py +45,Not Marked,không đánh dấu
DocType: Contract,Signed,Đã ký
apps/erpnext/erpnext/accounts/doctype/opening_invoice_creation_tool/opening_invoice_creation_tool_dashboard.html +1,Opening Invoices Summary,Mở Tóm lược Hóa đơn
DocType: Member,NPO-MEM-.YYYY.-,NPO-MEM-.YYYY.-
DocType: Education Settings,Education Manager,Quản lý Giáo dục
DocType: Crop Cycle,The minimum length between each plant in the field for optimum growth,Chiều dài tối thiểu giữa mỗi nhà máy trong cánh đồng để tăng trưởng tối ưu
apps/erpnext/erpnext/stock/doctype/stock_reconciliation/stock_reconciliation.py +153,"Batched Item {0} cannot be updated using Stock Reconciliation, instead use Stock Entry","Vật tư theo đợt {0} không thể được cập nhật bằng cách sử dụng Bảng điều hòa hàng kho , thay vào đó sử dụng bút toàn hàng kho"
apps/erpnext/erpnext/stock/doctype/stock_reconciliation/stock_reconciliation.py +153,"Batched Item {0} cannot be updated using Stock Reconciliation, instead use Stock Entry","Vật tự theo đợt {0} không thể được cập nhật bằng cách sử dụng bảng điều hòa kho,  khoán, thay vào đó sử dụng bút toán hàng kho"
DocType: Quality Inspection,Report Date,Báo cáo ngày
DocType: Student,Middle Name,Tên đệm
DocType: BOM,Routing,Routing
DocType: Serial No,Asset Details,Chi tiết nội dung
DocType: Bank Statement Transaction Payment Item,Invoices,Hoá đơn
DocType: Water Analysis,Type of Sample,Loại mẫu
DocType: Batch,Source Document Name,Tên tài liệu nguồn
DocType: Batch,Source Document Name,Tên tài liệu nguồn
DocType: Production Plan,Get Raw Materials For Production,Lấy nguyên liệu thô để sản xuất
DocType: Job Opening,Job Title,Chức vụ
apps/erpnext/erpnext/buying/doctype/supplier_quotation/supplier_quotation.py +89,"{0} indicates that {1} will not provide a quotation, but all items \
					have been quoted. Updating the RFQ quote status.","{0} cho biết rằng {1} sẽ không cung cấp báo giá, nhưng tất cả các mục \ đã được trích dẫn. Đang cập nhật trạng thái báo giá RFQ."
apps/erpnext/erpnext/stock/doctype/stock_entry/stock_entry.py +1290,Maximum Samples - {0} have already been retained for Batch {1} and Item {2} in Batch {3}.,Các mẫu tối đa - {0} đã được giữ lại cho Batch {1} và Item {2} trong Batch {3}.
DocType: Manufacturing Settings,Update BOM Cost Automatically,Cập nhật Tự động
DocType: Lab Test,Test Name,Tên thử nghiệm
DocType: Healthcare Settings,Clinical Procedure Consumable Item,Thủ tục lâm sàng
apps/erpnext/erpnext/utilities/activation.py +99,Create Users,tạo người dùng
apps/erpnext/erpnext/utilities/user_progress.py +147,Gram,Gram
apps/erpnext/erpnext/selling/doctype/customer/customer_dashboard.py +30,Subscriptions,Đăng ký
DocType: Supplier Scorecard,Per Month,Mỗi tháng
DocType: Education Settings,Make Academic Term Mandatory,Bắt buộc từ học thuật
apps/erpnext/erpnext/manufacturing/doctype/production_order/production_order.py +414,Quantity to Manufacture must be greater than 0.,Số lượng để sản xuất phải lớn hơn 0.
DocType: Asset Settings,Calculate Prorated Depreciation Schedule Based on Fiscal Year,Tính bảng khấu hao theo tỷ lệ phần trăm dựa trên năm tài chính
apps/erpnext/erpnext/config/maintenance.py +17,Visit report for maintenance call.,Thăm báo cáo cho các cuộc gọi bảo trì.
DocType: Stock Entry,Update Rate and Availability,Cập nhật tỷ giá và hiệu lực
DocType: Stock Settings,Percentage you are allowed to receive or deliver more against the quantity ordered. For example: If you have ordered 100 units. and your Allowance is 10% then you are allowed to receive 110 units.,Tỷ lệ phần trăm bạn được phép nhận hoặc cung cấp nhiều so với số lượng đặt hàng. Ví dụ: Nếu bạn đã đặt mua 100 đơn vị. và Trợ cấp của bạn là 10% sau đó bạn được phép nhận 110 đơn vị.
DocType: Loyalty Program,Customer Group,Nhóm khách hàng
apps/erpnext/erpnext/stock/doctype/stock_entry/stock_entry.py +296,Row #{0}: Operation {1} is not completed for {2} qty of finished goods in Work Order # {3}. Please update operation status via Time Logs,Hàng # {0}: Hoạt động {1} không hoàn thành cho {2} số lượng hàng hoá thành phẩm trong Đơn hàng công việc # {3}. Vui lòng cập nhật trạng thái hoạt động qua Bản ghi Thời gian
apps/erpnext/erpnext/stock/doctype/batch/batch.js +128,New Batch ID (Optional),ID hàng loạt mới (Tùy chọn)
apps/erpnext/erpnext/stock/doctype/batch/batch.js +128,New Batch ID (Optional),ID hàng loạt mới (Tùy chọn)
apps/erpnext/erpnext/accounts/doctype/purchase_invoice/purchase_invoice.py +231,Expense account is mandatory for item {0},Tài khoản chi phí là bắt buộc đối với mục {0}
DocType: BOM,Website Description,Mô tả Website
apps/erpnext/erpnext/accounts/report/cash_flow/cash_flow.py +101,Net Change in Equity,Chênh lệch giá tịnh trong vốn sở hữu
apps/erpnext/erpnext/assets/doctype/asset/asset.py +291,Please cancel Purchase Invoice {0} first,Hãy hủy hóa đơn mua hàng {0} đầu tiên
apps/erpnext/erpnext/healthcare/doctype/healthcare_service_unit_type/healthcare_service_unit_type.py +25,Not permitted. Please disable the Service Unit Type,Không được phép. Vui lòng tắt Loại Đơn vị Dịch vụ
apps/erpnext/erpnext/hr/doctype/job_applicant/job_applicant.py +43,"Email Address must be unique, already exists for {0}","Địa chỉ email phải là duy nhất, đã tồn tại cho {0}"
DocType: Serial No,AMC Expiry Date,Ngày hết hạn hợp đồng bảo hành (AMC)
DocType: Asset,Receipt,Phiếu nhận
,Sales Register,Đăng ký bán hàng
DocType: Daily Work Summary Group,Send Emails At,Gửi email Tại
DocType: Quotation,Quotation Lost Reason,lý do bảng báo giá mất
apps/erpnext/erpnext/accounts/doctype/payment_entry/payment_entry.py +383,Transaction reference no {0} dated {1},tham chiếu giao dịch không có {0} ngày {1}
apps/erpnext/erpnext/setup/doctype/supplier_group/supplier_group.js +5,There is nothing to edit.,Không có gì phải chỉnh sửa.
apps/erpnext/erpnext/selling/page/point_of_sale/point_of_sale.js +542,Form View,Xem Mẫu
DocType: HR Settings,Expense Approver Mandatory In Expense Claim,Chi phí phê duyệt bắt buộc trong yêu cầu chi tiêu
apps/erpnext/erpnext/setup/doctype/email_digest/email_digest.py +124,Summary for this month and pending activities,Tóm tắt cho tháng này và các hoạt động cấp phát
apps/erpnext/erpnext/accounts/doctype/exchange_rate_revaluation/exchange_rate_revaluation.py +91,Please set Unrealized Exchange Gain/Loss Account in Company {0},Vui lòng đặt Tài khoản Lãi / lỗ chưa thực hiện trong Công ty {0}
apps/erpnext/erpnext/utilities/user_progress.py +248,"Add users to your organization, other than yourself.","Thêm người dùng vào tổ chức của bạn, ngoài chính bạn."
DocType: Customer Group,Customer Group Name,Tên Nhóm khách hàng
apps/erpnext/erpnext/public/js/pos/pos.html +109,No Customers yet!,Chưa có Khách!
DocType: Healthcare Service Unit,Healthcare Service Unit,Đơn vị dịch vụ chăm sóc sức khỏe
apps/erpnext/erpnext/public/js/financial_statements.js +58,Cash Flow Statement,Báo cáo lưu chuyển tiền mặt
apps/erpnext/erpnext/manufacturing/doctype/production_plan/production_plan.py +467,No material request created,Không có yêu cầu vật liệu được tạo
apps/erpnext/erpnext/hr/doctype/employee_loan_application/employee_loan_application.py +23,Loan Amount cannot exceed Maximum Loan Amount of {0},Số tiền cho vay không thể vượt quá Số tiền cho vay tối đa của {0}
apps/erpnext/erpnext/hr/report/vehicle_expenses/vehicle_expenses.py +22,License,bằng
apps/erpnext/erpnext/accounts/doctype/sales_invoice/sales_invoice.py +563,Please remove this Invoice {0} from C-Form {1},Hãy loại bỏ hóa đơn này {0} từ C-Form {1}
DocType: Leave Control Panel,Please select Carry Forward if you also want to include previous fiscal year's balance leaves to this fiscal year,Vui lòng chọn Carry Forward nếu bạn cũng muốn bao gồm cân bằng tài chính của năm trước để lại cho năm tài chính này
DocType: GL Entry,Against Voucher Type,Loại chống lại Voucher
DocType: Healthcare Practitioner,Phone (R),Điện thoại (R)
apps/erpnext/erpnext/healthcare/doctype/practitioner_schedule/practitioner_schedule.js +104,Time slots added,Đã thêm khe thời gian
DocType: Item,Attributes,Thuộc tính
apps/erpnext/erpnext/healthcare/doctype/clinical_procedure_template/clinical_procedure_template.js +36,Enable Template,Bật Mẫu
apps/erpnext/erpnext/accounts/doctype/purchase_invoice/purchase_invoice.py +256,Please enter Write Off Account,Vui lòng nhập Viết Tắt tài khoản
apps/erpnext/erpnext/selling/report/inactive_customers/inactive_customers.py +71,Last Order Date,Kỳ hạn đặt cuối cùng
DocType: Salary Component,Is Payable,Có thể trả
DocType: Inpatient Record,B Negative,B Phủ định
apps/erpnext/erpnext/assets/doctype/asset_maintenance_log/asset_maintenance_log.py +25,Maintenance Status has to be Cancelled or Completed to Submit,Trạng thái Bảo trì phải được Hủy hoặc Hoàn thành để Gửi
DocType: Amazon MWS Settings,US,Mỹ
DocType: Holiday List,Add Weekly Holidays,Thêm ngày lễ hàng tuần
DocType: Staffing Plan Detail,Vacancies,Tuyển dụng
DocType: Hotel Room,Hotel Room,Phòng khách sạn
apps/erpnext/erpnext/accounts/doctype/budget/budget.py +57,Account {0} does not belongs to company {1},Tài khoản {0} không thuộc về công ty {1}
DocType: Leave Type,Rounding,Làm tròn
apps/erpnext/erpnext/accounts/doctype/sales_invoice/sales_invoice.py +990,Serial Numbers in row {0} does not match with Delivery Note,Số sê-ri trong hàng {0} không khớp với Lưu lượng giao hàng
DocType: Employee Benefit Application,Dispensed Amount (Pro-rated),Số tiền được phân phối (Được xếp hạng theo tỷ lệ)
apps/erpnext/erpnext/accounts/doctype/pricing_rule/pricing_rule.js +36,"Then Pricing Rules are filtered out based on Customer, Customer Group, Territory, Supplier, Supplier Group, Campaign, Sales Partner etc.","Sau đó, Quy tắc đặt giá được lọc ra dựa trên Khách hàng, Nhóm khách hàng, Lãnh thổ, Nhà cung cấp, Nhóm nhà cung cấp, Chiến dịch, Đối tác bán hàng, v.v."
DocType: Student,Guardian Details,Chi tiết người giám hộ
DocType: C-Form,C-Form,C-Form
DocType: Agriculture Task,Start Day,Ngày bắt đầu
DocType: Vehicle,Chassis No,chassis Không
DocType: Payment Request,Initiated,Được khởi xướng
DocType: Production Plan Item,Planned Start Date,Ngày bắt đầu lên kế hoạch
apps/erpnext/erpnext/manufacturing/doctype/bom/bom.py +644,Please select a BOM,Vui lòng chọn một BOM
DocType: Purchase Invoice,Availed ITC Integrated Tax,Thuế tích hợp ITC đã sử dụng
DocType: Purchase Order Item,Blanket Order Rate,Tỷ lệ đặt hàng chăn
apps/erpnext/erpnext/hooks.py +157,Certification,Chứng nhận
DocType: Bank Guarantee,Clauses and Conditions,Điều khoản và điều kiện
DocType: Serial No,Creation Document Type,Loại tài liệu sáng tạo
DocType: Project Task,View Timesheet,Xem tờ báo
DocType: Amazon MWS Settings,ES,ES
apps/erpnext/erpnext/accounts/doctype/exchange_rate_revaluation/exchange_rate_revaluation.js +24,Make Journal Entry,Hãy Journal nhập
DocType: Leave Allocation,New Leaves Allocated,Những sự cho phép mới được phân bổ
apps/erpnext/erpnext/controllers/trends.py +269,Project-wise data is not available for Quotation,Dữ liệu chuyên-dự án không có sẵn cho báo giá
apps/erpnext/erpnext/education/doctype/student_admission/templates/student_admission.html +30,End on,Kết thúc vào
DocType: Project,Expected End Date,Ngày Dự kiến kết thúc
DocType: Budget Account,Budget Amount,Số tiền ngân sách
DocType: Donor,Donor Name,Tên nhà tài trợ
DocType: Journal Entry,Inter Company Journal Entry Reference,Tham chiếu mục nhật ký liên công ty
DocType: Appraisal Template,Appraisal Template Title,Thẩm định Mẫu Tiêu đề
apps/erpnext/erpnext/utilities/user_progress_utils.py +29,Commercial,Thương mại
DocType: Patient,Alcohol Current Use,Sử dụng rượu
DocType: Employee Tax Exemption Proof Submission,House Rent Payment Amount,Số tiền thanh toán tiền thuê nhà
DocType: Student Admission Program,Student Admission Program,Chương trình nhập học cho sinh viên
DocType: Employee Tax Exemption Sub Category,Tax Exemption Category,Danh mục miễn thuế
DocType: Payment Entry,Account Paid To,Tài khoản Thụ hưởng
DocType: Subscription Settings,Grace Period,Thời gian ân hạn
DocType: Item Alternative,Alternative Item Name,Tên hạng mục thay thế
apps/erpnext/erpnext/selling/doctype/product_bundle/product_bundle.py +24,Parent Item {0} must not be a Stock Item,Mẫu gốc {0} không thể là mẫu tồn kho
apps/erpnext/erpnext/setup/setup_wizard/operations/install_fixtures.py +187,Website Listing,Danh sách trang web
apps/erpnext/erpnext/config/selling.py +57,All Products or Services.,Tất cả sản phẩm hoặc dịch vụ.
DocType: Email Digest,Open Quotations,Báo giá mở
DocType: Expense Claim,More Details,Xem chi tiết
DocType: Supplier Quotation,Supplier Address,Địa chỉ nhà cung cấp
apps/erpnext/erpnext/accounts/doctype/budget/budget.py +168,{0} Budget for Account {1} against {2} {3} is {4}. It will exceed by {5},{0} Ngân sách cho tài khoản {1} đối với {2} {3} là {4}. Nó sẽ vượt qua {5}
apps/erpnext/erpnext/stock/report/batch_wise_balance_history/batch_wise_balance_history.py +37,Out Qty,Số lượng ra
apps/erpnext/erpnext/buying/doctype/supplier/supplier.py +49,Series is mandatory,Series là bắt buộc
apps/erpnext/erpnext/setup/setup_wizard/data/industry_type.py +28,Financial Services,Dịch vụ tài chính
DocType: Student Sibling,Student ID,thẻ học sinh
apps/erpnext/erpnext/manufacturing/doctype/work_order/work_order.js +214,For Quantity must be greater than zero,Đối với Số lượng phải lớn hơn 0
apps/erpnext/erpnext/config/projects.py +51,Types of activities for Time Logs,Các loại hoạt động Thời gian Logs
DocType: Opening Invoice Creation Tool,Sales,Bán hàng
DocType: Stock Entry Detail,Basic Amount,Số tiền cơ bản
DocType: Training Event,Exam,Thi
apps/erpnext/erpnext/public/js/hub/hub_call.js +46,Marketplace Error,Lỗi thị trường
DocType: Complaint,Complaint,Lời phàn nàn
apps/erpnext/erpnext/accounts/doctype/sales_invoice/sales_invoice.py +534,Warehouse required for stock Item {0},phải có kho cho vật tư {0}
DocType: Leave Allocation,Unused leaves,Quyền nghỉ phép chưa sử dụng
apps/erpnext/erpnext/hr/doctype/loan/loan.js +83,Make Repayment Entry,Thực hiện mục trả nợ
apps/erpnext/erpnext/patches/v11_0/update_department_lft_rgt.py +8,All Departments,Tất cả bộ ngành
DocType: Healthcare Service Unit,Vacant,Trống
DocType: Patient,Alcohol Past Use,Uống rượu quá khứ
DocType: Fertilizer Content,Fertilizer Content,Nội dung Phân bón
apps/erpnext/erpnext/accounts/doctype/journal_entry/journal_entry.js +248,Cr,Cr
DocType: Project Update,Problematic/Stuck,Có vấn đề / Stuck
DocType: Tax Rule,Billing State,Bang thanh toán
DocType: Share Transfer,Transfer,Truyền
apps/erpnext/erpnext/selling/doctype/sales_order/sales_order.py +262,Work Order {0} must be cancelled before cancelling this Sales Order,Đơn hàng công việc {0} phải được hủy bỏ trước khi hủy Lệnh bán hàng này
apps/erpnext/erpnext/stock/doctype/material_request/material_request.js +995,Fetch exploded BOM (including sub-assemblies),Lấy BOM nổ (bao gồm các cụm chi tiết)
DocType: Authorization Rule,Applicable To (Employee),Để áp dụng (nhân viên)
apps/erpnext/erpnext/controllers/accounts_controller.py +170,Due Date is mandatory,Ngày đến hạn là bắt buộc
apps/erpnext/erpnext/controllers/item_variant.py +82,Increment for Attribute {0} cannot be 0,Tăng cho thuộc tính  {0} không thể là 0
DocType: Employee Benefit Claim,Benefit Type and Amount,Loại lợi ích và số tiền
apps/erpnext/erpnext/hotels/report/hotel_room_occupancy/hotel_room_occupancy.py +19,Rooms Booked,Phòng Đặt Phòng
apps/erpnext/erpnext/crm/doctype/lead/lead.py +57,Ends On date cannot be before Next Contact Date.,Kết thúc Vào ngày không được trước ngày liên hệ tiếp theo.
DocType: Journal Entry,Pay To / Recd From,Để trả / Recd Từ
DocType: Naming Series,Setup Series,Thiết lập Dòng
DocType: Payment Reconciliation,To Invoice Date,Tới ngày lập hóa đơn
DocType: Bank Account,Contact HTML,HTML Liên hệ
DocType: Support Settings,Support Portal,Cổng hỗ trợ
apps/erpnext/erpnext/healthcare/doctype/healthcare_settings/healthcare_settings.py +19,Registration fee can not be Zero,Phí đăng ký không được là Zero
DocType: Disease,Treatment Period,Thời gian điều trị
DocType: Travel Itinerary,Travel Itinerary,Hành trình du lịch
apps/erpnext/erpnext/education/api.py +336,Result already Submitted,Kết quả Đã gửi
apps/erpnext/erpnext/controllers/buying_controller.py +197,Reserved Warehouse is mandatory for Item {0} in Raw Materials supplied,Kho dự trữ là bắt buộc đối với Khoản {0} trong Nguyên liệu được cung cấp
,Inactive Customers,Khách hàng không được kích hoạt
DocType: Student Admission Program,Maximum Age,Tuổi tối đa
apps/erpnext/erpnext/regional/doctype/gst_settings/gst_settings.py +28,Please wait 3 days before resending the reminder.,Vui lòng chờ 3 ngày trước khi gửi lại lời nhắc.
DocType: Landed Cost Voucher,Purchase Receipts,Hóa đơn mua hàng
apps/erpnext/erpnext/accounts/doctype/pricing_rule/pricing_rule.js +29,How Pricing Rule is applied?,Làm thế nào giá Quy tắc được áp dụng?
DocType: Stock Entry,Delivery Note No,Số phiếu giao hàng
DocType: Cheque Print Template,Message to show,Tin nhắn để hiển thị
apps/erpnext/erpnext/public/js/setup_wizard.js +28,Retail,Lĩnh vực bán lẻ
DocType: Student Attendance,Absent,Vắng mặt
DocType: Staffing Plan,Staffing Plan Detail,Chi tiết kế hoạch nhân sự
DocType: Employee Promotion,Promotion Date,Ngày khuyến mãi
apps/erpnext/erpnext/accounts/doctype/purchase_invoice/purchase_invoice.js +615,Product Bundle,Sản phẩm lô
apps/erpnext/erpnext/buying/doctype/supplier_scorecard/supplier_scorecard.py +38,Unable to find score starting at {0}. You need to have standing scores covering 0 to 100,Không thể tìm thấy điểm số bắt đầu từ {0}. Bạn cần phải có điểm đứng bao gồm 0 đến 100
apps/erpnext/erpnext/accounts/doctype/journal_entry/journal_entry.py +244,Row {0}: Invalid reference {1},Hàng {0}: tham chiếu không hợp lệ {1}
apps/erpnext/erpnext/assets/doctype/location/location_tree.js +23,New Location,Vị trí mới
DocType: Purchase Taxes and Charges Template,Purchase Taxes and Charges Template,Mua Thuế và mẫu phí
DocType: Subscription,Current Invoice Start Date,Ngày bắt đầu hóa đơn hiện tại
DocType: Timesheet,TS-,TS-
apps/erpnext/erpnext/accounts/doctype/gl_entry/gl_entry.py +61,{0} {1}: Either debit or credit amount is required for {2},{0} {1}: Cả khoản nợ lẫn số tín dụng đều là yêu cầu bắt buộc với {2}
DocType: GL Entry,Remarks,Ghi chú
DocType: Hotel Room Amenity,Hotel Room Amenity,Tiện nghi phòng khách sạn
DocType: Budget,Action if Annual Budget Exceeded on MR,Hành động nếu ngân sách hàng năm vượt quá MR
DocType: Payment Entry,Account Paid From,Tài khoản Trích nợ
DocType: Purchase Order Item Supplied,Raw Material Item Code,Mã nguyên liệu thô của mặt hàng
DocType: Task,Parent Task,Công việc của Phụ Huynh
DocType: Journal Entry,Write Off Based On,Viết Tắt Dựa trên
apps/erpnext/erpnext/utilities/activation.py +65,Make Lead,Tạo đầu mối kinh doanh
apps/erpnext/erpnext/accounts/doctype/account/chart_of_accounts/verified/standard_chart_of_accounts.py +119,Print and Stationery,In và Văn phòng phẩm
DocType: Stock Settings,Show Barcode Field,Hiện Dòng mã vạch
apps/erpnext/erpnext/buying/doctype/request_for_quotation/request_for_quotation.js +859,Send Supplier Emails,Gửi email Nhà cung cấp
apps/erpnext/erpnext/hr/doctype/leave_application/leave_application.py +165,"Salary already processed for period between {0} and {1}, Leave application period cannot be between this date range.","Mức lương đã được xử lý cho giai đoạn giữa {0} và {1}, Giai đoạn bỏ ứng dụng không thể giữa khoảng kỳ hạn này"
DocType: Fiscal Year,Auto Created,Tự động tạo
apps/erpnext/erpnext/hr/doctype/employee_onboarding/employee_onboarding.py +19,Submit this to create the Employee record,Gửi thông tin này để tạo hồ sơ Nhân viên
DocType: Item Default,Item Default,Mục mặc định
DocType: Chapter Member,Leave Reason,Để lại lý do
apps/erpnext/erpnext/accounts/doctype/subscription/subscription.py +197,Invoice {0} no longer exists,Hoá đơn {0} không còn tồn tại
DocType: Guardian Interest,Guardian Interest,người giám hộ lãi
DocType: Volunteer,Availability,khả dụng
apps/erpnext/erpnext/config/accounts.py +357,Setup default values for POS Invoices,Thiết lập các giá trị mặc định cho các hoá đơn POS
apps/erpnext/erpnext/config/hr.py +248,Training,Đào tạo
DocType: Project,Time to send,Thời gian gửi
DocType: Timesheet,Employee Detail,Nhân viên chi tiết
apps/erpnext/erpnext/healthcare/doctype/clinical_procedure/clinical_procedure.py +19,Set warehouse for Procedure {0} ,Đặt kho cho thủ tục {0}
apps/erpnext/erpnext/education/report/student_and_guardian_contact_details/student_and_guardian_contact_details.py +58,Guardian1 Email ID,ID Email Guardian1
apps/erpnext/erpnext/education/report/student_and_guardian_contact_details/student_and_guardian_contact_details.py +58,Guardian1 Email ID,ID Email Guardian1
DocType: Lab Prescription,Test Code,Mã kiểm tra
apps/erpnext/erpnext/config/website.py +11,Settings for website homepage,Cài đặt cho trang chủ của trang web
