DocType: Accounting Period,Period Name,Tên kỳ
apps/erpnext/erpnext/selling/report/sales_person_commission_summary/sales_person_commission_summary.py +81,Commission Rate %,Tỷ lệ hoa hồng%
DocType: Work Order,Qty To Manufacture,Số lượng Để sản xuất
DocType: Email Digest,New Income,thu nhập mới
DocType: Buying Settings,Maintain same rate throughout purchase cycle,Duy trì tỷ giá giống nhau suốt chu kỳ mua bán
DocType: Opportunity Item,Opportunity Item,Hạng mục cơ hội
,Student and Guardian Contact Details,Sinh viên và người giám hộ Chi tiết liên lạc
apps/erpnext/erpnext/accounts/doctype/account/account.js +51,Merge Account,Hợp nhất tài khoản
apps/erpnext/erpnext/buying/doctype/request_for_quotation/request_for_quotation.py +53,Row {0}: For supplier {0} Email Address is required to send email,Hàng  {0}: Đối với nhà cung cấp {0} Địa chỉ email được yêu cầu để gửi email
apps/erpnext/erpnext/accounts/doctype/account/chart_of_accounts/verified/standard_chart_of_accounts.py +76,Temporary Opening,Mở cửa tạm thời
,Employee Leave Balance,Để lại cân nhân viên
apps/erpnext/erpnext/accounts/doctype/gl_entry/gl_entry.py +148,Balance for Account {0} must always be {1},Số dư cho Tài khoản {0} luôn luôn phải {1}
DocType: Patient Appointment,More Info,Xem thông tin
apps/erpnext/erpnext/stock/doctype/stock_reconciliation/stock_reconciliation.py +181,Valuation Rate required for Item in row {0},Đinh giá phải có cho mục ở hàng {0}
DocType: Supplier Scorecard,Scorecard Actions,Hành động Thẻ điểm
apps/erpnext/erpnext/utilities/user_progress.py +169,Example: Masters in Computer Science,Ví dụ: Thạc sĩ Khoa học Máy tính
apps/erpnext/erpnext/buying/doctype/supplier_quotation/supplier_quotation.py +67,Supplier {0} not found in {1},Nhà cung cấp {0} không được tìm thấy trong {1}
DocType: Purchase Invoice,Rejected Warehouse,Kho chứa hàng mua bị từ chối
DocType: GL Entry,Against Voucher,Chống lại Voucher
DocType: Item Default,Default Buying Cost Center,Bộ phận Chi phí mua hàng mặc định
apps/erpnext/erpnext/setup/page/welcome_to_erpnext/welcome_to_erpnext.html +6,"To get the best out of ERPNext, we recommend that you take some time and watch these help videos.","Để dùng ERPNext một cách hiệu quả nhất, chúng tôi khuyên bạn nên bỏ chút thời gian xem những đoạn video này"
apps/erpnext/erpnext/stock/doctype/material_request/material_request.js +1033,For Default Supplier (optional),Đối với Nhà cung cấp mặc định (tùy chọn)
DocType: Supplier Quotation Item,Lead Time in days,Thời gian Tiềm năng theo ngày
apps/erpnext/erpnext/accounts/report/accounts_payable/accounts_payable.js +82,Accounts Payable Summary,Sơ lược các tài khoản phải trả
apps/erpnext/erpnext/accounts/doctype/gl_entry/gl_entry.py +214,Not authorized to edit frozen Account {0},Không được phép chỉnh sửa tài khoản đóng băng {0}
DocType: Journal Entry,Get Outstanding Invoices,Được nổi bật Hoá đơn
apps/erpnext/erpnext/manufacturing/doctype/production_order/production_order.py +84,Sales Order {0} is not valid,Đơn đặt hàng {0} không hợp lệ
DocType: Supplier Scorecard,Warn for new Request for Quotations,Cảnh báo cho Yêu cầu Báo giá Mới
apps/erpnext/erpnext/utilities/activation.py +91,Purchase orders help you plan and follow up on your purchases,đơn đặt hàng giúp bạn lập kế hoạch và theo dõi mua hàng của bạn
apps/erpnext/erpnext/healthcare/doctype/lab_test/lab_test.js +146,Lab Test Prescriptions,Lab Test Prescriptions
apps/erpnext/erpnext/stock/doctype/material_request/material_request.py +164,"The total Issue / Transfer quantity {0} in Material Request {1}  \
							cannot be greater than requested quantity {2} for Item {3}",Tổng khối lượng phát hành / Chuyển {0} trong Chất liệu Yêu cầu {1} \ không thể nhiều hơn số lượng yêu cầu {2} cho mục {3}
apps/erpnext/erpnext/setup/setup_wizard/operations/install_fixtures.py +172,Small,Nhỏ
DocType: Shopify Settings,"If Shopify not contains a customer in Order, then while syncing Orders, the system will consider default customer for order","Nếu Shopify không chứa khách hàng trong Đơn đặt hàng, sau đó trong khi đồng bộ hóa Đơn đặt hàng, hệ thống sẽ xem xét khách hàng mặc định cho đơn đặt hàng"
DocType: Opening Invoice Creation Tool Item,Opening Invoice Creation Tool Item,Mở công cụ tạo mục lục hóa đơn
DocType: Cashier Closing Payments,Cashier Closing Payments,Thủ quỹ đóng khoản thanh toán
DocType: Education Settings,Employee Number,Số nhân viên
DocType: Subscription Settings,Cancel Invoice After Grace Period,Hủy hóa đơn sau thời gian gia hạn
apps/erpnext/erpnext/stock/doctype/packing_slip/packing_slip.py +67,Case No(s) already in use. Try from Case No {0},Không trường hợp (s) đã được sử dụng. Cố gắng từ Trường hợp thứ {0}
DocType: Project,% Completed,% Hoàn thành
,Invoiced Amount (Exculsive Tax),Số tiền ghi trên hóa đơn (thuế độc quyền )
apps/erpnext/erpnext/stock/report/bom_search/bom_search.js +14,Item 2,Khoản 2
DocType: QuickBooks Migrator,Authorization Endpoint,Điểm cuối ủy quyền
DocType: Travel Request,International,Quốc tế
DocType: Training Event,Training Event,Sự kiện Đào tạo
DocType: Item,Auto re-order,Auto lại trật tự
apps/erpnext/erpnext/selling/report/sales_person_target_variance_item_group_wise/sales_person_target_variance_item_group_wise.py +59,Total Achieved,Tổng số đã đạt được
DocType: Employee,Place of Issue,Nơi cấp
DocType: Contract,Contract,hợp đồng
DocType: Plant Analysis,Laboratory Testing Datetime,Thử nghiệm phòng thí nghiệm Datetime
DocType: Email Digest,Add Quote,Thêm Quote
apps/erpnext/erpnext/stock/doctype/stock_entry/stock_entry.py +1242,UOM coversion factor required for UOM: {0} in Item: {1},Yếu tố cần thiết cho coversion UOM UOM: {0} trong Item: {1}
apps/erpnext/erpnext/accounts/doctype/account/chart_of_accounts/verified/standard_chart_of_accounts.py +99,Indirect Expenses,Chi phí gián tiếp
apps/erpnext/erpnext/stock/doctype/stock_entry/stock_entry.py +128,Row {0}: Qty is mandatory,Hàng {0}: Số lượng là bắt buộc
DocType: Agriculture Analysis Criteria,Agriculture,Nông nghiệp
apps/erpnext/erpnext/manufacturing/doctype/blanket_order/blanket_order.js +15,Create Sales Order,Tạo Đơn đặt hàng
apps/erpnext/erpnext/accounts/doctype/purchase_invoice/purchase_invoice.py +516,Accounting Entry for Asset,Nhập kế toán cho tài sản
apps/erpnext/erpnext/accounts/doctype/purchase_invoice/purchase_invoice.js +871,Block Invoice,Chặn hóa đơn
apps/erpnext/erpnext/manufacturing/report/bom_stock_calculated/bom_stock_calculated.js +16,Quantity to Make,Số lượng cần làm
apps/erpnext/erpnext/accounts/page/pos/pos.js +801,Sync Master Data,Dữ liệu Sync Thạc sĩ
DocType: Asset Repair,Repair Cost,chi phí sửa chữa
apps/erpnext/erpnext/utilities/user_progress.py +138,Your Products or Services,Sản phẩm hoặc dịch vụ của bạn
apps/erpnext/erpnext/setup/setup_wizard/setup_wizard.py +15,Failed to login,Đăng nhập thất bại
apps/erpnext/erpnext/controllers/buying_controller.py +617,Asset {0} created,Đã tạo nội dung {0}
DocType: Special Test Items,Special Test Items,Các bài kiểm tra đặc biệt
apps/erpnext/erpnext/public/js/hub/marketplace.js +102,You need to be a user with System Manager and Item Manager roles to register on Marketplace.,Bạn cần phải là người dùng có vai trò Quản lý hệ thống và Trình quản lý mặt hàng để đăng ký trên Marketplace.
DocType: Bank Statement Transaction Payment Item,Mode of Payment,Hình thức thanh toán
apps/erpnext/erpnext/hr/doctype/employee_benefit_application/employee_benefit_application.py +25,As per your assigned Salary Structure you cannot apply for benefits,"Theo Cơ cấu tiền lương được chỉ định của bạn, bạn không thể nộp đơn xin trợ cấp"
apps/erpnext/erpnext/stock/doctype/item/item.py +218,Website Image should be a public file or website URL,Hình ảnh website phải là một tập tin công cộng hoặc URL của trang web
DocType: Purchase Invoice Item,BOM,BOM
apps/erpnext/erpnext/setup/doctype/item_group/item_group.js +71,This is a root item group and cannot be edited.,Đây là một nhóm mục gốc và không thể được chỉnh sửa.
apps/erpnext/erpnext/accounts/doctype/account/account.js +133,Merge,Hợp nhất
DocType: Journal Entry Account,Purchase Order,Mua hàng
DocType: Vehicle,Fuel UOM,nhiên liệu Đơn vị đo lường
DocType: Warehouse,Warehouse Contact Info,Kho Thông tin Liên hệ
DocType: Payment Entry,Write Off Difference Amount,Viết Tắt Chênh lệch Số tiền
DocType: Volunteer,Volunteer Name,Tên tình nguyện viên
apps/erpnext/erpnext/controllers/accounts_controller.py +777,Rows with duplicate due dates in other rows were found: {0},Hàng có ngày hoàn thành trùng lặp trong các hàng khác đã được tìm thấy: {0}
apps/erpnext/erpnext/hr/doctype/salary_slip/salary_slip.py +535,"{0}: Employee email not found, hence email not sent",{0}: không tìm thấy email của nhân viên. do đó không gửi được email
apps/erpnext/erpnext/hr/doctype/leave_encashment/leave_encashment.py +55,No Salary Structure assigned for Employee {0} on given date {1},Không có cấu trúc lương nào được giao cho nhân viên {0} vào ngày cụ thể {1}
apps/erpnext/erpnext/accounts/doctype/shipping_rule/shipping_rule.py +85,Shipping rule not applicable for country {0},Quy tắc gửi hàng không áp dụng cho quốc gia {0}
DocType: Item,Foreign Trade Details,Chi tiết Ngoại thương
,Assessment Plan Status,Kế hoạch Đánh giá Tình trạng
DocType: Email Digest,Annual Income,Thu nhập hàng năm
DocType: Serial No,Serial No Details,Không có chi tiết nối tiếp
DocType: Purchase Invoice Item,Item Tax Rate,Tỷ giá thuế mẫu hàng
apps/erpnext/erpnext/regional/report/eway_bill/eway_bill.py +176,From Party Name,Từ Tên Bên
DocType: Student Group Student,Group Roll Number,Số cuộn nhóm
DocType: Student Group Student,Group Roll Number,Số cuộn nhóm
apps/erpnext/erpnext/accounts/doctype/journal_entry/journal_entry.py +177,"For {0}, only credit accounts can be linked against another debit entry","Đối với {0}, tài khoản tín dụng chỉ có thể được liên kết chống lại mục nợ khác"
apps/erpnext/erpnext/accounts/doctype/sales_invoice/sales_invoice.py +660,Delivery Note {0} is not submitted,Phiếu giao hàng {0} không được ghi
apps/erpnext/erpnext/stock/get_item_details.py +167,Item {0} must be a Sub-contracted Item,Mục {0} phải là một mục phụ ký hợp đồng
apps/erpnext/erpnext/accounts/doctype/account/chart_of_accounts/verified/standard_chart_of_accounts.py +44,Capital Equipments,Thiết bị vốn
apps/erpnext/erpnext/accounts/doctype/pricing_rule/pricing_rule.js +33,"Pricing Rule is first selected based on 'Apply On' field, which can be Item, Item Group or Brand.","Luật giá được lựa chọn đầu tiên dựa vào trường ""áp dụng vào"", có thể trở thành mẫu hàng, nhóm mẫu hàng, hoặc nhãn hiệu."
apps/erpnext/erpnext/manufacturing/doctype/work_order/work_order.js +372,Please set the Item Code first,Vui lòng đặt mã mục đầu tiên
apps/erpnext/erpnext/regional/report/eway_bill/eway_bill.py +157,Doc Type,Loại doc
apps/erpnext/erpnext/controllers/selling_controller.py +132,Total allocated percentage for sales team should be 100,Tổng tỷ lệ phần trăm phân bổ cho đội ngũ bán hàng nên được 100
DocType: Subscription Plan,Billing Interval Count,Số lượng khoảng thời gian thanh toán
apps/erpnext/erpnext/healthcare/doctype/healthcare_practitioner/healthcare_practitioner_dashboard.py +10,Appointments and Patient Encounters,Các cuộc hẹn và cuộc gặp gỡ bệnh nhân
apps/erpnext/erpnext/hr/doctype/employee_promotion/employee_promotion.js +135,Value missing,Thiếu giá trị
DocType: Employee,Department and Grade,Sở và lớp
DocType: Sales Invoice Item,Edit Description,Chỉnh sửa Mô tả
DocType: Antibiotic,Antibiotic,Kháng sinh
,Team Updates,Cập nhật nhóm
apps/erpnext/erpnext/accounts/doctype/payment_order/payment_order.js +39,For Supplier,Cho Nhà cung cấp
DocType: Account,Setting Account Type helps in selecting this Account in transactions.,Loại Cài đặt Tài khoản giúp trong việc lựa chọn tài khoản này trong các giao dịch.
DocType: Purchase Invoice,Grand Total (Company Currency),Tổng cộng (Tiền tệ công ty)
apps/erpnext/erpnext/accounts/doctype/cheque_print_template/cheque_print_template.js +9,Create Print Format,Tạo Format In
apps/erpnext/erpnext/education/doctype/fee_schedule/fee_schedule_list.js +5,Fee Created,Phí tạo
apps/erpnext/erpnext/utilities/bot.py +39,Did not find any item called {0},Không tìm thấy mục nào có tên là {0}
apps/erpnext/erpnext/stock/report/item_prices/item_prices.js +8,Items Filter,Bộ lọc mục
DocType: Supplier Scorecard Criteria,Criteria Formula,Tiêu chuẩn Công thức
apps/erpnext/erpnext/stock/report/itemwise_recommended_reorder_level/itemwise_recommended_reorder_level.py +42,Total Outgoing,Tổng số đầu ra
apps/erpnext/erpnext/accounts/doctype/shipping_rule/shipping_rule.py +39,"There can only be one Shipping Rule Condition with 0 or blank value for ""To Value""","Chỉ có thể có một vận chuyển Quy tắc Điều kiện với 0 hoặc giá trị trống cho ""Để giá trị gia tăng"""
DocType: Bank Statement Transaction Settings Item,Transaction,cô lập Giao dịch
DocType: Patient Appointment,Duration,Thời lượng
apps/erpnext/erpnext/controllers/status_updater.py +160,"For an item {0}, quantity must be positive number","Đối với một mặt hàng {0}, số lượng phải là số dương"
apps/erpnext/erpnext/accounts/doctype/cost_center/cost_center.js +76,Note: This Cost Center is a Group. Cannot make accounting entries against groups.,Lưu ý: Trung tâm chi phí này là 1 nhóm. Không thể tạo ra bút toán kế toán với các nhóm này
apps/erpnext/erpnext/hr/doctype/compensatory_leave_request/compensatory_leave_request.py +44,Compensatory leave request days not in valid holidays,Ngày yêu cầu nghỉ phép không có ngày nghỉ hợp lệ
apps/erpnext/erpnext/stock/doctype/warehouse/warehouse.py +54,Child warehouse exists for this warehouse. You can not delete this warehouse.,kho con tồn tại cho nhà kho này. Bạn không thể xóa nhà kho này.
DocType: Item,Website Item Groups,Các Nhóm mục website
DocType: Purchase Invoice,Total (Company Currency),Tổng số (Tiền công ty )
DocType: Daily Work Summary Group,Reminder,Nhắc nhở
apps/erpnext/erpnext/regional/report/eway_bill/eway_bill.py +304,Accessable Value,Giá trị có thể truy cập
apps/erpnext/erpnext/stock/utils.py +231,Serial number {0} entered more than once,Nối tiếp số {0} vào nhiều hơn một lần
DocType: Bank Statement Transaction Invoice Item,Journal Entry,Bút toán nhật ký
apps/erpnext/erpnext/regional/report/eway_bill/eway_bill.py +183,From GSTIN,Từ GSTIN
DocType: Expense Claim Advance,Unclaimed amount,Số tiền chưa được xác nhận
apps/erpnext/erpnext/manufacturing/doctype/work_order/work_order.js +269,{0} items in progress,{0} mục trong tiến trình
DocType: Workstation,Workstation Name,Tên máy trạm
DocType: Grading Scale Interval,Grade Code,Mã lớp
DocType: POS Item Group,POS Item Group,Nhóm POS
apps/erpnext/erpnext/setup/doctype/email_digest/email_digest.js +17,Email Digest:,Email Digest:
apps/erpnext/erpnext/stock/doctype/item_alternative/item_alternative.py +23,Alternative item must not be same as item code,Mục thay thế không được giống với mã mục
apps/erpnext/erpnext/manufacturing/doctype/bom/bom.py +639,BOM {0} does not belong to Item {1},BOM {0} không thuộc mục {1}
DocType: Sales Partner,Target Distribution,phân bổ mục tiêu
DocType: Purchase Invoice,06-Finalization of Provisional assessment,06-Tổng kết Đánh giá tạm thời
DocType: Salary Slip,Bank Account No.,Tài khoản ngân hàng số
DocType: Naming Series,This is the number of the last created transaction with this prefix,Đây là số lượng các giao dịch tạo ra cuối cùng với tiền tố này
DocType: Supplier Scorecard,"Scorecard variables can be used, as well as:
{total_score} (the total score from that period),
{period_number} (the number of periods to present day)
","Các biến số thẻ điểm có thể được sử dụng, cũng như: {total_score} (tổng số điểm từ thời kỳ đó), {period_number} (số khoảng thời gian đến ngày nay)"
apps/erpnext/erpnext/public/js/setup_wizard.js +254,Collapse All,Thu gọn tất cả
apps/erpnext/erpnext/manufacturing/doctype/blanket_order/blanket_order.js +27,Create Purchase Order,Tạo đơn đặt hàng
DocType: Quality Inspection Reading,Reading 8,Đọc 8
DocType: Inpatient Record,Discharge Note,Lưu ý xả
DocType: Purchase Invoice,Taxes and Charges Calculation,tính toán Thuế và Phí
DocType: Accounts Settings,Book Asset Depreciation Entry Automatically,sách khấu hao tài sản cho bút toán tự động
DocType: Accounts Settings,Book Asset Depreciation Entry Automatically,Sách khấu hao tài sản cho bút toán tự động
DocType: BOM Operation,Workstation,Trạm làm việc
DocType: Request for Quotation Supplier,Request for Quotation Supplier,Yêu cầu báo giá Nhà cung cấp
DocType: Healthcare Settings,Registration Message,Thông báo Đăng ký
apps/erpnext/erpnext/setup/setup_wizard/operations/install_fixtures.py +143,Hardware,Phần cứng
DocType: Prescription Dosage,Prescription Dosage,Liều kê đơn
DocType: Contract,HR Manager,Trưởng phòng Nhân sự
apps/erpnext/erpnext/accounts/party.py +196,Please select a Company,Hãy lựa chọn một công ty
apps/erpnext/erpnext/setup/setup_wizard/operations/install_fixtures.py +95,Privilege Leave,Để lại đặc quyền
DocType: Purchase Invoice,Supplier Invoice Date,Nhà cung cấp hóa đơn ngày
DocType: Asset Settings,This value is used for pro-rata temporis calculation,Giá trị này được sử dụng để tính tỷ lệ pro-rata temporis
apps/erpnext/erpnext/shopping_cart/doctype/shopping_cart_settings/shopping_cart_settings.py +91,You need to enable Shopping Cart,Bạn cần phải kích hoạt  mô đun Giỏ hàng
DocType: Payment Entry,Writeoff,Xóa sổ
DocType: Maintenance Visit,MAT-MVS-.YYYY.-,MAT-MVS-.YYYY.-
DocType: Stock Settings,Naming Series Prefix,Đặt tên Tiền tố Dòng
DocType: Appraisal Template Goal,Appraisal Template Goal,Thẩm định mẫu Mục tiêu
DocType: Salary Component,Earning,Thu nhập
DocType: Supplier Scorecard,Scoring Criteria,Tiêu chí chấm điểm
DocType: Purchase Invoice,Party Account Currency,Tài khoản tiền tệ của đối tác
,BOM Browser,Trình duyệt BOM
apps/erpnext/erpnext/templates/emails/training_event.html +13,Please update your status for this training event,Vui lòng cập nhật trạng thái của bạn cho sự kiện đào tạo này
DocType: Item Barcode,EAN,EAN
DocType: Purchase Taxes and Charges,Add or Deduct,Thêm hoặc Khấu trừ
apps/erpnext/erpnext/accounts/doctype/shipping_rule/shipping_rule.py +148,Overlapping conditions found between:,Điều kiện chồng chéo tìm thấy giữa:
apps/erpnext/erpnext/accounts/doctype/gl_entry/gl_entry.py +188,Against Journal Entry {0} is already adjusted against some other voucher,Chống Journal nhập {0} đã được điều chỉnh đối với một số chứng từ khác
apps/erpnext/erpnext/selling/report/inactive_customers/inactive_customers.py +68,Total Order Value,Tổng giá trị theo thứ tự
apps/erpnext/erpnext/demo/setup/setup_data.py +341,Food,Thực phẩm
apps/erpnext/erpnext/accounts/report/accounts_payable/accounts_payable.js +69,Ageing Range 3,Phạm vi Ageing 3
DocType: POS Closing Voucher Details,POS Closing Voucher Details,Chi tiết phiếu thưởng đóng POS
DocType: Shopify Log,Shopify Log,Nhật ký Shopify
DocType: Inpatient Occupancy,Check In,Đăng ký vào
DocType: Maintenance Schedule Item,No of Visits,Số lần thăm
apps/erpnext/erpnext/maintenance/doctype/maintenance_schedule/maintenance_schedule.py +165,Maintenance Schedule {0} exists against {1},Lịch bảo trì {0} tồn tại với {0}
apps/erpnext/erpnext/education/doctype/student_applicant/student_applicant.js +36,Enrolling student,sinh viên ghi danh
apps/erpnext/erpnext/accounts/doctype/period_closing_voucher/period_closing_voucher.py +33,Currency of the Closing Account must be {0},Đồng tiền của tài khoản bế phải là {0}
apps/erpnext/erpnext/hr/doctype/appraisal_template/appraisal_template.py +21,Sum of points for all goals should be 100. It is {0},Sum điểm cho tất cả các mục tiêu phải 100. Nó là {0}
DocType: Project,Start and End Dates,Ngày bắt đầu và kết thúc
DocType: Contract Template Fulfilment Terms,Contract Template Fulfilment Terms,Điều khoản tuân thủ mẫu hợp đồng
,Delivered Items To Be Billed,Chỉ tiêu giao được lập hoá đơn
apps/erpnext/erpnext/manufacturing/doctype/bom/bom_item_preview.html +16,Open BOM {0},Mở BOM {0}
apps/erpnext/erpnext/stock/doctype/serial_no/serial_no.py +64,Warehouse cannot be changed for Serial No.,Không thể đổi kho cho Số seri
DocType: Authorization Rule,Average Discount,Giảm giá trung bình
DocType: Project Update,Great/Quickly,Tuyệt vời / Nhanh chóng
DocType: Purchase Invoice Item,UOM,Đơn vị đo lường
DocType: Employee Tax Exemption Declaration,Annual HRA Exemption,Miễn phí HRA hàng năm
DocType: Rename Tool,Utilities,Tiện ích
DocType: POS Profile,Accounting,Kế toán
DocType: Asset,Purchase Receipt Amount,Số tiền nhận hàng
DocType: Employee Separation,Exit Interview Summary,Thoát Tóm tắt phỏng vấn
apps/erpnext/erpnext/public/js/utils/serial_no_batch_selector.js +140,Please select batches for batched item ,Vui lòng chọn lô cho mục hàng loạt
DocType: Asset,Depreciation Schedules,Lịch khấu hao
apps/erpnext/erpnext/erpnext_integrations/doctype/shopify_settings/shopify_settings.py +37,"Support for public app is deprecated. Please setup private app, for more details refer user manual",Hỗ trợ cho ứng dụng công khai không còn được dùng nữa. Vui lòng thiết lập ứng dụng riêng tư để biết thêm chi tiết tham khảo hướng dẫn sử dụng
apps/erpnext/erpnext/regional/report/gstr_1/gstr_1.py +202,Following accounts might be selected in GST Settings:,Các tài khoản sau có thể được chọn trong Cài đặt GST:
apps/erpnext/erpnext/hr/doctype/leave_application/leave_application.py +104,Application period cannot be outside leave allocation period,Kỳ ứng dụng không thể có thời gian phân bổ nghỉ bên ngoài
DocType: Activity Cost,Projects,Dự án
DocType: Payment Request,Transaction Currency,giao dịch tiền tệ
apps/erpnext/erpnext/controllers/buying_controller.py +33,From {0} | {1} {2},Từ {0} | {1} {2}
apps/erpnext/erpnext/public/js/hub/marketplace.js +164,Some emails are invalid,Một số email không hợp lệ
DocType: Work Order Operation,Operation Description,Mô tả hoạt động
apps/erpnext/erpnext/accounts/doctype/fiscal_year/fiscal_year.py +34,Cannot change Fiscal Year Start Date and Fiscal Year End Date once the Fiscal Year is saved.,Không thể thay đổi ngày bắt đầu năm tài chính  và ngày kết thúc năm tài chính khi năm tài chính đã được lưu.
DocType: Quotation,Shopping Cart,Giỏ hàng
apps/erpnext/erpnext/stock/report/itemwise_recommended_reorder_level/itemwise_recommended_reorder_level.py +42,Avg Daily Outgoing,Avg Daily Outgoing
DocType: POS Profile,Campaign,Chiến dịch
DocType: Supplier,Name and Type,Tên và Loại
apps/erpnext/erpnext/hr/doctype/expense_claim/expense_claim.py +64,Approval Status must be 'Approved' or 'Rejected',"Tình trạng phê duyệt phải được ""chấp thuận"" hoặc ""từ chối"""
DocType: Healthcare Practitioner,Contacts and Address,Địa chỉ liên hệ và Địa chỉ
DocType: Salary Structure,Max Benefits (Amount),Lợi ích tối đa (Số tiền)
DocType: Purchase Invoice,Contact Person,Người Liên hệ
apps/erpnext/erpnext/projects/doctype/task/task.py +38,'Expected Start Date' can not be greater than 'Expected End Date','Ngày Bắt đầu Dự kiến' không a  thể sau 'Ngày Kết thúc Dự kiến'
apps/erpnext/erpnext/selling/page/sales_funnel/sales_funnel.js +107,No data for this period,Không có dữ liệu cho giai đoạn này
DocType: Course Scheduling Tool,Course End Date,Khóa học Ngày kết thúc
DocType: Holiday List,Holidays,Ngày lễ
DocType: Sales Order Item,Planned Quantity,Số lượng dự kiến
DocType: Purchase Invoice Item,Item Tax Amount,lượng thuế mẫu hàng
DocType: Water Analysis,Water Analysis Criteria,Tiêu chí phân tích nước
DocType: Item,Maintain Stock,Duy trì hàng tồn kho
DocType: Employee,Prefered Email,Email  đề xuất
DocType: Student Admission,Eligibility and Details,Tính hợp lệ và chi tiết
apps/erpnext/erpnext/accounts/report/cash_flow/cash_flow.py +92,Net Change in Fixed Asset,Chênh lệch giá tịnh  trong Tài sản cố định
apps/erpnext/erpnext/manufacturing/report/bom_stock_calculated/bom_stock_calculated.py +38,Reqd Qty,Reqd Qty
